	start	end	text
458	00:27:41	00:27:43	Yeah, professionally.
459	00:27:43	00:27:45	My profession, not hers.
460	00:27:45	00:27:48	I cut her some slack a while back.
461	00:27:48	00:27:50	She’s bad news, but she’s a babe.
462	00:27:50	00:27:51	Tell me about it.
463	00:27:51	00:27:55	Yeah, between you and me, I should have busted her, but I thought I might get lucky.
464	00:27:55	00:27:57	Yeah.
465	00:27:57	00:28:00	Well, next time she gets in a jam, she throws my name out.
466	00:28:00	00:28:02	My boss--not pleased.
467	00:28:02	00:28:03	So...
468	00:28:05	00:28:07	Tell me what you think.
469	00:28:07	00:28:13	I want you to write down your own statement, seal it up in this envelope, and I’ll hand-deliver it to the D.A.
470	00:28:13	00:28:15	It’ll be good for both of us.
471	00:28:15	00:28:17	Yeah. Thanks, man.
472	00:28:17	00:28:18	No problem.
473	00:28:18	00:28:20	Us guys have got to stick together, right?
474	00:28:20	00:28:22	That’s right. Yeah. That’s right.
475	00:28:43	00:28:46	Of course I graduated high school.
476	00:28:46	00:28:50	Hey, if this is gonna take forever, I could lay a urine sample on you too, gratis.
477	00:28:50	00:28:52	A writing sample would be sufficient, thank you.
478	00:28:52	00:28:56	What’s that gonna tell you-- whether I was writing under the influence?
479	00:28:56	00:28:58	Do yourself a favor.
480	00:28:58	00:29:00	Yes, ma’am.
481	00:29:00	00:29:02	Now, what is it that you want me to write?
482	00:29:02	00:29:04	I’ve got a kite.
483	00:29:04	00:29:06	Can you see the women?
484	00:29:06	00:29:07	Kill the lights.
485	00:29:07	00:29:08	That’s what you want me to write?
486	00:29:08	00:29:10	Three times.
487	00:29:17	00:29:21	Caucasian female with only a high school education and left-handed.
488	00:29:27	00:29:29	You can keep the pen as a souvenir.
489	00:29:33	00:29:35	I’ll be right back.
490	00:29:35	00:29:37	Hey, come on! You’re making me late.
491	00:29:37	00:29:39	Hey, hey, hey.
492	00:29:39	00:29:40	Two cheeks on the car.
493	00:29:40	00:29:42	There you go.
494	00:30:06	00:30:08	Okay, thanks.
495	00:30:10	00:30:12	She’s not the one.
496	00:30:12	00:30:13	So did I win something?
497	00:30:13	00:30:15	The right to keep on trucking.
498	00:30:17	00:30:18	Here you go, bubba.
499	00:30:19	00:30:21	Hey, we’re outta here!
500	00:30:21	00:30:25	You know, I’m starting to think that maybe we should be looking for a man.
501	00:30:25	00:30:28	Only 3% of multiple killers are female.
502	00:30:28	00:30:30	And a woman wouldn’t need a trophy.
503	00:30:30	00:30:32	And a body on ice is definitely a trophy.
504	00:30:32	00:30:35	Well, Ms. Hard-ass travels with her boyfriend.
505	00:30:35	00:30:38	I bet you a lot of guys travel with their girlfriends.
506	00:30:38	00:30:41	What if it was a man with a woman who would do anything he asked?
507	00:30:55	00:30:57	Then I said, Hey, us guys have to stick together.
508	00:30:57	00:31:01	He’s like, Right. You’re the man!
509	00:31:01	00:31:06	So, I mean, I could’ve used an STR-DNA but it’s too state-of-the-art, it’s overkill.
510	00:31:06	00:31:09	So I used an HLA-DQ-A1 with a...
511	00:31:09	00:31:11	polymarker.
512	00:31:11	00:31:15	That’s--that’s very, very interesting.
513	00:31:15	00:31:17	You don’t care about this at all, do you?
514	00:31:17	00:31:19	No. ( chuckles )
515	00:31:19	00:31:24	But to be honest with you, all I really care about is whether the charges against me are going to be dropped.
516	00:31:28	00:31:29	Are they?
517	00:31:32	00:31:34	The D.A. threw out the case.
518	00:31:34	00:31:36	Great.
519	00:31:36	00:31:40	So I can shoplift at that boutique again?
520	00:31:40	00:31:42	I was kidding, I was kidding.
521	00:31:42	00:31:45	Besides, they never have any good sales there, anyway.
522	00:31:50	00:31:53	I’d invite you out for coffee, but...
523	00:31:53	00:31:54	it’s probably a bad idea.
524	00:31:54	00:31:56	Uh, yeah.
525	00:31:56	00:31:57	Yeah.
526	00:31:59	00:32:05	But I can call you sometime, you know, just in case I ever get into trouble or something.
527	00:32:05	00:32:08	Maybe you should try not getting into trouble.
528	00:32:08	00:32:11	You do owe me one.
529	00:32:13	00:32:14	I owe you two.
530	00:32:29	00:32:31	You know where to find me.
531	00:32:40	00:32:43	Is that right?
532	00:32:43	00:32:45	Your boy Kenny just lawyered up.
533	00:32:45	00:32:50	Well, we got a warrant, so that should give us the room for a minute.
534	00:32:52	00:32:54	There’s something wrong with it.
535	00:32:54	00:32:56	Computers turn on.
536	00:32:56	00:32:57	When they don’t, it’s for a reason.
537	00:32:57	00:32:59	Did you plug it in?
538	00:32:59	00:33:00	The power light’s on.
539	00:33:02	00:33:03	Really?
540	00:33:07	00:33:08	Let me check it out.
541	00:33:14	00:33:17	Well, he’s a sneaky S.O.B., I give him that.
542	00:33:17	00:33:21	Oh, o one is gonna believe this.
543	00:33:22	00:33:23	All right.
544	00:33:29	00:33:30	Let me see that flashlight.
545	00:33:31	00:33:33	There’s scratches all over it.
546	00:33:33	00:33:35	Nothing really special about them.
547	00:33:35	00:33:38	And the hotshot takes another strike.
548	00:33:38	00:33:39	Check it out.
549	00:33:39	00:33:45	Not enough to cause even a small scratch on your finger, but more than enough to use as a basis for comparison.
550	00:33:45	00:33:47	We match this to the broken window, we got him.
551	00:33:47	00:33:51	One, two, three.
552	00:33:51	00:33:57	Left one is from the broken window the other one is from the gun, both dropping at an identical rate.
553	00:33:57	00:33:59	Glass is from the same source.
554	00:33:59	00:34:03	So Kenny broke the window from the inside using the butt of the gun.
555	00:34:03	00:34:06	My theory...
556	00:34:06	00:34:09	The brother was the executor of the parents’ estate.
557	00:34:09	00:34:11	He controlled the family money.
558	00:34:11	00:34:13	Sounds like more than a theory.
559	00:34:13	00:34:15	I called the county clerk.
560	00:34:15	00:34:18	With the brother out of the way, Kenny is the sole beneficiary.
561	00:34:18	00:34:21	Do you have any idea how much money I’ve lost?
562	00:34:21	00:34:23	Kenny, come on, what are you doing?
563	00:34:23	00:34:25	I’m your brother, okay?
564	00:34:25	00:34:28	I already said I’d loan you the money, okay?
565	00:34:28	00:34:29	Come on! $20,000?
566	00:34:29	00:34:32	That doesn’t even begin to solve my problems!
567	00:35:00	00:35:04	Slam that jail door.
568	00:35:04	00:35:07	Makes you reconsider, doesn’t it?
569	00:35:07	00:35:10	I never said you weren’t a good CSI.
570	00:35:18	00:35:22	We’re state-of-the-art here-- number one in vehicle satellite tracking.
571	00:35:22	00:35:26	I can locate one or all of our trucks with just a click of a mouse, 24-7.
572	00:35:26	00:35:30	Do you ever worry that technology is gonna make us obsolete?
573	00:35:30	00:35:32	No.
574	00:35:32	00:35:36	Can you, uh, narrow your database?
575	00:35:36	00:35:40	Say, eliminate all trucks that are not refrigerated?
576	00:35:40	00:35:42	Yeah, I think I can.
577	00:35:44	00:35:49	Can you eliminate all trucks that were not in Las Vegas yesterday?
578	00:35:53	00:35:57	Eliminate all trucks that only travel in state.
579	00:36:00	00:36:06	Now eliminate the trucks that don’t deliver to supermarkets along the I-15.
580	00:36:08	00:36:09	This is very cool.
581	00:36:09	00:36:13	Eliminate all trucks that did not deliver to Marty’s Market yesterday.
582	00:36:17	00:36:18	That’s our guy.
583	00:36:18	00:36:21	He delivered to all five towns all five supermarkets.
584	00:36:21	00:36:22	Where is he now?
585	00:36:28	00:36:30	Police! Get your hands up!
586	00:36:35	00:36:36	Police!
587	00:36:36	00:36:39	Step away from the truck and put your hands on the back of your head!
588	00:36:39	00:36:41	Keep your hands in sight! Get out of the truck!
589	00:36:41	00:36:43	Hands over your head!
590	00:36:45	00:36:47	Step away from the truck.
591	00:36:47	00:36:49	Put your hands on the back of your head.
592	00:36:49	00:36:51	I’m just making my regular delivery...
593	00:36:51	00:36:53	Don’t make me ask you twice.
594	00:36:53	00:36:55	Move! Hands on the back of your head!
595	00:36:55	00:36:57	Hands on the back of your head!
596	00:36:59	00:37:02	Left hand on the wall, right hand on the wall.
597	00:37:02	00:37:04	Check him for weapons.
598	00:37:04	00:37:07	Spread your legs. Nice and easy.
599	00:37:07	00:37:09	Hey, get away from my truck!
600	00:37:09	00:37:11	It’s not your truck anymore. It’s our crime scene.
601	00:37:11	00:37:13	Come with me. Check the cab.
602	00:37:17	00:37:18	It’s all yours.
603	00:37:21	00:37:23	All clear here, sir.
604	00:38:28	00:38:29	We got three.
605	00:38:37	00:38:39	Where is she?
606	00:38:41	00:38:43	Where is Margaret Shorey?
607	00:38:45	00:38:47	Screw you, man.
608	00:38:49	00:38:52	Look, pal, I already know what happened.
609	00:38:52	00:38:58	I even know your type-- Decent, trusting, middle-aged women.
610	00:38:58	00:39:00	Please help me...
611	00:39:00	00:39:02	You got to help me! I locked my baby in the car!
612	00:39:02	00:39:05	Did you call the manager? It is so hot, she’s gonna die.
613	00:39:05	00:39:06	Please help me!
614	00:39:06	00:39:08	All... all right.
615	00:39:08	00:39:09	Where’s your car?
616	00:39:09	00:39:11	This way.
617	00:39:14	00:39:17	Go on! Write it!
618	00:39:36	00:39:37	Okay. All right, listen.
619	00:39:37	00:39:41	First one of you lowlifes can name that tune gets to make a deal.
620	00:39:41	00:39:44	Hmm?
621	00:39:44	00:39:47	The difference between the chair or life in prison.
622	00:39:47	00:39:48	So...
623	00:39:50	00:39:52	He made me do it.
624	00:39:52	00:39:54	( screams ) Cuff him.
625	00:39:54	00:39:56	Let me go!
626	00:39:57	00:39:59	Hey, hey, hey...
627	00:40:03	00:40:05	Where is she?
628	00:40:42	00:40:43	There’s a lock.
629	00:40:43	00:40:44	Are there any keys?
630	00:40:48	00:40:50	Try those.
631	00:41:03	00:41:05	Hello, Margaret.
632	00:41:05	00:41:06	My name is Gil.
633	00:41:06	00:41:09	This is Catherine.
634	00:41:09	00:41:11	We’re gonna take you home.
635	00:41:19	00:41:21	You look lost.
636	00:41:21	00:41:23	Oh, yeah...
637	00:41:23	00:41:25	Do you know Warrick Brown?
638	00:41:25	00:41:28	Yeah, you want me to tell him you’re here?
639	00:41:28	00:41:30	Oh, he’s probably working.
640	00:41:30	00:41:32	He works really hard.
641	00:41:32	00:41:36	If you see him, could you just tell him that, uh, Jason says thanks?
642	00:41:36	00:41:38	Okay. Will he know what for?
643	00:41:38	00:41:39	Uh...
644	00:41:39	00:41:40	Hey, Jas, how you doing?
645	00:41:40	00:41:42	Better.
646	00:41:42	00:41:45	Hey, thanks for busting me loose.
647	00:41:45	00:41:46	My mom said she’ll pay you back.
648	00:41:46	00:41:49	No, you’ll pay me back, shorty.
649	00:41:49	00:41:51	Just don’t be pulling any more fire alarms.
650	00:41:51	00:41:52	I won’t.
651	00:41:52	00:41:54	Gets you more attention than you want.
652	00:41:54	00:41:55	I know.
653	00:41:55	00:41:56	You still working on those moves I showed you?
654	00:41:56	00:41:58	Yeah, every day after school.
655	00:41:58	00:41:59	How about that?
656	00:41:59	00:42:01	How about that right there?
657	00:42:01	00:42:02	Good.
658	00:42:02	00:42:03	Hey, I got to go.
659	00:42:03	00:42:05	My mom’s waiting for me.
660	00:42:05	00:42:08	Hey, come here.
661	00:42:08	00:42:09	Apologize to your mom, all right?
662	00:42:09	00:42:11	Let her know she can trust you.
663	00:42:11	00:42:13	Yeah. All right?
664	00:42:13	00:42:15	Bye, Warrick, uh... see you next week.
665	00:42:15	00:42:19	See you next week, Jaws.
666	00:42:19	00:42:23	So you went to the casino to win bail money.
667	00:42:23	00:42:24	He needed my help.
668	00:42:24	00:42:25	I didn’t win anything, Sara.
669	00:42:25	00:42:26	You’re a CSI.
670	00:42:26	00:42:27	You saw me enter a casino.
671	00:42:27	00:42:28	Did you see me place a bet?
672	00:42:28	00:42:30	You want to tell me you didn’t?
673	00:42:30	00:42:32	I don’t have to tell you anything.
674	00:42:34	00:42:40	Look, I went there to collect a debt that was owed to me.
675	00:42:40	00:42:42	We’re supposed to be working together.
676	00:42:42	00:42:47	Next time, just try talking to me instead of going around behind my back.
