	start	end	text
472	00:34:21	00:34:22	That stuff will kill you, you know.
473	00:34:22	00:34:24	Hasn't killed me yet.
474	00:34:24	00:34:27	Grego, find any time between meals to check out Grissom's scrapings?
475	00:34:28	00:34:30	You mean Ashleigh's fingernail scrapings?
476	00:34:30	00:34:31	Yeah. Yeah.
477	00:34:31	00:34:32	And?
478	00:34:33	00:34:34	Got a match.
479	00:34:34	00:34:36	To Cassie, her sister.
480	00:34:36	00:34:37	No. To the vic.
481	00:34:37	00:34:38	Ashleigh?
482	00:34:39	00:34:41	Yeah. The DNA under her fingernails was her own.
483	00:34:42	00:34:43	Excuse me.
484	00:34:45	00:34:49	So what I realized was bulimia is a zero sum disease.
485	00:34:49	00:34:53	That's why she has a plus sign over here and a minus sign over there.
486	00:34:53	00:34:57	Whatever went in had to be exactly canceled by what went out.
487	00:34:59	00:35:01	Body Dysmorphic Disorder.
488	00:35:01	00:35:04	Yes. One theory suggests it's neurobiological.
489	00:35:04	00:35:14	Another psychological-- that people with extreme sexual or emotional anxiety unconsciously displace their feelings into the arena of appearance, because it's more manageable.
490	00:35:14	00:35:16	You feel like crap, blame your face.
491	00:35:17	00:35:21	Or your skin, or your hair or that zit on your forehead.
492	00:35:21	00:35:22	I knew this dancer.
493	00:35:22	00:35:26	Every night she'd stare at herself in the mirror for three hours.
494	00:35:26	00:35:31	Meticulous grooming, when a person suffers from BDD becomes a destructive compulsion.
495	00:35:31	00:35:37	There's one line in her daybook that keeps repeating over and over I'm not even.
496	00:35:37	00:35:40	So you're saying she knew she was slipping.
497	00:35:40	00:35:42	No. She literally means even.
498	00:35:42	00:35:46	A large number of BDD sufferers are convinced that they're not symmetric.
499	00:35:46	00:35:49	That one side of their body or their face doesn't match the other.
500	00:35:49	00:35:51	All animals prefer symmetry in their mates.
501	00:35:51	00:35:56	The male Japanese scorpion flies with the most symmetrical wings gets the most mates.
502	00:35:56	00:36:00	So, really we're not talking about being beautiful at all.
503	00:36:00	00:36:02	In terms of entomology being beautiful is about being even.
504	00:36:02	00:36:05	It signals the fitness to procreate.
505	00:36:05	00:36:07	So, we're not really talking about looks.
506	00:36:07	00:36:10	We're talking about survival of the species?
507	00:36:12	00:36:14	control and perfectionism.
508	00:36:14	00:36:16	That's what her code was all about.
509	00:36:19	00:36:28	Let's take HBWC/3, 1590 BC, 90 BF, 3930 S, 114 TC.
510	00:36:28	00:36:30	Three hamburgers with cheese.
511	00:36:30	00:36:31	Content 530.
512	00:36:31	00:36:35	530 times three is where she gets 1590 BC.
513	00:36:35	00:36:38	That's BC for bad calories.
514	00:36:38	00:36:42	And at 30 grams a pop 90 grams of BF.
515	00:36:42	00:36:43	Bad fat?
516	00:36:43	00:36:44	Yeah.
517	00:36:44	00:36:50	The rest of her formula involves sodium, total carbohydrates and the actual weight of everything she ate.
518	00:36:51	00:36:53	And so, she was, uh...
519	00:36:53	00:36:57	operating like a scientist seeking a perfect formula to take her pain away.
520	00:36:57	00:37:00	Or disappear altogether.
521	00:37:00	00:37:02	Which brings me to the minus side of her equation.
522	00:37:02	00:37:08	She would write down the number of times she t'u'd, threw up, in this case twice-- or evo'd.
523	00:37:08	00:37:10	Evo'd?
524	00:37:10	00:37:12	Moving her bowels.
525	00:37:12	00:37:15	The directions on her disposable enema box use the term evacuate.
526	00:37:15	00:37:22	So, after her burger binge she 3 evo'd, 14 G, 2 t'u'd, 9 G, 3 #1.
527	00:37:22	00:37:27	She evo'd three times but her calculations didn't stop there.
528	00:37:27	00:37:29	G stands for grams.
529	00:37:36	00:37:37	14 gram... wait a minute.
530	00:37:37	00:37:39	You're telling me that she weighed her bowel?
531	00:37:40	00:37:41	Yeah.
532	00:37:41	00:37:43	We bagged it.
533	00:37:47	00:37:51	Input and output down to the last quarter gram.
534	00:37:51	00:37:57	Well, that makes sense why the blood and skin under Ashleigh James's fingernails is a perfect match to Ashleigh James.
535	00:37:57	00:37:59	She attacked herself.
536	00:38:00	00:38:05	I mean, Ashleigh was convinced that everything about her needed to be fixed.
537	00:38:05	00:38:07	The real problem was inside her head.
538	00:38:07	00:38:09	She couldn't deal with that so she tried to fix the outside.
539	00:38:09	00:38:13	Hence, the digging and picking and purging and bleeding.
540	00:38:13	00:38:14	To us, it would be torture.
541	00:38:14	00:38:18	To her... some sort of release.
542	00:38:18	00:38:22	Which is why Rod cut her loose.
543	00:38:22	00:38:24	She was no longer bankable.
544	00:38:24	00:38:27	Also why Frank was so angry at Rod.
545	00:38:28	00:38:30	Yeah, he destroyed Frank's vision of her.
546	00:38:30	00:38:34	So the victim and the killer became one and the same.
547	00:38:34	00:38:43	The very nature of addiction-- whether it be self-medicating herself or self-mutilating-- is that the very behavior we use to survive it becomes a behavior that ends up killing us.
548	00:38:43	00:38:50	But wait, that still doesn't answer how Ashleigh ended up in a shopping cart by the freeway.
549	00:38:50	00:38:53	Well, the fingerprints explain that.
550	00:39:14	00:39:17	I think Cassie was trying to take care of her sister.
551	00:39:18	00:39:21	She pushed her to a place where she thought she'd be safe.
552	00:39:21	00:39:26	Where she thought she could see herself for how beautiful she really was.
553	00:39:35	00:39:38	What happened to these girls?
554	00:39:48	00:39:52	I'm sorry about your sister, Cassie.
555	00:39:52	00:39:54	The dead don't bleed.
556	00:39:54	00:39:58	True. Death does have some advantages.
557	00:40:00	00:40:02	Would you like me to help you get into a shelter?
558	00:40:02	00:40:04	No, I would need a shelter from a shelter.
559	00:40:04	00:40:10	No, no, no. Out here, I can hunt and I can range and I can find the things that I need out here.
560	00:40:10	00:40:13	I mean, you never know what you need until you find it.
561	00:40:13	00:40:16	Or until you lose it.
562	00:40:19	00:40:23	I mean, all we are is what we try to get rid of.
563	00:40:23	00:40:27	Fat and newspapers and loneliness and cat food cans.
564	00:40:27	00:40:32	And there are going-away people and there are left-behind people but, you know, everybody's secrets...
565	00:40:32	00:40:34	everybody's secrets are the same.
566	00:40:34	00:40:36	Were you and your sister's secrets the same?
567	00:40:37	00:40:38	My sister didn't have secrets.
568	00:40:38	00:40:40	Her secrets had her.
569	00:40:40	00:40:43	That... I told you I didn't... I don't know.
570	00:40:43	00:40:48	I mean, you know, y-y-you-you can pick through a million lives and never have one of your own.
571	00:40:51	00:40:56	Looking for things, analyzing them...
572	00:40:56	00:41:00	trying to figure out the world-- that's a life.
573	00:41:00	00:41:03	You never know what you need until you find it.
574	00:41:03	00:41:09	And the next thing I find it might be the thing that changes everything.
575	00:41:09	00:41:13	What will you do when you find it?
576	00:41:13	00:41:16	Sleep...
577	00:41:16	00:41:19	the most perfect sleep.
578	00:42:33	00:42:38	Obviously most of crime scene investigation is about seeing.
579	00:42:38	00:42:40	But much of it is about hearing as well.
580	00:42:41	00:42:42	Listening.
581	00:42:42	00:42:43	Knowing how to listen.
582	00:42:43	00:42:47	Not just to what people are saying but how they say it.
583	00:42:47	00:42:53	How their tone of voice matches their facial expressions or body posture.
584	00:42:53	00:42:58	So, even if I read lips and know what they're saying...
585	00:42:58	00:43:01	it's not enough.
586	00:43:02	00:43:06	We're both scientists, Mr. Grissom so let me tell you the science.
587	00:43:07	00:43:09	You've got otosclerosis.
588	00:43:10	00:43:15	Basically, this means a bony growth has begun to form around the base of the stapes.
589	00:43:15	00:43:25	What this does is prevent the stapes from moving and passing vibrations to the inner ear effectively neutralizing sound waves.
590	00:43:25	00:43:27	It's hereditary-- my mother.
591	00:43:27	00:43:29	Most doctors think so.
592	00:43:29	00:43:36	But there's no way to know when it's going to show up and there's no way to reverse it once it does.
593	00:43:36	00:43:38	Right.
594	00:43:42	00:43:43	How long do you think?
595	00:43:45	00:43:47	I don't have that answer.
