	start	end	text
0	00:00:10	00:00:12	Back it up. Back it up.
1	00:00:13	00:00:16	Whoa, whoa, whoa. You're good. You're good.
2	00:00:19	00:00:20	Hey, Harlan.
3	00:00:20	00:00:22	Special delivery.
4	00:00:22	00:00:24	Fresh shipment in from Nebraska.
5	00:00:24	00:00:26	Great. Just stack it in the freezer, will you?
6	00:00:26	00:00:27	I got to open up.
7	00:00:27	00:00:29	All right, you got it, boss.
8	00:00:56	00:00:59	Ever wonder what's in that hot dog?
9	00:00:59	00:01:01	Human body in a meat grinder.
10	00:01:02	00:01:04	Shop foreman found an arm.
11	00:01:04	00:01:07	The rest of him is prime grade A sirloin.
12	00:01:07	00:01:09	Body in a meat grinder.
13	00:01:09	00:01:12	Sounds kind of Mob-ish except they left town in the '80s.
14	00:01:12	00:01:16	The last guy to operate the meat grinder is this guy over here.
15	00:01:16	00:01:18	Manny Saldano, age 37.
16	00:01:18	00:01:19	Worked for Meteor for 11 years.
17	00:01:19	00:01:21	Shop foreman vouches for him.
18	00:01:21	00:01:25	Says he inspected all three of his machines before he clocked him out.
19	00:01:25	00:01:26	Well, keep him here.
20	00:01:26	00:01:27	We're going to need to process him.
21	00:01:27	00:01:29	Sure.
22	00:01:29	00:01:32	Check out the smorgasbord.
23	00:01:32	00:01:33	Go ahead.
24	00:01:38	00:01:40	Mike.
25	00:01:40	00:01:44	Good God...
26	00:01:46	00:01:48	Looks like the elbow got stuck in the blade.
27	00:01:51	00:01:53	Yup, the ulna.
28	00:01:53	00:01:55	One of the strongest bones in the body.
29	00:01:55	00:01:57	Probably what jammed this grinder.
30	00:01:57	00:02:00	Possibly why whoever did this didn't finish the job.
31	00:02:05	00:02:09	It's like that Morrissey album-- Meat Is Murder.
32	00:02:11	00:02:13	I'm going to need a hand.
33	00:02:52	00:02:55	The last remains of John Doe.
34	00:02:55	00:02:56	We're going to need sifters.
35	00:02:56	00:02:58	Blood's everywhere.
36	00:02:58	00:03:02	Phenolphthalein and Luminol are useless.
37	00:03:02	00:03:05	We're going to have to dismantle this piece by piece.
38	00:03:06	00:03:06	Yeah.
39	00:03:06	00:03:07	I'll get a foreman.
40	00:03:07	00:03:08	I think I can handle this.
41	00:03:08	00:03:11	You know about meat grinders?
42	00:03:11	00:03:13	Well, everything's pretty much plumbing.
43	00:03:13	00:03:14	Male into female parts.
44	00:03:14	00:03:18	Righty tighty, lefty loosey.
45	00:03:26	00:03:28	Grinder plate.
46	00:03:33	00:03:35	Blade.
47	00:03:42	00:03:43	The worm.
48	00:03:56	00:03:58	Found an ear plug.
49	00:03:58	00:04:02	Ear wax is ripe with DNA.
50	00:04:02	00:04:03	Except...
51	00:04:04	00:04:07	all the employees wear them.
52	00:04:07	00:04:10	This one's different than the ones they use.
53	00:04:10	00:04:13	Whoever wore this brought it with them.
54	00:04:13	00:04:16	We just have to find out whose ear it fits.
55	00:04:18	00:04:22	Girl's name is Linda Damen, 23, apparent suicide.
56	00:04:22	00:04:25	Father stopped by with dinner found her dead, called 911.
57	00:04:25	00:04:26	No signs of forced entry?
58	00:04:26	00:04:27	Nope.
59	00:04:27	00:04:28	Did find her wallet out.
60	00:04:28	00:04:30	Empty.
61	00:04:30	00:04:31	Empty?
62	00:04:31	00:04:34	Maybe she was just broke.
63	00:04:38	00:04:40	Hey.
64	00:04:40	00:04:41	You guys are fast.
65	00:04:41	00:04:43	You pronounce?
66	00:04:43	00:04:45	20. Coroner will be able to tell you more.
67	00:04:45	00:04:47	Looks like she bled out.
68	00:04:47	00:04:48	Her left wrist is transected.
69	00:04:48	00:04:50	It's atypical for a female.
70	00:04:50	00:04:52	Women usually commit suicide in the tub.
71	00:04:52	00:04:55	It's easier cleanup for whoever's left behind.
72	00:04:55	00:04:56	Yeah.
73	00:04:58	00:04:59	Warrick.
74	00:05:01	00:05:04	Did her parents say whether she was living with a man?
75	00:05:04	00:05:06	Was dating a Brody Jones.
76	00:05:06	00:05:09	No idea where he works or lives.
77	00:05:09	00:05:11	Did someone move her?
78	00:05:11	00:05:13	She was propped up when we got here.
79	00:05:13	00:05:15	I checked for vitals.
80	00:05:15	00:05:17	You sure with all your life-saving efforts you didn't move her?
81	00:05:17	00:05:20	Hey, man, like I said, I checked for vitals.
82	00:05:20	00:05:21	It's okay, baby.
83	00:05:26	00:05:27	The victim had no response.
84	00:05:27	00:05:29	I had no reason to move her.
85	00:05:29	00:05:31	Well, someone moved her.
86	00:05:31	00:05:33	She bled out here and she's dead there.
87	00:05:41	00:05:42	I'm going to hit the road...
88	00:05:42	00:05:43	baby.
89	00:05:43	00:05:46	I'm sorry.
90	00:05:50	00:05:53	There's a stain here.
91	00:05:53	00:05:55	So cold stains.
92	00:05:55	00:05:56	Is it recent?
93	00:05:59	00:06:01	It's cool to the touch, yeah.
94	00:06:06	00:06:08	Sara.
95	00:06:08	00:06:11	I think our suicide just became suspicious circs.
96	00:06:13	00:06:19	Since I'm the one who always seems to state the obvious this arm was dead before it was hacked off.
97	00:06:19	00:06:24	What do you make of the, uh scar tissue on the palm?
98	00:06:24	00:06:26	Occupational hazard, maybe.
99	00:06:26	00:06:32	I see this kind of thing a lot in bricklayers, plumbers, carpenters.
100	00:06:32	00:06:34	Looks like it's blistered.
101	00:06:34	00:06:39	Gradual denaturation of the proteins in the epithelials.
102	00:06:39	00:06:44	resulting in general scarring on the palm or surface.
103	00:06:44	00:06:48	We'll take a sample from under the fingernails and send it to trace.
104	00:06:49	00:06:53	Tips of the fingers look like they're worn to the bone.
105	00:06:53	00:06:54	Can you get a partial?
106	00:06:56	00:06:57	Much more than that.
107	00:06:57	00:06:59	Lansberry's Ridge Builder.
108	00:07:01	00:07:10	One application to the bulbs of the fingers and the ridges plump out temporarily like a Chia Pet on steroids.
109	00:07:39	00:07:41	Petrov Samsko.
110	00:07:41	00:07:45	Non-gaming sheriff's permit, head chef, DeBreff Restaurant.
111	00:07:46	00:07:49	Chef-- that would explain the burn scar tissue on his palm.
112	00:07:49	00:07:50	It's DeBreff.
113	00:07:50	00:07:52	It's a five-star restaurant.
114	00:07:52	00:07:53	I've eaten there.
115	00:07:53	00:07:55	Good, maybe you can get us a table.
116	00:07:55	00:07:58	Different sole, different size.
117	00:07:58	00:07:59	Thank you.
118	00:08:01	00:08:02	Sorry for the inconvenience.
119	00:08:02	00:08:04	This is just a standard procedure.
120	00:08:04	00:08:07	Do you have any idea where your daughter's boyfriend works?
121	00:08:07	00:08:09	Well, a casino.
122	00:08:09	00:08:12	Uh, which one?
123	00:08:12	00:08:14	All of them.
124	00:08:14	00:08:16	He's, uh, he's a gambler.
125	00:08:16	00:08:22	Um, used to drag Linda out, keep her up days at a time.
126	00:08:22	00:08:27	Ran her health down, her spirit.
127	00:08:27	00:08:29	She was getting better, though.
128	00:08:29	00:08:36	She had a, uh... rough time after college finding herself but she was getting better.
129	00:08:48	00:08:55	The transection of the left wrist is consistent with a self-inflicted wound particularly because she's right-handed.
130	00:08:55	00:08:56	There's no hesitation marks.
131	00:08:56	00:08:59	Isn't that uncommon for suicide?
132	00:08:59	00:09:03	People usually stutter-cut a few times trying to work up the courage.
133	00:09:04	00:09:05	This woman cut herself with one smooth motion.
134	00:09:05	00:09:08	This DB is all wrong.
135	00:09:08	00:09:11	Someone moved her two feet from where she bled out.
136	00:09:11	00:09:13	What did the tox screen say?
137	00:09:13	00:09:14	Nothing. Not back yet.
138	00:09:14	00:09:16	But I'll get it to you soon as it is.
139	00:09:16	00:09:18	Thank you.
140	00:09:19	00:09:21	Is that glass in her hair?
141	00:09:23	00:09:25	Minute pieces of it, yeah.
142	00:09:26	00:09:28	I tweezed a few for trace.
143	00:09:28	00:09:31	We didn't see any broken glass in her apartment.
144	00:09:31	00:09:34	Round edges, tinted...
145	00:09:34	00:09:36	It looks polarized.
146	00:09:36	00:09:38	Probably safety glass.
147	00:09:38	00:09:39	Yeah.
148	00:09:39	00:09:42	Too bad it didn't protect her.
149	00:09:42	00:09:44	Uh, DeBreff, please hold.
150	00:09:44	00:09:45	DeBreff, please hold.
151	00:09:45	00:09:46	DeBreff, please hold.
152	00:09:47	00:09:48	Hi. Last name?
153	00:09:48	00:09:50	We don't have reservations. W-We're here...
154	00:09:50	00:09:51	Eh, party of four?
155	00:09:51	00:09:53	Three weeks from Thursday?
156	00:09:53	00:09:54	Let me see.
157	00:09:54	00:09:56	Excuse me, but you don't understand.
158	00:09:56	00:09:58	No, I'm sorry. You don't understand.
159	00:09:58	00:10:00	Your walk-in's on a very busy night.
160	00:10:00	00:10:01	We're short a chef.
161	00:10:01	00:10:02	We know. He's dead.
162	00:10:02	00:10:04	Not just dead.
163	00:10:04	00:10:06	Dismembered.
164	00:10:07	00:10:09	We're with the crime lab.
165	00:10:10	00:10:12	I'll get the owner.
166	00:10:15	00:10:17	Are you sure it's Petrov?
167	00:10:17	00:10:20	Coroner made a positive identification.
168	00:10:20	00:10:22	What makes you think this event happened here?
169	00:10:22	00:10:26	We found traces of aspic and olive oil under his fingernails.
170	00:10:26	00:10:31	Means that he went into the meat grinder without showering.
171	00:10:31	00:10:33	Possibly straight from this kitchen.
172	00:10:33	00:10:36	If there was a murder in our kitchen don't you think that, uh...
173	00:10:36	00:10:38	I'd know about it?
174	00:10:38	00:10:40	I don't know. Would you?
175	00:10:45	00:10:47	Hey, Cath?
176	00:10:47	00:10:49	Blood spatter.
177	00:10:49	00:10:50	It's a kitchen. The chefs use knives.
178	00:10:50	00:10:51	That's not uncommon.
179	00:10:51	00:10:53	You are...?
180	00:10:53	00:10:54	Gil Grissom.
181	00:10:54	00:10:55	I'm with her.
182	00:10:57	00:11:00	Who's, uh, Stephanie?
183	00:11:00	00:11:02	One of my waitresses.
184	00:11:02	00:11:12	Oh, I understand how chefs cut their fingers and how the kitchen help could have blood spatter on their uniforms but how does a waitress get blood on the back of her shirt?
185	00:11:14	00:11:21	We can shut you down for hours or get a warrant and shut you down for good.
186	00:11:23	00:11:25	Give me till after the rush?
187	00:11:32	00:11:36	Okay, this rush is taking entirely too long.
188	00:11:36	00:11:37	The coquilles St. Jacques.
189	00:11:37	00:11:38	Thank you.
190	00:11:38	00:11:42	People always think that the show is out front.
191	00:11:42	00:11:46	It wasn't till I waitressed I realized it's all in the back.
192	00:12:03	00:12:05	What are you looking at?
193	00:12:05	00:12:07	Looks like a V-pattern to me.
194	00:12:07	00:12:08	What do you think?
195	00:12:09	00:12:11	Yeah.
196	00:12:11	00:12:12	What, caused by a candle?
197	00:12:13	00:12:15	Burn area seems too big for a candle.
198	00:12:15	00:12:17	Okay. Kitchen's all yours.
199	00:12:17	00:12:21	Mr. Dutton, uh, can I ask you what happened here?
200	00:12:21	00:12:22	Oh, geez.
201	00:12:22	00:12:25	Uh, waiters probably put the candles too close to the wall.
202	00:12:25	00:12:27	I've told them a million times.
203	00:12:31	00:12:33	Ah, excuse me. Stephanie?
204	00:12:33	00:12:34	Uh-huh.
205	00:12:34	00:12:35	Is this your uniform?
206	00:12:35	00:12:37	Don't have to answer that, Steph.
207	00:12:37	00:12:39	They don't have a warrant.
208	00:12:39	00:12:41	I thought you said the Mafia left town.
209	00:12:42	00:12:47	We have the owner's consent so, again, could you explain this blood?
210	00:12:48	00:12:49	Order up, Stephanie.
211	00:12:49	00:12:50	Hot items.
212	00:12:50	00:12:53	Two filet mignon and one coquilles St. Jacques.
213	00:12:53	00:12:55	Boogie. Go, go.
214	00:12:55	00:12:56	Hey!
215	00:12:56	00:13:02	We found blood spatter on the uniforms of several employees who worked the night that Chef Petrov died.
216	00:13:02	00:13:05	Ross Halpo-- sous chef.
217	00:13:05	00:13:08	Lola Creighton-- saucier.
218	00:13:08	00:13:10	You want to tell us how the blood got here?
219	00:13:10	00:13:12	It's my blood.
220	00:13:14	00:13:16	don't touch my knife; don't touch my johnson.
221	00:13:21	00:13:23	Hey, hey, that's my knife!
222	00:13:24	00:13:25	Touched his knife.
223	00:13:26	00:13:26	I deserved it.
224	00:13:27	00:13:28	Okay.
225	00:13:28	00:13:32	That still doesn't explain how the blood got on the uniforms.
226	00:13:32	00:13:33	They don't get it.
227	00:13:33	00:13:35	Chefs here have a ritual.
228	00:13:35	00:13:36	Macho thing.
229	00:13:36	00:13:41	If you get cut it's tradition that you disburse maximum spillage.
230	00:13:41	00:13:42	Oh, hey, watch it.
231	00:13:42	00:13:43	Ah, blood!
232	00:13:43	00:13:45	Oh, hey, stop... ooh!
233	00:13:45	00:13:47	That's how everyone got blood on themselves.
234	00:13:47	00:13:48	Macho.
235	00:13:48	00:13:51	Haven't these people ever heard of HIV?
236	00:13:51	00:13:52	Apparently not.
237	00:13:52	00:13:53	Alert all your employees.
238	00:13:53	00:13:56	We're going to take over your kitchen, starting now.
239	00:13:56	00:13:59	Hey. You got something on that glass?
240	00:13:59	00:14:01	Didn't beep you to say hi.
241	00:14:01	00:14:05	Glad to see you're settling in, Hodges.
242	00:14:05	00:14:07	You were right. It is polarized.
243	00:14:07	00:14:09	Ultraviolet quotient is very high.
244	00:14:09	00:14:11	Glass is from a car windshield.
245	00:14:11	00:14:14	Maybe she was in some kind of car accident.
246	00:14:14	00:14:16	Hit-and-run...
247	00:14:16	00:14:20	Then she crawls home, gets on her bed and commits hari-kari?
248	00:14:20	00:14:22	Stranger things have happened.
249	00:14:22	00:14:25	If you weren't such a lab rat, you would know that.
250	00:14:25	00:14:27	You got a make of a car for me?
251	00:14:27	00:14:29	No.
252	00:14:29	00:14:31	But...
253	00:14:31	00:14:34	I can narrow it down to the year it was manufactured.
254	00:14:34	00:14:40	Car companies add more ultraviolet sealants each season to stay ahead of safety standards.
255	00:14:40	00:14:44	Used a comparison study of a car that was made in 2001.
256	00:14:46	00:14:49	Your windshield glass is from a 2002 model.
257	00:14:49	00:14:50	Thank you.
258	00:14:50	00:14:53	Mm-hmm.
259	00:14:56	00:14:57	The windshield's intact.
260	00:14:57	00:15:02	Yeah. Well, maybe the glass came from another windshield in this lot.
261	00:15:02	00:15:04	Yeah. Let's take a look.
262	00:15:04	00:15:09	You know, you can tell a lot about a person by what they leave in their car.
263	00:15:09	00:15:11	Rotten bananas.
264	00:15:12	00:15:14	Business suit.
265	00:15:18	00:15:20	I got a paycheck.
266	00:15:20	00:15:22	Who would do that?
267	00:15:22	00:15:23	Underwear.
268	00:15:26	00:15:28	That looks like adhesive.
269	00:15:29	00:15:32	Still tacky.
270	00:15:32	00:15:33	Hey, hey!
271	00:15:33	00:15:34	What are you doing?
272	00:15:34	00:15:35	That's my car.
273	00:15:35	00:15:37	Crime lab. How are you?
274	00:15:37	00:15:39	Cute picture. I'm late for work.
275	00:15:39	00:15:41	We noticed you had your windshield replaced recently.
276	00:15:41	00:15:42	The adhesive's seeping.
277	00:15:42	00:15:43	You get what you pay for.
278	00:15:43	00:15:45	So the car shop was having a half-off deal.
279	00:15:45	00:15:47	I'm in no position to go to the big guys.
280	00:15:47	00:15:52	Did replacing the windshield have anything to do with the tenant in apartment 325?
281	00:15:52	00:15:53	Linda? Yeah.
282	00:15:53	00:15:55	She did it.
283	00:15:55	00:15:58	I'd send her the bill if I thought she'd pay.
284	00:15:58	00:16:00	She hasn't paid for anything else she trashed in this complex.
285	00:16:00	00:16:01	Like what else?
286	00:16:01	00:16:04	Oh, well, that would depend on her mood.
287	00:16:04	00:16:06	Um, when she's up, she breaks the mailboxes.
288	00:16:09	00:16:12	When she's down she throws the patio furniture into the pool.
289	00:16:16	00:16:21	She broke my windshield yesterday because she said she heard me talking on my cell about her.
290	00:16:23	00:16:25	You bitch! I heard you!
291	00:16:25	00:16:27	We just call her the whack job in 325.
292	00:16:27	00:16:29	Well, she died yesterday.
293	00:16:29	00:16:31	We think it may have been a suicide.
294	00:16:31	00:16:34	Yeah? I'm surprised someone didn't kill her.
295	00:16:38	00:16:45	Look, unless you want to call my pit boss and tell him I'm under arrest, I'm going to work.
296	00:16:45	00:16:48	Thank you.
297	00:16:48	00:16:50	I would like to see Linda Damen's tox report.
298	00:16:50	00:16:52	Yeah.
299	00:17:09	00:17:14	Fresh off an airplane from a conference, and bam-- I got seminal fluid.
300	00:17:14	00:17:16	Lucky you.
301	00:17:30	00:17:33	Some things never change.
302	00:17:33	00:17:35	What's that?
303	00:17:35	00:17:37	Cocaine.
304	00:17:43	00:17:46	Presence of blood on the drain.
305	00:17:46	00:17:48	Blood, coke, semen.
306	00:17:48	00:17:52	These people were doing everything in this kitchen but cook.
307	00:17:53	00:17:55	I'll go have a little chit-chat with the hostess.
308	00:17:56	00:17:58	They always seem to know everything.
309	00:18:17	00:18:19	Blood clot.
310	00:18:20	00:18:22	What is that, sand around it?
311	00:18:22	00:18:24	Looks like it.
312	00:18:24	00:18:26	What would sand be doing in a kitchen?
313	00:18:26	00:18:31	Well, one thing's the blood got there before the sand.
314	00:18:31	00:18:34	This was not a little knife nick.
315	00:18:34	00:18:36	This guy was stuck.
316	00:18:36	00:18:42	I mean, uh, he bled out long enough for his blood to pool and clot.
317	00:18:45	00:18:47	Excuse me.
318	00:18:48	00:18:50	We're going to need all your knives.
319	00:18:51	00:18:52	Starting with yours.
320	00:18:54	00:18:55	I need them back by the next shift.
321	00:18:57	00:18:59	Well, that depends on what we find.
322	00:19:07	00:19:12	Oh, uh, this is the clearest picture that we could find of Brody.
323	00:19:12	00:19:14	Thank you.
324	00:19:14	00:19:15	I'll get it to a detective.
325	00:19:15	00:19:18	The shoeprint that you found in Linda's bedroom?
326	00:19:18	00:19:20	Are you thinking that Brody might have...?
327	00:19:20	00:19:21	Oh, we don't know yet.
328	00:19:21	00:19:23	We're going to wait and see what the evidence tells us.
329	00:19:24	00:19:29	I did meet a tenant at your daughter's apartment complex that described Linda as...
330	00:19:29	00:19:31	troubled.
331	00:19:31	00:19:34	Did you ever witness her being violent?
332	00:19:34	00:19:38	We like to think of her as normal, as improving.
333	00:19:38	00:19:41	She was prescribed lithium her junior year of college.
334	00:19:41	00:19:43	She was diagnosed bipolar?
335	00:19:43	00:19:45	She's a rapid cycler.
336	00:19:45	00:19:47	She shifts into manic in a blink.
337	00:19:47	00:19:52	We knew she had been violent around the complex.
338	00:19:52	00:19:53	Lithium didn't help?
339	00:19:53	00:19:55	Well, it's a catch-22.
340	00:19:55	00:20:04	When Linda's in an up phase, she doesn't think she needs the lithium, so she doesn't take it which then makes her more unstable.
341	00:20:06	00:20:09	Made.
342	00:20:09	00:20:12	I'm sorry for your loss.
343	00:20:46	00:20:49	That's a gueridon used for tableside cooking.
344	00:20:49	00:20:54	I thought there was a policy against the use of these in Las Vegas restaurants.
345	00:20:54	00:20:59	Ever since a television star from the '70s burned his face by one.
346	00:20:59	00:21:00	It's changed dining forever.
347	00:21:00	00:21:04	You know, those V-marks that we found in the restaurant-- those were made fairly recently.
348	00:21:04	00:21:07	Certainly since the '70s.
349	00:21:09	00:21:12	I lied about the candles.
350	00:21:12	00:21:14	It was an accident.
351	00:21:14	00:21:20	According to your owner's log, it was a bad accident.
352	00:21:20	00:21:29	Danny Pasqualle Italian male model suffered third-degree burns on his face the night of September 26, 2002.
353	00:21:29	00:21:32	We do special requests for special customers.
354	00:21:32	00:21:38	Chef Petrov made Mr. Pasqualle a Cafe Diablo.
355	00:21:38	00:21:45	Myers Rum, Grand Marnier, Kahlua, and now for the ride.
356	00:21:45	00:21:48	Did he ever file formal charges against you?
357	00:21:48	00:21:49	No, that's the strange thing.
358	00:21:49	00:21:51	He... he never did.
359	00:21:52	00:21:55	What am I going to do, sue for a restaurant?
360	00:21:55	00:21:57	I used to make five million a year.
361	00:21:57	00:21:58	You do the math.
362	00:21:58	00:22:02	So after losing all that salary you never filed suit.
363	00:22:02	00:22:07	Maybe you didn't file charges to keep it quiet and settle it for yourself.
364	00:22:09	00:22:10	Are you accusing me of something?
365	00:22:10	00:22:19	No charges will be filed, Mr. Pasqualle if... you'd be willing to fill out a statement to that effect.
366	00:22:22	00:22:25	The mark on your hand, Mr. Pasqualle?
367	00:22:25	00:22:31	Patterned abrasions over the dorsal of the hand at the metacarpal phalangeal joints.
368	00:22:31	00:22:33	We call it a fight bite.
369	00:22:33	00:22:35	Human mouths are full of bacteria.
370	00:22:35	00:22:40	A wound from a human bite is a tremendous source of infection, unfortunately.
371	00:22:40	00:22:41	So, what happened, Mr. Pasqualle?
372	00:22:41	00:22:45	You paid the chef a little visit and did your version of Etu, Brute?
373	00:22:51	00:22:55	You don't have to say anything, Mr. Pasqualle.
374	00:23:00	00:23:04	We just need your hand.
375	00:23:26	00:23:30	not human.
376	00:23:30	00:23:34	25 knives in, and I'm bust.
377	00:23:37	00:23:39	Oh, now we're cooking.
378	00:23:44	00:23:46	It's not blood.
379	00:23:46	00:23:49	There he is-- dollar slots, wearing the cap.
380	00:23:49	00:23:50	How did you track him down?
381	00:23:50	00:23:52	We showed his photo around.
382	00:23:52	00:23:56	The ATM in the lobby-- he used it 24 hours ago.
383	00:23:59	00:24:00	What is he doing?
384	00:24:00	00:24:03	We used to call a guy like that a bean counter.
385	00:24:03	00:24:06	Degenerates paying 25 cents a pop in hopes of cracking a pattern.
386	00:24:07	00:24:08	What are the notebooks for?
387	00:24:08	00:24:09	It's his results.
388	00:24:09	00:24:13	But that joker doesn't realize that the patterns can end up in the hundreds of millions.
389	00:24:15	00:24:18	You know, the more I see of this kind of stuff the less I picture you a gambler.
390	00:24:18	00:24:19	This isn't gambling.
391	00:24:19	00:24:21	This is the end of the line.
392	00:24:26	00:24:28	How long have you been here, sir?
393	00:24:30	00:24:31	Las Vegas Police.
394	00:24:31	00:24:32	We want a word with you.
395	00:24:32	00:24:34	What do you know about the death of Linda Damen?
396	00:24:34	00:24:35	Unfortunate.
397	00:24:35	00:24:38	I need to... write my results.
398	00:24:38	00:24:39	I need to...
399	00:24:41	00:24:41	document them.
400	00:24:42	00:24:44	How did you get the blood on your shirt?
401	00:24:44	00:24:46	What blood?
402	00:24:46	00:24:47	We're going to need your shirt.
403	00:24:53	00:24:54	Take it.
404	00:24:56	00:24:57	You're coming with the shirt.
405	00:24:58	00:25:00	We'll need your shoes, too.
406	00:25:00	00:25:09	Did you know that some doctors believe that oral bacteria have no other benefits than to make it impossible for other more vicious bacteria to take up residence in our mouths?
407	00:25:09	00:25:11	I knew that, Greg.
408	00:25:11	00:25:13	So, then I should just stop trying to impress you.
409	00:25:13	00:25:15	That would impress me.
410	00:25:15	00:25:17	Okay. Well, results from the Fight Bite Boy.
411	00:25:17	00:25:22	I had to get it from an outside lab since we're not equipped to do bacterial DNA testing ourselves.
412	00:25:22	00:25:23	Hint, hint.
413	00:25:23	00:25:27	Bacteria on his knuckles matches the natural bacteria in the chef's mouth.
414	00:25:28	00:25:30	I guess he settled out of court.
415	00:25:30	00:25:32	I'll never work again!
416	00:25:33	00:25:36	Looks like he took a cheek swab of the chef with his own fist.
417	00:25:37	00:25:39	Thanks, Greg.
418	00:25:39	00:25:40	Mm-hmm.
419	00:25:40	00:25:43	You can see why I might have a hard time believing you, right?
420	00:25:46	00:25:48	Excuse me.
421	00:25:54	00:25:57	So... our male model copping to battery?
422	00:25:57	00:25:59	He's denying murder.
423	00:25:59	00:26:01	Well, maybe he's telling the truth.
424	00:26:01	00:26:05	The earplug from the meat plant-- we got a hit on Codus.
425	00:26:05	00:26:09	Kicked out Harold Haskins delivery man from Meteor Meat.
426	00:26:09	00:26:11	Out on parole for extortion.
427	00:26:11	00:26:14	He delivers to DeBreff Restaurant.
428	00:26:14	00:26:16	So, you snuck in the place to grind up a body?
429	00:26:16	00:26:19	No. I didn't even know what it was till it was too late.
430	00:26:19	00:26:23	Who exactly gave you the, uh, meat to grind?
431	00:26:23	00:26:26	Uh, it was in the restaurant freezer at the DeBreff.
432	00:26:27	00:26:28	You see my face?
433	00:26:28	00:26:30	This is me almost believing you.
434	00:26:30	00:26:33	Now, I've already violated your parole so whatever I say to the judge is up to you.
435	00:26:34	00:26:34	So, what is it?
436	00:26:36	00:26:37	It was Ross.
437	00:26:37	00:26:39	The sous chef.
438	00:26:40	00:26:42	I owed him 3,000 for coke.
439	00:26:42	00:26:46	He said I could pay him back with the favor.
440	00:26:46	00:26:49	You ground up a body as a favor?
441	00:26:49	00:26:50	It was already dead.
442	00:26:50	00:26:51	It's not like I killed him.
443	00:26:51	00:26:54	Well, that's a very tenuous distinction.
444	00:26:54	00:26:56	Stay right there.
445	00:26:56	00:26:59	That's a filet, not a porterhouse.
446	00:26:59	00:27:00	I'm a sous chef.
447	00:27:00	00:27:03	20 guys are into me for recreational substances.
448	00:27:03	00:27:05	It doesn't mean they'd cut a body up for me.
449	00:27:05	00:27:07	Ground it up.
450	00:27:07	00:27:09	We're thinking that you did the actual filleting.
451	00:27:09	00:27:10	Never happened.
452	00:27:10	00:27:12	Ask any of the guys.
453	00:27:12	00:27:13	We have.
454	00:27:13	00:27:14	They won't talk.
455	00:27:15	00:27:17	Military calls it Code Red.
456	00:27:17	00:27:20	Fierce loyalty to the top dog.
457	00:27:20	00:27:22	I guess Petrov was that until somebody killed him.
458	00:27:22	00:27:25	His tragedy is your promotion?
459	00:27:26	00:27:27	Excuse me.
