	start	end	text
446	00:31:56	00:31:58	You ran it?
447	00:31:58	00:31:59	Yeah.
448	00:31:59	00:32:00	They're sulfur.
449	00:32:00	00:32:04	Now, Warrick mentioned something about a missing coin collection.
450	00:32:04	00:32:09	Now, some dealers-- bad ones-- use sulfur to polish up coins for sale.
451	00:32:10	00:32:12	Shake and bake.
452	00:32:17	00:32:22	So I figure that your killer is either a coin dealer or a collector.
453	00:32:22	00:32:25	And he transferred the sulfur to the body when disposing of it.
454	00:32:25	00:32:27	Are you a numismatist, Greg?
455	00:32:27	00:32:30	Oh, my grandpa started me off with a 1909 V.D.B.
456	00:32:30	00:32:32	S Lincoln penny.
457	00:32:32	00:32:33	Often referred to as a V.D.B.
458	00:32:33	00:32:37	because it bears the monogram of its engraver, Victor D. Brenner.
459	00:32:37	00:32:38	It's a low mintage.
460	00:32:39	00:32:42	So, let's see, you surf, you scuba dive, you're into latex...
461	00:32:42	00:32:45	you like fashion models and Marilyn Manson.
462	00:32:45	00:32:48	And you also have a coin collection.
463	00:32:48	00:32:49	Weird, huh?
464	00:32:49	00:32:52	Well...
465	00:32:52	00:32:54	I raise cockroaches.
466	00:32:57	00:32:59	Look available.
467	00:32:59	00:33:00	Be unobtainable.
468	00:33:01	00:33:03	Except when you're trying to beat a murder rap.
469	00:33:03	00:33:04	Excuse me?
470	00:33:04	00:33:05	Whatever you did worked.
471	00:33:05	00:33:07	Brian's going down for you.
472	00:33:07	00:33:09	Oh, so, first you accuse me of whacking Christian.
473	00:33:09	00:33:11	Now you're accusing me of doing Brian?
474	00:33:12	00:33:13	Well, you are the queen bee.
475	00:33:14	00:33:16	The drones line up to service you.
476	00:33:16	00:33:19	What the drones do is make bots and break bots.
477	00:33:19	00:33:23	And while they're up wiring and soldering all night long, you know where I am?
478	00:33:23	00:33:25	I'm at home.
479	00:33:26	00:33:28	With this.
480	00:33:28	00:33:32	Does it have a name or did it come with the wallet?
481	00:33:32	00:33:35	Pretty funny for a scientist.
482	00:33:35	00:33:37	Let me make it easy for you.
483	00:33:37	00:33:43	And in case you can't spell, that E-S-Q means he and his entire law firm are going to be all over your ass.
484	00:33:43	00:33:47	Next time you want to talk to me, talk to him.
485	00:33:54	00:33:57	Hey, I was able to pull the cell phone records for our vic.
486	00:33:57	00:34:00	Most of the calls went to the office, two went to the wife.
487	00:34:00	00:34:02	But there are two who are interesting.
488	00:34:02	00:34:03	Jones Collectibles.
489	00:34:03	00:34:06	Guy is a small-time fence.
490	00:34:06	00:34:08	That mean anything to you?
491	00:34:15	00:34:17	Does now.
492	00:34:24	00:34:26	Anything I can help you with, let me know.
493	00:34:33	00:34:34	I heard that you dealt in coins.
494	00:34:35	00:34:36	Really?
495	00:34:36	00:34:38	From whom?
496	00:34:38	00:34:39	Grissom.
497	00:34:40	00:34:41	He's a friend of mine.
498	00:34:42	00:34:43	We work together.
499	00:34:44	00:34:46	Uh, looking to see what you got.
500	00:34:46	00:34:48	I'd like to make a trade.
501	00:34:50	00:34:51	Why the flip?
502	00:34:51	00:34:54	I've been meaning to get it slabbed.
503	00:34:58	00:35:00	Not bad.
504	00:35:00	00:35:01	No hairlines.
505	00:35:01	00:35:04	No fly specks.
506	00:35:05	00:35:08	You got yourself a slider.
507	00:35:09	00:35:12	I'd like to get myself a 1916 D dime.
508	00:35:12	00:35:16	Been all over Vegas, can't find one.
509	00:35:16	00:35:17	You got any?
510	00:35:18	00:35:20	I might have one, but it's pricey.
511	00:35:20	00:35:23	Hey, so is mine.
512	00:35:44	00:35:51	1907 Saint Goddins double eagle gold piece.
513	00:35:51	00:35:53	I've only seen that in books.
514	00:35:53	00:35:55	And that's as close as you get.
515	00:35:55	00:35:57	If you want to deal for the D dime, it's yours.
516	00:35:57	00:36:00	I'll take it.
517	00:36:11	00:36:17	The bot was on a different control frequency, which means someone was using a different transmitter.
518	00:36:17	00:36:18	Puppet master.
519	00:36:18	00:36:20	Somebody else pulling the strings.
520	00:36:20	00:36:23	That would explain why the bot was sluggish.
521	00:36:29	00:36:31	So, what's the range of those controllers anyway?
522	00:36:31	00:36:32	It's limited.
523	00:36:32	00:36:34	Definitely not outside this building.
524	00:36:34	00:36:39	So, if somebody hijacked Brian's bot they'd have to be nearby, but... obviously, out of sight.
525	00:36:43	00:36:45	Well, there's a good place to hide up there.
526	00:36:45	00:36:47	Opportunity.
527	00:36:50	00:36:51	Maybe we've got motive.
528	00:36:54	00:36:56	Ooh, proud papa.
529	00:36:56	00:36:59	The man who built Hammer of God.
530	00:37:00	00:37:03	Which leaves us with... means.
531	00:37:05	00:37:07	Transmitter modules.
532	00:37:16	00:37:18	Yeah, check out the 80s.
533	00:37:18	00:37:23	81, 82, 83... 85, 86?
534	00:37:23	00:37:25	84.
535	00:37:27	00:37:28	I bet I know who's got it.
536	00:37:32	00:37:35	Guy came in a couple of weeks ago with this collection looking to sell.
537	00:37:35	00:37:35	I bought it.
538	00:37:35	00:37:38	There must be $50,000 worth of coins in there, isn't there, Greg?
539	00:37:40	00:37:42	At least.
540	00:37:42	00:37:44	You must have a record of the transaction.
541	00:37:44	00:37:46	I know I got it somewhere.
542	00:37:46	00:37:47	Maybe it's in your car.
543	00:37:47	00:37:48	Mind if we help you look?
544	00:37:48	00:37:50	No, go ahead.
545	00:37:50	00:37:52	I got nothing to hide. ( tosses keys )
546	00:37:58	00:38:00	Ten-inch subs.
547	00:38:00	00:38:02	400 watts.
548	00:38:02	00:38:04	Four channels?
549	00:38:04	00:38:05	That's state-of-the-art.
550	00:38:05	00:38:06	Those hot, too?
551	00:38:06	00:38:09	It kind of looks like the DeLorean from Back to the Future.
552	00:38:11	00:38:12	Trace amounts of sulfur.
553	00:38:12	00:38:15	You don't artificially tone your coins, do you, Mr. Jones?
554	00:38:15	00:38:17	Hey, my merchandise is authentic.
555	00:38:19	00:38:23	Well, you may have some authentic blood in your car as well.
556	00:38:27	00:38:30	Yeah, well, I cut my finger the other day.
557	00:38:30	00:38:31	Huh.
558	00:38:31	00:38:33	That's Keith Mercer's blood.
559	00:38:33	00:38:37	You know it and when I get back to the lab, I'm going to prove it.
560	00:38:37	00:38:40	I think you're busted.
561	00:38:49	00:38:52	So... what happened?
562	00:38:52	00:38:54	I lost.
563	00:38:54	00:38:56	You didn't lose.
564	00:38:56	00:38:57	You were destroyed.
565	00:39:06	00:39:07	Ooh!
566	00:39:19	00:39:22	And you wanted revenge.
567	00:39:22	00:39:25	You couldn't kill Christian's bot so you killed Christian.
568	00:39:25	00:39:27	I heard Brian killed him.
569	00:39:27	00:39:31	This is the transmitter from Christian's robot.
570	00:39:31	00:39:32	So?
571	00:39:33	00:39:35	So... it's got your DNA on it.
572	00:39:47	00:39:49	Brian wasn't in control of the bot.
573	00:39:49	00:39:50	You were.
574	00:40:01	00:40:02	Oh, my God!
575	00:40:02	00:40:04	I can't turn it off!
576	00:40:18	00:40:20	The bot wasn't the only thing you manipulated, Luke.
577	00:40:20	00:40:22	Chris! Chris!
578	00:40:23	00:40:24	Oh, my God.
579	00:40:24	00:40:25	What did you do?!
580	00:40:26	00:40:27	It was an accident.
581	00:40:27	00:40:28	The bot just... Oh, my God!
582	00:40:28	00:40:29	Oh, we've got to call the cops!
583	00:40:30	00:40:32	If you do that, they're going to think you did this. I didn't do it.
584	00:40:32	00:40:34	They're going to put you in prison for life.
585	00:40:34	00:40:37	I'll keep this quiet, but you have to get rid of this body.
586	00:40:43	00:40:45	Brian gave you up.
587	00:40:45	00:40:48	No place to hide now.
588	00:40:57	00:41:00	I know what it must've been like for you.
589	00:41:00	00:41:06	Having created something, only to lose it.
590	00:41:06	00:41:08	Let me guess.
591	00:41:08	00:41:10	You have a kid?
592	00:41:10	00:41:12	Yes, I have a daughter.
593	00:41:12	00:41:17	And you think just because you squeeze a baby out from between your legs, you know how I feel?
594	00:41:19	00:41:20	That's biology.
595	00:41:20	00:41:22	Any animal can do that.
596	00:41:23	00:41:25	Uh-huh.
597	00:41:25	00:41:31	But I took a thought from my head and I made it real.
598	00:41:31	00:41:34	It was... perfect.
599	00:41:36	00:41:41	I guess the only flaw then was you.
600	00:41:49	00:41:50	How's it look?
601	00:41:51	00:41:53	Oh.
602	00:41:53	00:41:54	Blood in the car is the victim's.
603	00:42:00	00:42:01	Keith Mercer made a bad call.
604	00:42:02	00:42:03	Yeah, it sounds like a pretty nice collection.
605	00:42:03	00:42:06	How about I come by Saturday and take a look?
606	00:42:06	00:42:07	Uh, this weekend's no good.
607	00:42:07	00:42:08	My wife and I are out of town.
608	00:42:08	00:42:11	Hey, what are you doing?
609	00:42:13	00:42:15	Told you that dude was busted.
610	00:42:15	00:42:17	What happened to your enthusiasm, Greg?
611	00:42:20	00:42:26	Well... every time I make another DNA match in here, my world gets a little smaller.
612	00:42:26	00:42:29	Out there... felt large.
613	00:42:29	00:42:32	Out there means a pay cut.
614	00:42:33	00:42:35	I'm not about the money.
615	00:42:40	00:42:41	That's good to know.
