	start	end	text
0	00:00:17	00:00:18	Ready to go?
1	00:00:18	00:00:19	I'll get the paper. You get the car.
2	00:00:19	00:00:20	Okay.
3	00:00:42	00:00:43	Ooh!
4	00:00:55	00:00:59	Early morning call-out, the worst.
5	00:00:59	00:01:00	Where did you come from?
6	00:01:00	00:01:01	Home.
7	00:01:01	00:01:03	Did you get any sleep?
8	00:01:03	00:01:04	No. You?
9	00:01:04	00:01:05	About a half an hour.
10	00:01:05	00:01:07	I was watching the World Series of Poker.
11	00:01:07	00:01:10	Waiting for Sam Farha to light his cigarette.
12	00:01:10	00:01:12	Ever been to the Acid Drop?
13	00:01:12	00:01:15	I try to avoid those places.
14	00:01:15	00:01:17	The victims were the owners.
15	00:01:17	00:01:20	Mike Trent and his wife Laurel.
16	00:01:20	00:01:23	Both shot execution-style back of the head.
17	00:01:23	00:01:25	A neighbor walking the dog found 'em.
18	00:01:25	00:01:29	Mike used to own a semi-pro hockey team with some other guy.
19	00:01:29	00:01:34	He made a ton of money, sunk it all into clubs like Acid Drop, uh, Psychedelic Hoe-Down...
20	00:01:34	00:01:35	Captain Brass.
21	00:01:35	00:01:37	Fun joints.
22	00:01:37	00:01:40	Looks like they never got out of the driveway.
23	00:01:43	00:01:49	She dropped where she was shot, but he looks like he was dragged.
24	00:01:52	00:01:58	You drag a body away to hide it, not down a driveway for the world to see it.
25	00:01:59	00:02:09	Unless that was the point.
26	00:02:45	00:02:47	Bling-bling.
27	00:02:47	00:02:49	The ol' trophy wife.
28	00:02:49	00:02:51	You think?
29	00:02:51	00:02:54	Classic Vegas.
30	00:02:54	00:03:01	He pays for her boobs, tummy tuck, Prada, weekly spa, French manicure.
31	00:03:01	00:03:06	And she's just hanging on his arm like she belongs.
32	00:03:06	00:03:08	Tell us how you really feel, Catherine.
33	00:03:08	00:03:09	Oh, it's gross.
34	00:03:09	00:03:11	I wouldn't want to be her for the world.
35	00:03:11	00:03:14	I wouldn't mind being her for a day, I guess.
36	00:03:14	00:03:15	Not this day.
37	00:03:15	00:03:16	No.
38	00:03:16	00:03:19	Looks like it was just the two of them.
39	00:03:19	00:03:21	Nobody I know lives like this with kids.
40	00:03:24	00:03:26	Brown.
41	00:03:26	00:03:28	I've been here for 20 minutes.
42	00:03:28	00:03:29	What's the code?
43	00:03:29	00:03:31	You on the East Coast looking for a sunset?
44	00:03:31	00:03:33	I am.
45	00:03:33	00:03:34	You're at the wrong gate.
46	00:03:34	00:03:37	Drive back down the road, make three lefts.
47	00:03:37	00:03:42	When you get to the main gate, speak to Officer Ray and tell her you're with the Crime Lab.
48	00:03:42	00:03:45	When you get to the scene, make sure I'm the first person you speak to.
49	00:03:45	00:03:46	Okay.
50	00:03:51	00:03:51	Mike Trent?
51	00:03:52	00:03:53	Mm-hmm.
52	00:03:53	00:03:56	Boy, he's a big dog in the club world.
53	00:03:56	00:04:01	You know I heard he paid Lil' Kim $10,000 one time just to walk into one of his clubs, turn around and walk back out.
54	00:04:01	00:04:04	Yeah, Jah Rule gets the same fee.
55	00:04:04	00:04:08	He told me.
56	00:04:08	00:04:10	Hey, uh, let me have one of those, Sara.
57	00:04:10	00:04:12	Sorry, last one.
58	00:04:13	00:04:15	You have a cold, Sara?
59	00:04:15	00:04:17	I've been feeling a little run-down lately.
60	00:04:17	00:04:19	Okay, it's a gated community.
61	00:04:19	00:04:21	The main gate has a guard all the time.
62	00:04:21	00:04:25	The resident gate is at the north end, has punch-key access.
63	00:04:25	00:04:28	Those are the only two ways in and out of this place.
64	00:04:28	00:04:31	I thought you moved into communities like this for this not to happen.
65	00:04:32	00:04:35	Hey, Grissom.
66	00:04:35	00:04:36	What do you got?
67	00:04:36	00:04:39	So far, an empty briefcase and a purse.
68	00:04:39	00:04:41	You want us to take the perimeter?
69	00:04:41	00:04:42	Yeah, please.
70	00:04:42	00:04:44	Catherine and Warwick are inside.
71	00:04:44	00:04:47	The bodies were found on the driveway, so any evidence of the killers is going to be out here.
72	00:04:47	00:04:51	I'll check the rear for any sign of forced entry.
73	00:04:51	00:04:54	I'll take the side door.
74	00:04:54	00:04:56	You just get off a shift?
75	00:04:57	00:04:58	Catherine called me.
76	00:04:58	00:04:59	I'm here to help with the case.
77	00:04:59	00:05:01	You look like a man who just rolled out of bed.
78	00:05:01	00:05:03	You all right? Yeah, why?
79	00:05:03	00:05:04	T-shirt, sneakers.
80	00:05:04	00:05:05	You're already a half hour late.
81	00:05:05	00:05:08	Grissom will rip you a new one he sees you like that.
82	00:05:08	00:05:09	Serious?
83	00:05:09	00:05:12	Yeah, it's not a Rebel game. It's a crime scene.
84	00:05:12	00:05:15	See, this is what I'm talking about right here.
85	00:05:15	00:05:18	The battery's not changed out of your flashlight.
86	00:05:18	00:05:19	Kit's open.
87	00:05:20	00:05:22	It's not stocked; no swabs.
88	00:05:22	00:05:24	Did you sterilize your equipment after your last case?
89	00:05:24	00:05:26	Uh, no.
90	00:05:28	00:05:31	See, you know when I'm on call because my clothes are folded next to my bed.
91	00:05:31	00:05:36	Shoes, jacket, ball cap, bottle of water, pen, paper, Thomas Guide, next to the phone.
92	00:05:36	00:05:39	00 in the morning, I'm not scrambled.
93	00:05:39	00:05:42	Everything's there before the phone rings.
94	00:05:42	00:05:43	My game is tight, like my trunk.
95	00:05:43	00:05:44	Check it out.
96	00:05:50	00:05:53	Camera case, tripod, film is in the fridge.
97	00:05:53	00:05:54	Markers, check.
98	00:05:54	00:05:56	Extra field kit, fully stocked, sterilized.
99	00:05:56	00:06:00	Shoeprint lift kit, wet weather gear.
100	00:06:00	00:06:01	Files mama.
101	00:06:04	00:06:05	Forms for days.
102	00:06:05	00:06:10	First Call form, First Officer form, Consent to Search, Bird's Eye View inside, Bird's Eye View outside.
103	00:06:11	00:06:13	It's down to how I like my lunch.
104	00:06:13	00:06:14	Picking up what I'm putting down?
105	00:06:14	00:06:17	Yeah. See, no one ever told me.
106	00:06:17	00:06:18	You've been told.
107	00:06:18	00:06:20	Yes, sir.
108	00:07:12	00:07:13	No sign of disturbance in the rear.
109	00:07:14	00:07:17	Cigarette butts.
110	00:07:17	00:07:19	Orange peel, seeds.
111	00:07:19	00:07:22	Lying in wait, maybe.
112	00:07:22	00:07:24	You still sucking on that same cough drop?
113	00:07:24	00:07:26	Yeah.
114	00:07:26	00:07:28	I'm a... a slow sucker.
115	00:07:28	00:07:33	So, assuming the killer didn't live in the community, how did he gain entry?
116	00:08:19	00:08:20	Crime occurred in the driveway.
117	00:08:20	00:08:23	Nothing to indicate that the suspects were inside the house.
118	00:08:23	00:08:27	Yes, ma'am. I got it.
119	00:08:27	00:08:28	So, then, what are we looking for?
120	00:08:28	00:08:32	Anything inside that'll make the outside make sense.
121	00:08:32	00:08:33	On your hands and knees.
122	00:08:33	00:08:36	Check the carpet for trace.
123	00:09:06	00:09:08	Hey.
124	00:09:08	00:09:10	Greg.
125	00:09:10	00:09:12	I'm going to need you to photograph something.
126	00:09:12	00:09:13	Why, what'd you find?
127	00:09:14	00:09:15	It's what I didn't find.
128	00:09:18	00:09:19	Well, I found something.
129	00:09:19	00:09:21	Blood.
130	00:09:21	00:09:22	Blood?
131	00:09:22	00:09:24	Where?
132	00:09:24	00:09:26	Right here.
133	00:09:31	00:09:34	Ooh, I also found some videos.
134	00:09:34	00:09:37	Looks like amateur porn.
135	00:09:37	00:09:41	Porn. That figures.
136	00:09:41	00:09:44	Sunburn Sin. Ooh.
137	00:09:44	00:09:47	Starring Laurel Lust.
138	00:09:47	00:09:51	That's Laurel Trent.
139	00:09:51	00:09:53	Isn't that the wife?
140	00:09:53	00:09:54	Yeah.
141	00:09:54	00:09:56	A few years back.
142	00:09:56	00:09:58	A Goode/Mike T. Production.
143	00:09:58	00:10:03	Mike T as in Mike Trent?
144	00:10:03	00:10:08	Well, I bet he seduced her, and then he produced her.
145	00:10:08	00:10:11	Laurel Trent definitely had some work done.
146	00:10:11	00:10:13	Implants which she later had removed.
147	00:10:13	00:10:17	She has a four- centimeter-long scar at the edge of the areola.
148	00:10:17	00:10:20	Collapsed fibrous capsules in both breasts.
149	00:10:20	00:10:21	Fascinating.
150	00:10:21	00:10:22	Cause of death?
151	00:10:22	00:10:24	I was just getting to that.
152	00:10:24	00:10:27	Two gunshot wounds to the back of the head, just like her husband.
153	00:10:27	00:10:29	Close range.
154	00:10:29	00:10:31	Either one immediately debilitating and fatal.
155	00:10:31	00:10:33	I sent the bullets to the lab.
156	00:10:33	00:10:36	But this is why I sent for you.
157	00:10:42	00:10:44	Stun gun burns?
158	00:10:48	00:10:51	If you're close enough to stun him, you're close enough to shoot him.
159	00:10:52	00:10:55	And we suspect that there were two assailants.
160	00:10:55	00:10:58	Well, maybe they were trying to buy time.
161	00:10:58	00:11:02	For what?
162	00:11:04	00:11:06	Now, the first order of business is to kill the Trents.
163	00:11:07	00:11:10	Then the suspects go upstairs and rip off Laurel's jewelry.
164	00:11:10	00:11:12	And bail on bikes.
165	00:11:12	00:11:14	That's a little low-rent, don't you think?
166	00:11:14	00:11:19	Yeah, but I'm thinking, in a neighborhood like this, if you burn rubber out of here, it's gonna cause a lot of attention.
167	00:11:19	00:11:21	If you roll quietly away on a bike, though...
168	00:11:21	00:11:24	Ah, no one's the wiser. Okay, I get it.
169	00:11:24	00:11:27	This is the resident gate that Greg called me from; he couldn't get in.
170	00:11:27	00:11:31	He needed a code. Sara did find an orange peel in the side yard.
171	00:11:31	00:11:33	What do you think, sticky fingers?
172	00:11:33	00:11:35	Does citrus illuminate?
173	00:11:35	00:11:37	Sugar will, if it's derivatized.
174	00:11:38	00:11:39	Do you have any fluorescent reagents?
175	00:11:39	00:11:40	I've got ANTS.
176	00:11:41	00:11:44	Not the insect. Amino-naphthalene Trisulfonic acid. trisulfonic acid.
177	00:11:44	00:11:45	You're trying to stump me. I can feel it.
178	00:11:46	00:11:47	Let me check it out.
179	00:11:51	00:11:54	The ANTS should make it light up under the ALS.
180	00:12:07	00:12:11	One, three...
181	00:12:11	00:12:13	five and six.
182	00:12:13	00:12:16	In some configuration.
183	00:12:16	00:12:18	They had the code.
184	00:12:18	00:12:21	We're mid-case. Why do we have to do this now?
185	00:12:21	00:12:25	I have to get this evaluation in, or I'm gonna get written up.
186	00:12:25	00:12:27	Okay.
187	00:12:27	00:12:29	My goals.
188	00:12:29	00:12:31	Mm...
189	00:12:31	00:12:32	Oh, all right, okay.
190	00:12:32	00:12:35	For starters, I'd like two consecutive nights off.
191	00:12:35	00:12:45	I would like to cut my triples down to ten a year instead of the usual 20, and, uh, I would love to find a reliable baby-sitter, so I could have myself some kind of a personal life.
192	00:12:45	00:12:48	You don't have a personal life?
193	00:12:50	00:12:54	I haven't had sex in six-- no-- seven months.
194	00:12:59	00:13:01	How can I help?
195	00:13:03	00:13:05	You. Advance, I mean.
196	00:13:05	00:13:07	Do you...
197	00:13:07	00:13:12	have any interest in changing sections in the lab, for instance? Gil, how do you do this?
198	00:13:12	00:13:16	Honestly, how do you juggle scheduling and vacations and...
199	00:13:16	00:13:21	The goal of any supervisor is to teach someone how to take his place someday.
200	00:13:21	00:13:23	Are you going someplace?
201	00:13:23	00:13:25	You never know.
202	00:13:25	00:13:26	Are you considering me?
203	00:13:26	00:13:28	Why not?
204	00:13:28	00:13:30	You're certainly qualified.
205	00:13:30	00:13:36	But... a CSI who uses the DNA lab to establish her own paternity...
206	00:13:36	00:13:42	calls into question... her judgment, don't you think?
207	00:13:51	00:13:54	You've left that out.
208	00:13:54	00:13:55	Are you covering for me?
209	00:13:55	00:14:00	I believe that we've dealt with this issue, handled it internally.
210	00:14:00	00:14:02	As far as I'm concerned, it's dead.
211	00:14:02	00:14:06	Besides, you'll never do it again.
212	00:14:06	00:14:09	So just sign your name by the red X.
213	00:14:11	00:14:18	Before I sign, um, since we're putting all of our cards on the table, there's something you should know.
214	00:14:18	00:14:25	Sam Braun wrote me a check, and... I cashed it.
215	00:14:27	00:14:30	For how much?
216	00:14:30	00:14:36	Enough to where Lindsay and I can do anything and...
217	00:14:36	00:14:39	not enough to where we can do nothing.
218	00:14:39	00:14:42	Sam Braun was a murder suspect in one of your cases.
219	00:14:42	00:14:44	How does this not look like a payoff?
220	00:14:44	00:14:45	I consulted an attorney.
221	00:14:45	00:14:47	It is a check from a father to a daughter.
222	00:14:47	00:14:49	It is completely out of departmental jurisdiction.
223	00:14:49	00:14:51	What about conflict of interest?
224	00:14:51	00:14:52	Not just for you but for this lab.
225	00:14:52	00:14:55	Gil, I would never compromise you or the lab.
226	00:14:55	00:14:58	Maybe not legally, but ethically?
227	00:15:03	00:15:07	What else should I know, Catherine?
228	00:15:07	00:15:09	That's everything.
229	00:15:24	00:15:25	Talk to me.
230	00:15:25	00:15:27	Orange peels, seeds, cigarette butts.
231	00:15:27	00:15:30	I'm logging them in and moving them to DNA.
232	00:15:30	00:15:34	Okay, so you've gone through her purse, uh, her wallet...
233	00:15:34	00:15:36	Yeah, everything's there-- money, credit cards.
234	00:15:36	00:15:38	Yeah. What about the briefcase?
235	00:15:38	00:15:40	Empty. Stop. I-I got a system here.
236	00:15:40	00:15:43	I found this wadded up in her purse.
237	00:15:43	00:15:46	It's a release form-- permission to film an adult movie at the Acid Drop.
238	00:15:46	00:15:48	From Drake the Snake Productions.
239	00:15:48	00:15:50	Signed by a Drake Snow.
240	00:16:12	00:16:14	I need to see your boss.
241	00:16:14	00:16:16	Follow me.
242	00:16:16	00:16:17	Tonight's for Mike.
243	00:16:17	00:16:21	We pay our respects by ringing the register.
244	00:16:21	00:16:26	Now, I don't mind if you're talking, just as long as they're drinking.
245	00:16:26	00:16:27	Watch the doubles...
246	00:16:27	00:16:30	Uh...
247	00:16:32	00:16:35	Watch the doubles. Be smart.
248	00:16:35	00:16:38	You do that, we're gonna take this party 00 in the morning.
249	00:16:38	00:16:39	And most importantly, have fun.
250	00:16:39	00:16:40	Okay.
251	00:16:40	00:16:43	Go make some money. See you later.
252	00:16:45	00:16:48	You here about Mike?
253	00:16:48	00:16:50	Yes, I am.
254	00:16:50	00:16:52	Let's go somewhere private.
255	00:16:52	00:16:54	Sorry for the inconvenience, everybody.
256	00:16:54	00:16:56	When you come back, next bottle's on me.
257	00:16:56	00:16:58	Go ahead. ( clears throat )
258	00:16:58	00:17:01	Thanks, Chief. We're going to shut her down for about half an hour.
259	00:17:01	00:17:02	Well...
260	00:17:02	00:17:03	this is private.
261	00:17:03	00:17:05	It was, um...
262	00:17:05	00:17:07	It was a real shock, you know?
263	00:17:07	00:17:09	Mike and Laurel getting killed like that.
264	00:17:09	00:17:14	But I got to say, if they had a choice how to go out, it would have been together.
265	00:17:14	00:17:17	For him, the sun rose and set with her.
266	00:17:17	00:17:20	He didn't treat her like a trophy wife?
267	00:17:20	00:17:22	No. You kidding?
268	00:17:22	00:17:27	No. He got her off the VHS covers, and she made a home for him.
269	00:17:27	00:17:28	You know?
270	00:17:28	00:17:30	Have a seat.
271	00:17:32	00:17:34	Um, and what was, uh...
272	00:17:34	00:17:37	What was your professional affiliation with him?
273	00:17:37	00:17:40	I run his clubs.
274	00:17:40	00:17:43	Ever since he got out of the partner business with Kyle Goode.
275	00:17:44	00:17:48	Have you seen this Mr. Goode lately?
276	00:17:48	00:17:50	He shows his face every once in a while.
277	00:17:50	00:17:52	I just try to keep him away from Mike, you know?
278	00:17:52	00:17:54	As much as humanly possible.
279	00:17:55	00:17:57	And...
280	00:17:57	00:18:00	what about this Drake Snow guy?
281	00:18:00	00:18:01	Drake?
282	00:18:01	00:18:02	Drake the Snake.
283	00:18:02	00:18:04	I, uh...
284	00:18:04	00:18:05	I hired him. He's harmless.
285	00:18:05	00:18:07	He saw one Ron Jeremy movie.
286	00:18:07	00:18:09	Now the guy just sees dollar signs.
287	00:18:11	00:18:14	Uh, and how did he get along with the Trents?
288	00:18:14	00:18:16	Why don't you go ask him?
289	00:18:16	00:18:18	Reading my mind.
290	00:18:18	00:18:20	Mm.
291	00:18:21	00:18:22	You, uh...
292	00:18:23	00:18:24	You never gave me your name.
293	00:18:24	00:18:25	Oh.
294	00:18:25	00:18:26	Catherine.
295	00:18:26	00:18:28	Catherine.
296	00:18:28	00:18:29	Willows.
297	00:18:30	00:18:32	Chris Bezich.
298	00:18:32	00:18:34	Chris Bezich.
299	00:18:34	00:18:36	Come on.
300	00:18:36	00:18:39	Mike and Kyle-- they made all their money out of Laurel taking it off.
301	00:18:39	00:18:42	She-She was a cash register in panties is what she was.
302	00:18:42	00:18:44	And you wanted in?
303	00:18:44	00:18:45	No. Trust me.
304	00:18:45	00:18:48	The last thing that I wanted was to be partners with Mike.
305	00:18:48	00:18:51	Guy'd... Guy'd chew you up and spit you out soon as look at you.
306	00:18:51	00:18:52	And Kyle-- forget it.
307	00:18:52	00:18:55	Guy'd tell you right to your face he's sticking it to you.
308	00:18:55	00:18:56	Pasadena, baby.
309	00:18:56	00:18:58	I got my own plans.
310	00:18:58	00:18:59	I-I just... I just need a location.
311	00:18:59	00:19:01	One location.
312	00:19:01	00:19:02	And what?
313	00:19:02	00:19:05	Mike didn't agree to it?
314	00:19:05	00:19:06	Didn't ask him.
315	00:19:06	00:19:09	Last time I asked him for something, he took a swing at me.
316	00:19:10	00:19:10	Get the hell out of my...
317	00:19:10	00:19:13	I just want the same shot that you had, Mike.
318	00:19:13	00:19:14	Laurel said that...
319	00:19:14	00:19:15	You two aren't in business anymore.
320	00:19:17	00:19:19	In the kitchen, you said?
321	00:19:20	00:19:21	Yeah.
322	00:19:21	00:19:24	So, I wasn't going to make that mistake again, so I had to try something different.
323	00:19:24	00:19:25	So, I pulled a Geffen.
324	00:19:25	00:19:26	I went straight to Yoko.
325	00:19:26	00:19:30	Oh, you gave Laurel the release form.
326	00:19:30	00:19:32	Yeah. She was going to give it to Mike.
327	00:19:32	00:19:35	He was going to sign it, and they were going to get it back to me.
328	00:19:35	00:19:36	So much for that.
329	00:19:36	00:19:37	All right. So, uh, listen, Drake.
330	00:19:37	00:19:39	I'm going to help you get that dream shot.
331	00:19:39	00:19:44	So that when you do get into the porn biz, you won't have a murder rap hanging over your head.
332	00:19:44	00:19:46	Here.
333	00:19:46	00:19:47	Crime Scene 101.
334	00:19:48	00:19:50	Stick this in your mouth.
335	00:19:50	00:19:52	Hey, you can set 'em right there.
336	00:19:52	00:19:56	Can't believe that there's this many abandoned bikes in Charleston Hills.
337	00:19:56	00:20:01	These were found in the alley behind the Fire Department, so check them out.
338	00:20:14	00:20:16	Sugar on the handlebars of both bikes.
339	00:20:16	00:20:17	Just like the keypad.
340	00:20:18	00:20:19	So we may have our getaway bikes.
341	00:20:19	00:20:22	We could check the serial numbers, but they're usually not recorded.
342	00:20:26	00:20:28	You know what? I got an idea.
343	00:20:28	00:20:31	Hmm?
344	00:20:31	00:20:33	What are you doing?
345	00:20:38	00:20:40	Get me a pair of tweezers, will you?
346	00:20:51	00:20:53	Now how did you know that receipt was in there?
347	00:20:53	00:20:54	Well, I used to read point spreads.
348	00:20:55	00:20:55	Now I read books.
349	00:20:56	00:20:57	Good for you.
350	00:20:57	00:21:00	Bad for Ross Davis, though.
351	00:21:02	00:21:04	This is a little intense for getting my bike stolen.
352	00:21:04	00:21:06	I already got a new one.
353	00:21:06	00:21:07	Did you report it?
354	00:21:07	00:21:08	No. You're kidding me, right?
355	00:21:08	00:21:10	I got jumped, man.
356	00:21:10	00:21:11	By whom?
357	00:21:11	00:21:12	By two bucked-ass brothers.
358	00:21:12	00:21:14	They were both yoked as hell.
359	00:21:14	00:21:15	Ripped.
360	00:21:15	00:21:17	I thought for a second they were going to kill me.
361	00:21:19	00:21:20	Hey, hey.
362	00:21:24	00:21:25	Something wrong with your neck?
363	00:21:25	00:21:26	Man, it's killing me.
364	00:21:26	00:21:31	I don't know what the hell they hit me with, but my knees was the first to go.
365	00:21:33	00:21:35	I believe you were hit with a stun gun.
366	00:21:35	00:21:37	Just like Mike Trent.
367	00:21:44	00:21:45	I found something on your butt.
368	00:21:45	00:21:47	Checking out my butt again, Greg?
369	00:21:47	00:21:48	I was.
370	00:21:48	00:21:51	As well as the four butts Sara got at the crime scene.
371	00:21:51	00:21:52	Oh.
372	00:21:52	00:21:55	Found something on them that I can't explain, so I sent them over to Hodges.
373	00:21:55	00:21:57	Your butt's fine.
374	00:21:58	00:21:59	Switching gears.
375	00:21:59	00:22:02	Blood found in the Trents' bedroom is a match to Drake Snow.
376	00:22:02	00:22:06	So he told the truth about the blood and lied about the kitchen.
377	00:22:06	00:22:07	Figures.
378	00:22:07	00:22:11	Three of the four cigarette butts are also a match to Drake.
379	00:22:11	00:22:12	Puts him at the scene.
380	00:22:12	00:22:14	And the fourth butt?
381	00:22:14	00:22:17	Female, not a match to Laurel Trent.
382	00:22:17	00:22:18	Orange seeds?
383	00:22:18	00:22:19	Two additional donors, both male.
384	00:22:19	00:22:21	Not a match to any of our players.
385	00:22:21	00:22:23	No hits on CODIS.
386	00:22:23	00:22:26	So we're looking for two guys and a gal who might know Drake.
387	00:22:26	00:22:28	We already know you lied.
388	00:22:28	00:22:32	We found your blood in the Trents' bedroom, not in the kitchen.
389	00:22:32	00:22:34	So what were you doing in there?
390	00:22:34	00:22:36	You putting the shot in her, or what?
391	00:22:36	00:22:37	Hey, look.
392	00:22:38	00:22:39	I know where you're going with this.
393	00:22:40	00:22:42	Okay, I was in the bedroom.
394	00:22:42	00:22:45	She wasn't on her knees. I was.
395	00:22:45	00:22:47	I was begging. Not for sex.
396	00:22:47	00:22:49	I was begging for my business.
397	00:22:50	00:22:51	Drake the Snake Productions.
398	00:22:51	00:22:55	Mike comes busting in, goes ballistic, smacks me in the nose...
399	00:22:55	00:23:00	I mean, I know I keep coming back to this three-and-out thing, but maybe because you're in bed with his wife.
400	00:23:00	00:23:02	Laurel and I didn't have sex in the bedroom.
401	00:23:02	00:23:06	We had it on the set-- past tense, long time ago.
402	00:23:06	00:23:07	Then along came Mike.
403	00:23:07	00:23:09	Mike was good for Laurel.
404	00:23:09	00:23:11	Mike was not good for me.
405	00:23:11	00:23:13	She got carte blanche-- Laurel.
406	00:23:13	00:23:14	Me, I got a bar back.
407	00:23:14	00:23:18	Now I'm popping blue pills looking for something to bring me down, but I know the business.
408	00:23:18	00:23:21	I just don't have the capital to get behind the camera.
409	00:23:21	00:23:23	So what does killing the Trents get you?
410	00:23:25	00:23:27	Zero.
411	00:23:27	00:23:31	No one was more upset than me.
412	00:23:31	00:23:33	You're still pouring drinks. Boo-hoo.
413	00:23:33	00:23:36	And what are you doing smoking around their place?
414	00:23:38	00:23:39	What?
415	00:23:39	00:23:42	Yeah, we found cigarette butts with your DNA on it on their property.
416	00:23:42	00:23:45	I don't know what you're talking about.
417	00:23:45	00:23:46	I don't.
418	00:23:46	00:23:48	I smoke one place, okay?
419	00:23:48	00:23:50	I smoke at work.
420	00:23:50	00:23:51	I'm down to one a day.
421	00:23:51	00:23:55	Right after happy hour, I have my one cigarette, and it's out back by the service register.
422	00:23:55	00:23:56	You ask anybody.
423	00:23:58	00:24:00	Drake's telling the truth, you know?
424	00:24:00	00:24:01	He smokes one a day.
425	00:24:01	00:24:03	Not on the floor, right here, my rule.
426	00:24:04	00:24:07	Mm-hmm, well, still have to verify it with evidence.
427	00:24:10	00:24:12	You verify everything?
428	00:24:12	00:24:15	Everything.
429	00:24:15	00:24:17	Including you.
430	00:24:17	00:24:20	You're clear.
431	00:24:20	00:24:23	Can you blame Drake, you know?
432	00:24:24	00:24:26	He's trying to give up cigarettes.
433	00:24:26	00:24:28	That's like me trying to give up...
434	00:24:28	00:24:30	Sex?
435	00:24:30	00:24:34	Everybody needs to indulge in a vice at least once a day, right?
436	00:24:34	00:24:40	Yes, well, I did happen to notice those little waitress girlies trying to serve their way into bed with you.
437	00:24:40	00:24:43	That's work.
438	00:24:43	00:24:45	I prefer women.
439	00:24:45	00:24:48	Speaking of work, do you, um...
440	00:24:48	00:24:50	ever get a day off?
441	00:24:54	00:24:55	What?
442	00:24:55	00:24:57	You want to get to know me?
443	00:24:57	00:24:59	Yes.
444	00:25:12	00:25:13	Um...
445	00:25:13	00:25:15	What?
446	00:25:15	00:25:16	Wait. Hang on.
447	00:25:17	00:25:18	I'm on the clock.
448	00:25:21	00:25:23	You started it.
449	00:25:23	00:25:26	Yes, and when the time is right, maybe I'll finish it.
450	00:25:38	00:25:39	How you feeling?
451	00:25:39	00:25:41	Hey. What do you mean?
452	00:25:41	00:25:44	Well, you were popping cough drops at the scene the other day a mile a minute.
453	00:25:44	00:25:46	I thought I was coming down with a cold.
454	00:25:46	00:25:48	Ah.
455	00:25:48	00:25:50	Yeah, I, uh...
456	00:25:50	00:25:53	I understand colds.
457	00:25:53	00:26:00	You know, back in Jersey when I was getting it from both ends, from my wife and my work, things started to get heavy.
458	00:26:00	00:26:03	I started medicating.
459	00:26:03	00:26:05	Cure my cold.
460	00:26:05	00:26:13	And, um, and God forbid I had an early morning roll-out and I had that tell-tale breath, you know what I mean?
461	00:26:13	00:26:19	So I would dodge my supe, and I started popping cough drops.
462	00:26:19	00:26:22	Huh.
463	00:26:22	00:26:25	I mean, what I'm trying to say is that...
