	start	end	text
427	00:29:17	00:29:19	I mean, he was wearing a mask.
428	00:29:19	00:29:22	It all happened pretty quick.
429	00:29:22	00:29:25	Why?
430	00:29:25	00:29:29	We're looking for a rapist who masquerades as a fireman.
431	00:29:30	00:29:35	He uses smoke bombs to get his victims to open their doors.
432	00:29:36	00:29:38	He knocked on my door.
433	00:29:38	00:29:42	Are you saying you think he was going to rape me?
434	00:29:42	00:29:43	It's possible.
435	00:29:43	00:29:48	You know, I was pretty freaked.
436	00:29:49	00:29:52	When he was standing there in front of me...
437	00:29:56	00:30:04	Just before he left, I swear, for a second, it felt like he wasn't going to let me go.
438	00:30:09	00:30:11	Turnouts were a dead end.
439	00:30:11	00:30:14	And there's nothing to track off of the smoke bombs.
440	00:30:14	00:30:18	I've got hundreds of names of people who purchased nitrous oxide in the last six months.
441	00:30:18	00:30:20	What? You got to narrow that down.
442	00:30:20	00:30:22	That is narrowed down.
443	00:30:24	00:30:26	Okay. Our rapist is a foot fetishist.
444	00:30:26	00:30:27	That's what gets him off.
445	00:30:27	00:30:30	He has to see his victim's feet somewhere.
446	00:30:30	00:30:34	If we can figure out where, maybe we can find him.
447	00:30:34	00:30:36	What do the victims have in common?
448	00:30:38	00:30:40	Christina Hollis.
449	00:30:40	00:30:42	African American. Single.
450	00:30:42	00:30:44	Lives and works at the Omni.
451	00:30:44	00:30:49	She lives on the 11th floor, so there's no real way for a peeper to see in.
452	00:30:49	00:30:53	And she uses the gym, but not the pool.
453	00:30:53	00:30:57	Stephanie Daniels lives across town. Caucasian. Also single.
454	00:30:57	00:31:01	No gym membership, but she does use the pool at her apartment complex regularly.
455	00:31:01	00:31:04	There's a couple of adjacent buildings.
456	00:31:04	00:31:08	It's possible that somebody could see into her place with a telescope, but she has shades and curtains.
457	00:31:09	00:31:11	I kind of doubt it.
458	00:31:11	00:31:13	So they have nothing in common.
459	00:31:13	00:31:16	Sure, they do. They both have feet.
460	00:31:16	00:31:21	We may have a third victim who may also be our first victim.
461	00:31:21	00:31:28	Tara Weathers. Last month, she claimed she was drugged in a bar and woke up in her apartment with her toes freshly painted.
462	00:31:28	00:31:31	They did a tox on her at the time.
463	00:31:31	00:31:33	Found lorazepam in her system.
464	00:31:36	00:31:38	Well, she does have nice feet.
465	00:31:39	00:31:43	And the nail polish looks like a similar shade to Christina Hollis'.
466	00:31:43	00:31:45	Yeah. So the pattern starts a month ago.
467	00:31:45	00:31:51	Our guy drugs Tara Weathers in a bar, takes her to her apartment, paints her toes, leaves.
468	00:31:51	00:31:54	Two weeks later, he steps it up.
469	00:31:54	00:32:00	Poses as a firefighter, places smoke bombs in an apartment building, only things don't work out the way that he planned.
470	00:32:00	00:32:03	The building catches fire, and he runs.
471	00:32:03	00:32:08	He waits a couple more weeks, he does it again, but this time he goes all the way.
472	00:32:08	00:32:09	Yeah. And now he's escalating.
473	00:32:09	00:32:12	Where does he go from here?
474	00:32:17	00:32:18	Tara Weathers?
475	00:32:18	00:32:20	I'm Jim Brass, Las Vegas Police.
476	00:32:20	00:32:22	This is Catherine Willows from the Crime Lab.
477	00:32:22	00:32:23	What do you want?
478	00:32:23	00:32:27	Well, we're here to ask you about the incident you reported to the police last month.
479	00:32:27	00:32:28	The nail polish thing?
480	00:32:28	00:32:29	Yeah, the nail polish thing.
481	00:32:29	00:32:33	You guys said I should consider myself lucky, that there was no real crime anyway.
482	00:32:33	00:32:35	Well, we may have been wrong about that.
483	00:32:35	00:32:38	I knew it, that's what I tried to tell you the first time.
484	00:32:41	00:32:47	The guy who drugged you is a rapist and a murderer, and we're looking to stop him before he does it again.
485	00:32:47	00:32:48	Are you serious?
486	00:32:48	00:32:49	Very.
487	00:32:49	00:32:53	We're trying to understand what you have in common with the other victims that might lead us to him.
488	00:32:53	00:32:55	Now he has a foot fetish.
489	00:32:55	00:32:56	He's into feet.
490	00:32:56	00:33:00	Is there any way that he could've... seen your feet?
491	00:33:00	00:33:01	Um...
492	00:33:01	00:33:04	I-I... I don't know.
493	00:33:04	00:33:05	Where do you buy your shoes?
494	00:33:05	00:33:07	All over.
495	00:33:07	00:33:09	Do you go to a gym? No, not really.
496	00:33:09	00:33:10	Pool?
497	00:33:10	00:33:12	No, never. I burn easily.
498	00:33:12	00:33:14	I'm a legal secretary, I don't get out much.
499	00:33:14	00:33:18	My work starts early and it goes late.
500	00:33:18	00:33:21	The firm is so conservative, we're not even allowed to wear open-toed shoes.
501	00:33:21	00:33:23	I notice that you do yoga.
502	00:33:23	00:33:24	Yeah.
503	00:33:25	00:33:26	Where?
504	00:33:26	00:33:27	Out on the balcony.
505	00:33:27	00:33:29	It's practically the only fresh air I get.
506	00:33:43	00:33:47	Anybody in those apartments has a clear view of her bare feet.
507	00:33:47	00:33:50	So how'd you get the warrant?
508	00:33:50	00:33:53	The tenant's name was on the nitrous oxide list.
509	00:33:54	00:33:55	Las Vegas Police.
510	00:33:55	00:33:57	Open up, we have a warrant.
511	00:33:57	00:33:59	Open up, police.
512	00:33:59	00:34:01	Open it.
513	00:34:03	00:34:05	Let's go.
514	00:34:05	00:34:07	No, no, no, you're not going in there, no.
515	00:34:07	00:34:09	Can you please take this in, it's a flashlight cam.
516	00:34:09	00:34:11	It'll record anything you point it at.
517	00:34:13	00:34:14	All clear.
518	00:34:15	00:34:16	Thanks.
519	00:34:32	00:34:34	Perfect view of Tara's balcony.
520	00:34:43	00:34:47	Yoga flyers from all over town.
521	00:34:51	00:34:54	Guy's got everything he needs for a pedicure.
522	00:35:08	00:35:11	Hey, check this out.
523	00:35:12	00:35:15	God bless the internet.
524	00:36:00	00:36:03	Fireman's air tank case.
525	00:36:07	00:36:09	Where's the tank?
526	00:36:18	00:36:20	Yeah, this is Brass.
527	00:36:20	00:36:22	I want to put a broadcast out on Richard McQueen.
528	00:36:22	00:36:25	That's M-C-Q-U-E-E-N.
529	00:36:25	00:36:27	Copy. ( cell phone blips )
530	00:36:27	00:36:28	Candle wax on the camera.
531	00:37:02	00:37:04	There, send it to the monitor.
532	00:37:22	00:37:24	Stay down!
533	00:37:24	00:37:26	Las Vegas P.D.!
534	00:37:26	00:37:28	Las Vegas P.D., break it up!
535	00:37:28	00:37:29	Break it up!
536	00:37:29	00:37:31	What the hell's going on here? Smoke bombs.
537	00:37:31	00:37:32	We caught this creep sneaking away.
538	00:37:32	00:37:35	My guys tried to stop him.
539	00:37:35	00:37:37	She wouldn't let me touch her feet.
540	00:37:37	00:37:39	You should see what he did?
541	00:38:15	00:38:19	Women are four times more likely than men to be the victims of a sex-related murder.
542	00:38:19	00:38:23	And men are ten times more likely than women to be the murderer.
543	00:38:23	00:38:25	It's just the way it is.
544	00:38:44	00:38:46	Is that your daughter?
545	00:38:46	00:38:49	Oh, yeah, these are old pictures.
546	00:38:49	00:38:51	She's a teenager now.
547	00:38:51	00:38:54	With all the things you see on this job, do you ever worry about her?
548	00:38:54	00:38:56	Are you kidding?
549	00:38:56	00:38:58	I keep a vial of her blood in my freezer.
550	00:38:58	00:39:04	Like as a DNA sample in case you need to identify her?
551	00:39:04	00:39:07	Well...
552	00:39:07	00:39:14	One thing you learn doing this job is that bad things happen to people who never expect it...
553	00:39:14	00:39:16	every day.
554	00:39:26	00:39:28	Yeah, we got a confession.
555	00:39:28	00:39:31	He didn't choose women's feet, women's feet chose him.
556	00:39:31	00:39:35	He lit candles, he played music, he thought he was on a date.
557	00:39:35	00:39:37	But did he explain, you know, why he did it?
558	00:39:37	00:39:39	Oh, yeah. Oh, sure.
559	00:39:39	00:39:46	His mother was a hooker, she put him under the bed when she did her business, her feet dangled over the edge of the bed.
560	00:39:46	00:39:48	He watched her feet, they were perfect.
561	00:39:48	00:39:50	You know, I don't know if it's true.
562	00:39:50	00:39:53	What about the fireman thing?
563	00:39:53	00:39:56	I don't know, I guess he wanted to be a fireman when he grew up.
564	00:39:56	00:39:59	Didn't you?
565	00:39:59	00:40:01	Look, juries love explanations, they want it nice and neat.
566	00:40:01	00:40:06	They don't want to know we live in a random world, they want meaning.
567	00:40:06	00:40:08	It's that simple.
568	00:40:08	00:40:10	So how do you cope with a day like today?
569	00:40:10	00:40:12	What do you do?
570	00:40:12	00:40:21	What do you want me to tell you, that I go home, I get drunk, I go to a bar, I stay out all night, I don't sleep... huh?
571	00:40:21	00:40:22	That's not the truth. You know what happens?
572	00:40:23	00:40:25	I take care of myself, I sleep very well.
573	00:40:25	00:40:30	How well did you sleep after you learned you killed that fellow officer in that shootout last year?
574	00:40:36	00:40:38	Uh, yeah.
575	00:40:38	00:40:39	Oh, is this... is that...
576	00:40:39	00:40:40	Oh, is this what this is about?
577	00:40:40	00:40:42	Who've you been talking to, huh?
578	00:40:42	00:40:45	What, you come here with your camera and you roll a little film and...
579	00:40:45	00:40:48	what, you think you know what it's like to be a cop?
580	00:40:48	00:40:50	You?
581	00:40:51	00:40:53	You're all done. You're all done with this.
582	00:40:53	00:40:55	Get out of here.
583	00:40:58	00:41:02	The truth is if there isn't any evidence, we have nowhere to go.
584	00:41:02	00:41:04	So you feel you did the best you could?
585	00:41:04	00:41:05	Yes, I do.
586	00:41:06	00:41:10	Do you think forensic shows are just teaching the criminals how to get away with crimes?
587	00:41:10	00:41:13	Everyone learns from science.
588	00:41:13	00:41:16	It all depends on how you use the knowledge.
589	00:41:21	00:41:23	Keep going, go inside for a close-up.
