	start	end	text
399	00:28:09	00:28:11	This time, we're going to throw away the key.
400	00:28:11	00:28:13	Mr. Contranos has no interest in speaking to you.
401	00:28:13	00:28:17	We're talking about the difference between life without parole and the needle, here.
402	00:28:17	00:28:20	He's prepared to do his time.
403	00:28:26	00:28:30	Grissom, I managed to get a hit off of that sniper cartridge case.
404	00:28:30	00:28:33	Links up to a drug rip-off in L.A. last year-- unsolved.
405	00:28:33	00:28:35	What about the phone records from the motel?
406	00:28:35	00:28:37	Fausto made one call about an hour before he died.
407	00:28:37	00:28:40	We ran it down to a disposable mobile phone.
408	00:28:40	00:28:43	So is there anything I can tell the undersheriff?
409	00:28:43	00:28:46	Yeah. Dead end on Fausto.
410	00:28:46	00:28:47	You tell him.
411	00:29:01	00:29:03	I got your results from the blood on the bullet.
412	00:29:03	00:29:05	It definitely belongs to Officer Bell.
413	00:29:08	00:29:11	This is my first deceased police officer.
414	00:29:11	00:29:13	I heard that his wife is pregnant.
415	00:29:13	00:29:16	Wendy, you understand that this is confidential.
416	00:29:16	00:29:19	Yes, sir. And you can't discuss it, even with your coworkers.
417	00:29:19	00:29:22	I understand what this means.
418	00:29:31	00:29:34	Hey. Warrick tell you about the IBIS hit?
419	00:29:34	00:29:35	Yeah.
420	00:29:35	00:29:38	How are you doing with Bell's bullet?
421	00:29:38	00:29:39	I was confirming my findings.
422	00:29:39	00:29:42	Don't want to make any mistakes.
423	00:29:42	00:29:43	Does that mean you have results?
424	00:29:44	00:29:47	The bullet has the right GRC's for a Sig-Sauer.
425	00:29:47	00:29:49	Sergeant Adams carries a Beretta.
426	00:29:49	00:29:50	Carroll, too.
427	00:29:50	00:29:52	Davis has a Glock, so that rules him out.
428	00:29:52	00:29:56	However, both detectives Brass and Curtis carry Sigs.
429	00:29:58	00:30:00	But take a look.
430	00:30:04	00:30:09	There's hardly any jacket left. Means there's almost no chance of identifying that to a specific gun.
431	00:30:09	00:30:11	What if you had more time? Could you do it?
432	00:30:11	00:30:16	Sorry, boss. I mean, there's just no way I can tell you who shot Officer Bell.
433	00:30:17	00:30:24	You know, based on the dates of these address labels, it appears that Carlos and Bianca were receiving two to three drug shipments a day.
434	00:30:24	00:30:27	So the dogs hit on the boxes?
435	00:30:27	00:30:33	Yes, and Narco found trace amounts of cocaine, for whatever that's worth.
436	00:30:33	00:30:40	Well, the return addresses are all bogus, the couple is not talking, and all four suspects are dead.
437	00:30:40	00:30:42	There's nothing more we can do.
438	00:30:53	00:30:58	Okay, Nick, the cruiser's right front tire is 19 feet, 5 inches from the south curb.
439	00:31:01	00:31:05	Sara, the detective unit's left front tire is five feet to inches from the south curb.
440	00:31:10	00:31:11	All right.
441	00:31:11	00:31:13	Nick, you be Brass.
442	00:31:13	00:31:14	Sara, you be Sofia.
443	00:31:14	00:31:16	Good.
444	00:31:16	00:31:18	I'll be Bell.
445	00:31:18	00:31:22	Officer Bell was crouched down behind his door.
446	00:31:31	00:31:34	Gris! I can't see you from here.
447	00:31:34	00:31:37	You're blocked by both cars.
448	00:31:37	00:31:38	Yeah, me either.
449	00:31:38	00:31:40	I'd have to shoot through both cars to get to you.
450	00:31:40	00:31:44	I processed them both-- no shots entered from the back.
451	00:31:46	00:31:48	Can you see me here?
452	00:31:50	00:31:53	Yeah, I can see you. Yeah, now.
453	00:31:55	00:31:57	What would make Bell stand up in the middle of a gunfight?
454	00:31:58	00:32:00	Maybe he had to change positions.
455	00:32:00	00:32:03	We know that the suspects were starting to run, right?
456	00:32:04	00:32:06	Okay, he popped up, took one in the vest.
457	00:32:08	00:32:10	Let's assume that.
458	00:32:10	00:32:17	We'll line up the exit trajectories with the apartment window, and we'll use lasers, but we may have to wait until it's dark.
459	00:32:21	00:32:23	We're turning on the lasers.
460	00:32:23	00:32:25	Is the candle in position?
461	00:32:25	00:32:28	Ready on this end.
462	00:32:28	00:32:30	Let me know when the beam hits the candle.
463	00:32:30	00:32:31	Good to go!
464	00:32:38	00:32:40	Uh... good height.
465	00:32:40	00:32:42	Move it six inches to the left.
466	00:32:42	00:32:44	Six inches to the left.
467	00:32:47	00:32:49	Oh, no, no. My left.
468	00:32:49	00:32:51	He meant the other left.
469	00:33:00	00:33:01	Right there.
470	00:33:01	00:33:02	Perfect.
471	00:33:02	00:33:04	I'll call you back.
472	00:33:04	00:33:06	Okay, we got the exit.
473	00:33:06	00:33:08	Now we need the entrance.
474	00:33:08	00:33:09	Sara, turn your laser on.
475	00:33:14	00:33:16	The path of my laser is off.
476	00:33:16	00:33:17	Yeah, it's a bad angle.
477	00:33:17	00:33:19	Move it to the left.
478	00:33:21	00:33:23	Gris... Hmm?
479	00:33:23	00:33:25	It's blocked by the car.
480	00:33:25	00:33:27	It's not possible.
481	00:33:27	00:33:29	Turn it off.
482	00:33:29	00:33:31	Nick, turn yours on.
483	00:33:31	00:33:33	Mine's been on the whole time.
484	00:33:33	00:33:35	It's still blocked.
485	00:33:40	00:33:41	Raise it up.
486	00:34:03	00:34:05	He stood up.
487	00:34:34	00:34:36	Well, your call was a little cryptic.
488	00:34:36	00:34:40	Must've got the results from the ballistics test.
489	00:34:40	00:34:46	We did, but it was inconclusive, so I went back to the intersection and ran a reconstruction.
490	00:34:46	00:34:48	Well, I don't know how you reconstruct a war zone.
491	00:34:48	00:34:50	You have no idea what it was like.
492	00:34:50	00:34:52	I mean, it was a fire fight.
493	00:34:54	00:34:56	Have you talked to Sofia?
494	00:34:58	00:35:01	It wasn't Sofia.
495	00:35:05	00:35:07	You must have stood up...
496	00:35:07	00:35:10	fired at the suspects over the black and whites.
497	00:35:10	00:35:14	Officer Bell stood up at the same time, right into your line of fire.
498	00:35:14	00:35:17	Fausto shot him in the vest, which spun him a little.
499	00:35:17	00:35:20	At the same time, you hit him in the neck.
500	00:35:22	00:35:27	( sighs ) Oh, I-I swear, I was behind the car, I...
501	00:35:27	00:35:29	I-I stood up?
502	00:35:34	00:35:39	Sheriff wants me to present our findings at a community meeting in an hour.
503	00:35:47	00:35:49	Don't keep 'em waiting.
504	00:36:03	00:36:08	I just received a report from the Shooting Review Board.
505	00:36:10	00:36:12	You've been cleared.
506	00:36:16	00:36:19	You can go back to work.
507	00:36:22	00:36:24	Thank you.
508	00:36:36	00:36:39	Hello. My name is Dr. Gil Grissom.
509	00:36:39	00:36:45	I'm the night shift supervisor for the Las Vegas Police Department's Crime Lab.
510	00:36:45	00:36:48	( murmuring fades ) I'm not a police officer; I'm a scientist.
511	00:36:48	00:36:50	You work for the cops. That makes you a cop.
512	00:36:50	00:36:51	You're not on our side.
513	00:36:58	00:37:00	Actually, I'm a forensics expert.
514	00:37:00	00:37:10	( murmuring fades ) My job is to identify, collect, and examine physical evidence from a crime scene, to determine who did what to whom and how did they do it.
515	00:37:10	00:37:18	I've been asked to come here today by the mayor and Sheriff Burdick to present our analysis of the evidence in this case to your community.
516	00:37:18	00:37:21	Why aren't they here? Why should we believe your evidence?
517	00:37:24	00:37:27	Physical evidence cannot be wrong.
518	00:37:27	00:37:28	It doesn't lie.
519	00:37:29	00:37:32	It's not influenced by emotion or prejudice. ( murmuring fades )
520	00:37:32	00:37:36	It's... it's not confused by the excitement of the moment.
521	00:37:36	00:37:45	I'm here, in God's house, to explain to you the truth about exactly what happened the other day.
522	00:37:46	00:37:50	I'd like to start by showing you some photos.
523	00:37:50	00:37:57	This is a bullet that was recovered from the Kevlar vest of Officer Daniel Bell, now deceased.
524	00:37:57	00:37:59	What about my son?
525	00:37:59	00:38:03	What-What does the evidence say about my son?
526	00:38:05	00:38:07	Okay, if you like, we can start there.
527	00:38:07	00:38:09	Please.
528	00:38:11	00:38:14	This photo is a comparison of two cartridge cases.
529	00:38:14	00:38:17	The one on the right was found next to your son.
530	00:38:17	00:38:23	The one on the left was test-fired from Jose Fausto's pistol.
531	00:38:23	00:38:30	As you can see, there are corresponding individual marks on both cartridges.
532	00:38:30	00:38:33	These are unique, like fingerprints.
533	00:38:33	00:38:37	It means that they were fired from the same gun.
534	00:38:37	00:38:41	It proves that while attempting to escape from the police...
535	00:38:41	00:38:45	Jose Fausto shot your son Geraldo in the back.
536	00:38:45	00:38:46	Why would he do that?
537	00:38:48	00:38:52	We recovered your son's bicycle from Jose Fausto's motel room.
538	00:38:52	00:38:55	Your son was on his way to football practice.
539	00:38:58	00:39:05	It appears that Jose Fausto shot your son so he could use his bike.
540	00:39:53	00:39:57	Jim, I was just on my way out, but if you want me to stay...
541	00:39:57	00:39:59	No, I-I think I can handle it. I think.
542	00:39:59	00:40:01	Thanks. Okay.
543	00:40:48	00:40:52	The Shooting Review Board wants to talk to you.
544	00:40:52	00:40:59	You're going to have to explain your tactical decision for shooting in the direction of a fellow officer.
545	00:40:59	00:41:03	I'm ready when they are.
546	00:41:03	00:41:06	As far as I'm concerned, there's no question...
547	00:41:06	00:41:09	it was a bad shoot.
548	00:41:13	00:41:15	I'll have to live with that.
549	00:41:37	00:41:39	( chuckles ) Oh, whoa!
550	00:41:40	00:41:43	Hey. What's your name?
551	00:41:43	00:41:45	Jeannie. Well, that's a pretty name.
552	00:41:48	00:41:49	Is that your mom over there?
553	00:41:49	00:41:52	Huh? Okay, be careful, Jeannie...
554	00:42:32	00:42:35	Mrs. Bell... I'm Jim Brass.
555	00:42:35	00:42:38	I know.
556	00:42:40	00:42:43	I want you to know... if there's, um...
557	00:42:43	00:42:45	if there's any, um...
558	00:42:57	00:43:00	I know it wasn't your fault.
559	00:43:04	00:43:07	I... I'm...
560	00:43:07	00:43:09	I'm so sorry.
