	start	end	text
447	00:30:34	00:30:35	That's Mini-Britney.
448	00:30:35	00:30:36	It's what the people want.
449	00:30:40	00:30:42	Anybody hungry?
450	00:30:43	00:30:45	I'm going on a sandwich run.
451	00:30:45	00:30:48	At least let me get that.
452	00:30:50	00:30:52	Fine. Fine.
453	00:30:52	00:30:55	Warwick, take me back to jail.
454	00:30:58	00:31:02	Yeah, see, I got cameras all over this place, man.
455	00:31:02	00:31:04	Let's see who she's with.
456	00:31:06	00:31:07	Let's run this back an hour.
457	00:31:15	00:31:17	Looks like Dana cleaned you out, man.
458	00:31:17	00:31:19	Nah, wasn't nothing in that safe, man.
459	00:31:19	00:31:21	Only Dana didn't know that.
460	00:31:21	00:31:23	So, how come you never told us that before?
461	00:31:23	00:31:27	You guys sprung me to help find her, and that's what I'm doing.
462	00:31:29	00:31:30	There she is.
463	00:31:33	00:31:35	Wait a minute.
464	00:31:35	00:31:36	That's Jessica Jaynes' husband, Walter.
465	00:31:36	00:31:38	What's Dana doing with him?
466	00:31:38	00:31:39	Beats the hell out of me.
467	00:31:40	00:31:41	Walter's J.J.'s pimp.
468	00:31:41	00:31:43	Your favorite word.
469	00:31:44	00:31:46	He all about the cash.
470	00:31:46	00:31:48	Dude's a man-bitch.
471	00:31:48	00:31:51	Takes care of the kid while she goes out and makes the money.
472	00:31:51	00:31:55	Even tattoos her waist every time she pulls a high-roller trick.
473	00:31:57	00:31:58	Another notch on her belt, I guess.
474	00:31:58	00:32:01	I think he's got a gun on her.
475	00:32:02	00:32:04	J.J. was after your money.
476	00:32:04	00:32:07	Now Walter's after it, and he's taken your girlfriend hostage to get it.
477	00:32:07	00:32:09	Where's the money, Kellen?
478	00:32:09	00:32:12	'Cause I'm betting that's where we're going to find the both of them.
479	00:32:12	00:32:14	Well, talk to my lawyers.
480	00:32:14	00:32:15	Better yet, talk to the tax dudes.
481	00:32:15	00:32:17	They know where it is.
482	00:32:17	00:32:19	House special, times three.
483	00:32:19	00:32:21	Oh, come on, get out of here, man.
484	00:32:21	00:32:23	What's this look like, a party?
485	00:32:23	00:32:28	Okay, I'll check the outside cameras, see if we can see where they went.
486	00:32:35	00:32:37	I need to put a BOLO out on Walter Jaynes.
487	00:32:37	00:32:40	I'm gonna put some more mayonnaise on this dry-ass sandwich.
488	00:33:06	00:33:09	Kellen!
489	00:33:25	00:33:27	LVPD.
490	00:33:27	00:33:28	Move! Move!
491	00:33:31	00:33:33	Move! Move!
492	00:33:51	00:33:53	Suspect was seen leaving the scene in a, uh...
493	00:33:53	00:33:55	A piece-of-crap blue station wagon.
494	00:33:55	00:33:58	Nevada plates, K-C-Z. That's all I got.
495	00:33:58	00:34:01	A blue station wagon, partial plates, Kilo-Charlie-Zebra.
496	00:34:03	00:34:05	Dale?!
497	00:34:07	00:34:08	What did you give Drops?
498	00:34:08	00:34:10	Turkey sandwich.
499	00:34:10	00:34:11	You want to play around with me, huh?
500	00:34:11	00:34:12	You're under arrest.
501	00:34:12	00:34:14	For what, serving sandwiches?
502	00:34:14	00:34:15	Aiding and abetting. Cuff him.
503	00:34:15	00:34:18	Hey, man. Hey, hey, hey, hey, hey, hey, hey.
504	00:34:18	00:34:21	Look... Look, um...
505	00:34:21	00:34:23	Look, it was a GPS jammer melt.
506	00:34:23	00:34:25	A what?
507	00:34:32	00:34:39	I need you to call Captain Jim Brass, or Nick Stokes at the Crime Lab.
508	00:34:39	00:34:42	Don't look at me like that, Sherry, please, all right? Just do it!
509	00:34:42	00:34:44	Get him out of here.
510	00:34:44	00:34:46	Come on, man. I told you everything.
511	00:34:46	00:34:48	(phone rings) You still gonna arrest me?
512	00:34:48	00:34:50	I was just taking orders, man.
513	00:34:51	00:34:52	Hey, Grissom, don't worry.
514	00:34:52	00:34:53	We're gonna get him.
515	00:34:53	00:34:55	The undersheriff will be pleased to know that.
516	00:34:55	00:35:03	The nine-millimeter casing found at the business manager's apartment, and the one from Valinda Carlisle's car were fired in the same gun.
517	00:35:03	00:35:04	No surprises there.
518	00:35:04	00:35:08	Yeah, but it's not the gun that was used to kill Jessica Jaynes.
519	00:35:08	00:35:12	I think Walter Jaynes is the one who's on a rampage here, and he's dragging Dana Espinosa with him.
520	00:35:13	00:35:14	Any idea where?
521	00:35:14	00:35:15	No. No, not yet.
522	00:35:15	00:35:17	You might want to work on that, Nick.
523	00:35:17	00:35:20	We got a lead on the station wagon that scooped up Drops.
524	00:35:20	00:35:21	The registered owner is Walter Jaynes.
525	00:35:21	00:35:24	He must have had Dana in the car with him.
526	00:35:24	00:35:27	Walter wouldn't just let him in the car to protect the girl.
527	00:35:27	00:35:28	Drops must have something he wants.
528	00:35:28	00:35:30	The money.
529	00:35:30	00:35:35	What we have here... is a misunderstanding.
530	00:35:35	00:35:38	Hmm. I understand it just fine.
531	00:35:38	00:35:45	My J.J. bangs one of your whales 24-7 from Christmas to New Year's, and you stiff us.
532	00:35:45	00:35:47	Wait. Wait. Stiff you?
533	00:35:47	00:35:48	I got busted.
534	00:35:48	00:35:50	I went to jail.
535	00:35:50	00:35:51	Technically, I'm still in jail.
536	00:35:51	00:35:54	And my baby doesn't have a mother.
537	00:35:54	00:35:55	Neither does Dana.
538	00:35:55	00:35:57	I'm sorry. I thought she was gonna kill me, too.
539	00:35:57	00:35:59	Calm down.
540	00:35:59	00:36:01	Look, look, look at me. Walter, look at me.
541	00:36:01	00:36:03	Don't even listen to her. Walter!
542	00:36:03	00:36:04	Walter, look at me! See this here? Look.
543	00:36:05	00:36:07	50 Gs, baby.
544	00:36:07	00:36:08	I won't even take my cut.
545	00:36:08	00:36:11	That's very generous.
546	00:36:11	00:36:15	So, uh, we good to go?
547	00:36:15	00:36:17	You owe me something else.
548	00:36:17	00:36:19	What? The vig?
549	00:36:19	00:36:21	What's that, 25 more?
550	00:36:21	00:36:24	You can take the whole couch if you want to.
551	00:36:24	00:36:25	No, no, no, no.
552	00:36:25	00:36:28	I got my pay.
553	00:36:28	00:36:30	I need my payback.
554	00:36:32	00:36:34	I lost my wife.
555	00:36:34	00:36:38	I'm going to let you choose which one you lose.
556	00:36:38	00:36:40	Either your girl...
557	00:36:42	00:36:44	...or your baby.
558	00:36:56	00:36:57	Drops' GPS just came back up.
559	00:36:59	00:37:00	He's definitely at the apartment.
560	00:37:00	00:37:01	Well, either the jammer died, or...
561	00:37:01	00:37:04	Yeah, or he's calling for help. Okay, listen up.
562	00:37:04	00:37:07	We got a hostage situation at the Glanville apartment, 6555 Vegas Valley.
563	00:37:07	00:37:08	We're gonna make a silent approach.
564	00:37:08	00:37:09	Everybody copy?
565	00:37:12	00:37:15	Look... I can't choose.
566	00:37:15	00:37:19	Either you choose, or I choose.
567	00:37:19	00:37:20	Choose!
568	00:37:43	00:37:45	Okay.
569	00:37:46	00:37:49	No!
570	00:38:02	00:38:05	Get that scumbag out of here!
571	00:38:06	00:38:09	Oh, man! Oh, Damn!
572	00:38:09	00:38:13	We have two gunshot victims at the Glanville Apartments. Code Three.
573	00:38:13	00:38:14	(groans) Whoa, whoa, whoa.
574	00:38:14	00:38:15	Damn. Her water broke.
575	00:38:15	00:38:17	Trauma from the shot.
576	00:38:17	00:38:18	One of the victims is a pregnant woman.
577	00:38:18	00:38:20	She's going into labor.
578	00:38:20	00:38:22	That's all I got right there.
579	00:38:22	00:38:24	Oh, the baby's coming!
580	00:38:24	00:38:25	Just keeping breathing, Dana.
581	00:38:25	00:38:27	Just keep breathing, okay?
582	00:38:27	00:38:28	Paramedics are on their way.
583	00:38:29	00:38:30	Here. Relax.
584	00:38:30	00:38:31	That's it. That's it.
585	00:39:04	00:39:07	He looks healthy.
586	00:39:07	00:39:09	How are you? You good?
587	00:39:09	00:39:10	Sore.
588	00:39:10	00:39:13	I want to hold him.
589	00:39:14	00:39:16	No.
590	00:39:17	00:39:19	No?
591	00:39:19	00:39:21	That's my son.
592	00:39:21	00:39:23	I don't want you to hold him, Kellen.
593	00:39:23	00:39:30	Because of you, I heard my mother die.
594	00:39:30	00:39:33	Where's the money?! MARIA I don't have anything! Drops' money!
595	00:39:33	00:39:37	Who?! Just take what you want and leave, or I'm calling the police!
596	00:39:37	00:39:40	I didn't even know it was J.J.
597	00:39:40	00:39:42	What was I supposed to do?
598	00:39:43	00:39:45	I shot her and ran, and then Valinda called.
599	00:39:45	00:39:47	She said she heard what happened.
600	00:39:47	00:39:51	Said she wanted to help me.
601	00:39:53	00:39:54	Thank you, Val.
602	00:39:54	00:39:56	I am so freaked out right now.
603	00:39:56	00:39:57	I am so sorry.
604	00:39:57	00:39:59	Walter made Val call me.
605	00:39:59	00:40:00	She was just bait.
606	00:40:04	00:40:06	Walter said you owed him some money.
607	00:40:06	00:40:11	You told me you didn't have anything.
608	00:40:11	00:40:15	So I took Walter to Zig-Zag, thinking he would help.
609	00:40:15	00:40:21	And when he didn't, he killed him, too.
610	00:40:21	00:40:23	And for what?
611	00:40:23	00:40:27	So that you could hide all the money and keep it for yourself?
612	00:40:27	00:40:29	I had to.
613	00:40:29	00:40:31	The tax dudes would have taken it.
614	00:40:31	00:40:35	And, technically, I didn't hide it.
615	00:40:35	00:40:37	I left it with your mother.
616	00:40:37	00:40:38	Don't BS me, Kellen.
617	00:40:38	00:40:40	Babe, listen, okay, seriously.
618	00:40:40	00:40:43	Seriously, you would have spent it.
619	00:40:43	00:40:45	Then, where would we be?
620	00:40:45	00:40:48	Hmm? Hmm?
621	00:40:48	00:40:50	That was for our future, Mommy.
622	00:40:50	00:40:52	We don't have a future.
623	00:40:54	00:40:57	When you get out, we'll be gone.
624	00:40:57	00:40:59	You can't do that.
625	00:40:59	00:41:02	We're not married, and you're a convict.
626	00:41:02	00:41:04	I can do what I want.
627	00:41:07	00:41:09	Okay, Drops, that's it.
628	00:41:09	00:41:10	Time to go, man.
629	00:41:10	00:41:14	We got to get you transferred back to the prison hospital, okay?
630	00:41:23	00:41:25	Is Dana gonna do any time for offing J.J.?
631	00:41:25	00:41:27	Oh, I doubt it.
632	00:41:27	00:41:29	Sounds like a pretty good case of self-defense to me.
633	00:41:29	00:41:31	What about the money?
634	00:41:31	00:41:32	I'm not expecting anything. Just wondering.
635	00:41:32	00:41:34	Well, technically, it's the mother's.
636	00:41:34	00:41:35	It was her apartment.
637	00:41:35	00:41:38	Dana's the only beneficiary, so the money's really hers.
638	00:41:38	00:41:41	And my kid's. Yeah.
639	00:41:41	00:41:44	For once, I did something good in my life.
640	00:41:44	00:41:47	Oh, your life ain't over yet, Kellen.
641	00:41:47	00:41:49	It ain't over yet.
