	start	end	text
0	00:00:45	00:00:48	We've got two entry wounds...
1	00:00:52	00:00:53	...and two exit wounds.
2	00:00:54	00:00:55	Through-and-throughs.
3	00:00:56	00:00:57	Any ID on her?
4	00:00:57	00:01:00	No wallet, no purse, no cell.
5	00:01:00	00:01:01	Brass is tracking down the lease.
6	00:01:01	00:01:03	None of the neighbors seem to know her.
7	00:01:03	00:01:06	Buildings like these get a lot of transients.
8	00:01:06	00:01:09	People who tend to keep to themselves.
9	00:01:12	00:01:15	Looks like the drawers have been rifled through.
10	00:01:15	00:01:18	Maybe she walked in on a robbery in progress.
11	00:01:18	00:01:20	Yeah, except there's no sign of forced entry.
12	00:01:22	00:01:31	One, two, three, four, five, six, seven casings, which means there's seven bullets to look for.
13	00:01:43	00:01:46	Got a strange blood drop.
14	00:01:46	00:01:49	It's pretty far from the vic.
15	00:01:49	00:01:50	Could belong to the suspect.
16	00:01:50	00:01:53	It's circular.
17	00:01:53	00:01:55	No directionality.
18	00:01:55	00:01:59	Suspect would have had to be standing perfectly still.
19	00:02:01	00:02:02	It's gravitational.
20	00:02:20	00:02:24	Greg, could you get the Hawkeye, please?
21	00:02:24	00:02:27	Here you go.
22	00:02:27	00:02:30	Mitch, could you check the apartment immediately above this one?
23	00:02:30	00:02:32	You got it, Doc.
24	00:02:32	00:02:35	Mack, James, upstairs.
25	00:02:56	00:02:58	LVPD. Open up!
26	00:02:59	00:03:01	Open the door!
27	00:03:01	00:03:03	Get the ram.
28	00:03:08	00:03:10	It looks like this crime has a second story.
29	00:04:09	00:04:13	Maria Espinosa, organ donor.
30	00:04:13	00:04:14	Heart was in the right place.
31	00:04:14	00:04:16	Unfortunately, her head was in the wrong place.
32	00:04:16	00:04:18	No exit wound.
33	00:04:18	00:04:20	Bullet probably hit bone and fragmented.
34	00:04:20	00:04:22	Okay.
35	00:04:22	00:04:27	So a stray bullet rips through the floor and Mrs. Espinosa winds up collateral damage.
36	00:04:29	00:04:31	Hey, guys.
37	00:04:31	00:04:33	I found something.
38	00:04:33	00:04:34	What do you got, Greg?
39	00:04:40	00:04:43	I said what do you got?
40	00:04:43	00:04:47	Urine.
41	00:04:47	00:04:49	There's no sign of any pets in here.
42	00:05:00	00:05:05	Maybe the shooter freaked out and wet himself.
43	00:05:07	00:05:09	Not exactly a hardened criminal.
44	00:05:57	00:06:04	You know, the bullet trajectory and the location of the facial wound suggest that she was in this position when she was shot.
45	00:06:04	00:06:08	She was probably trying to hear what was going on downstairs.
46	00:06:09	00:06:11	Shut up!
47	00:06:18	00:06:20	Guess it doesn't pay to be a nosy neighbor.
48	00:06:20	00:06:25	Yeah, but Brass said that the neighbors heard the gunshots, but they didn't hear any raised voices or arguing.
49	00:06:27	00:06:30	What was she listening to?
50	00:06:42	00:06:43	Tramp stamp.
51	00:06:43	00:06:45	Looks more like a tramp belt.
52	00:06:46	00:06:48	Help me roll her.
53	00:06:51	00:06:56	So, hot girl with dollar-sign tats and a mostly empty apartment.
54	00:06:56	00:06:57	Prostitute, right?
55	00:06:57	00:06:58	Maybe.
56	00:06:58	00:07:00	Maybe she just loves money.
57	00:07:00	00:07:06	You know, it's the love of money that is the root of all evil.
58	00:07:06	00:07:09	Most people think it's just the money.
59	00:07:09	00:07:11	Oh, sage.
60	00:07:13	00:07:16	Washroom.
61	00:07:16	00:07:18	Hey, Catherine, are you collecting trace from Blondie's body?
62	00:07:18	00:07:20	As we speak.
63	00:07:20	00:07:26	So I've collected seven bullets and seven shell casings from the apartment where she was shot.
64	00:07:26	00:07:28	So what's the problem?
65	00:07:28	00:07:31	One of these bullets is supposed to be in Mrs. Espinosa.
66	00:07:33	00:07:35	Well, maybe you recovered a bullet from a different event.
67	00:07:35	00:07:37	Maybe.
68	00:07:37	00:07:40	Have you checked Blondie for GSR?
69	00:07:40	00:07:42	Hang on-- not yet.
70	00:07:53	00:07:58	Sodium rhodizonate test on right hand.
71	00:08:03	00:08:05	Positive for GSR.
72	00:08:05	00:08:07	She had a gun of her own.
73	00:08:10	00:08:20	Ballistics confirms that all these nine-millimeter casings were fired in the same weapon, but Doc Robbins pulled this bullet fragment from Mrs. Espinosa.
74	00:08:21	00:08:25	It's cannelured.
75	00:08:25	00:08:26	So...
76	00:08:26	00:08:28	Blondie had a revolver.
77	00:08:28	00:08:29	Hence no shell casings.
78	00:08:29	00:08:36	Okay, so she goes back to her apartment packing heat, and somebody's already there waiting to light her up. (two gunshots)
79	00:08:36	00:08:39	She gets off a couple of desperate rounds and...
80	00:08:39	00:08:44	one shot goes through the ceiling, accidentally killing Mrs. Espinosa.
81	00:08:44	00:08:46	Welcome to the O.K. Corral. (phone rings)
82	00:08:47	00:08:48	Yeah, Jim?
83	00:08:49	00:08:50	I just got off the phone with the apartment manager.
84	00:08:50	00:08:51	Yeah? Did you get an ID on Blondie?
85	00:08:52	00:08:53	It's not her apartment.
86	00:08:53	00:08:55	The name on the lease is Kellen Tyford.
87	00:08:55	00:08:56	Drops?
88	00:08:56	00:08:58	The nightclub promoter?
89	00:08:58	00:08:59	Yeah, and get this.
90	00:08:59	00:09:02	He leases the upstairs apartment, too.
91	00:09:02	00:09:05	That's a lot of apartments for a guy who's getting free room and board.
92	00:09:10	00:09:12	Well, well, well.
93	00:09:12	00:09:13	What's a convict to do?
94	00:09:29	00:09:31	Check and mate.
95	00:09:31	00:09:32	Whoo!
96	00:09:32	00:09:33	He played right into it.
97	00:09:34	00:09:35	Oh, man, that was...
98	00:09:35	00:09:36	Did you see that?
99	00:09:36	00:09:38	I totally got him.
100	00:09:49	00:09:52	Looks like something more than forensics be jamming a brother up in here.
101	00:09:52	00:09:54	Man, y'all some jinxes, man.
102	00:09:54	00:09:55	You know, this is a setup.
103	00:09:55	00:09:56	Don't you get it?
104	00:09:56	00:10:01	Ivy League college student versus a high school dropout convict.
105	00:10:01	00:10:03	You got no chance.
106	00:10:03	00:10:05	And so said a jury of your peers.
107	00:10:05	00:10:08	Look, eight months on a weak-ass weapons charge?
108	00:10:08	00:10:09	It's a vacation.
109	00:10:09	00:10:10	Vacation, huh?
110	00:10:11	00:10:12	So who's this?
111	00:10:12	00:10:14	Your house-sitter?
112	00:10:14	00:10:17	We found her at your apartment over on Vegas Valley.
113	00:10:17	00:10:19	What's her name?
114	00:10:19	00:10:20	Jessica Jaynes.
115	00:10:21	00:10:22	J.J. everybody calls her.
116	00:10:22	00:10:24	But what happened to her?
117	00:10:24	00:10:25	She drowned.
118	00:10:25	00:10:27	So what was she doing at your apartment?
119	00:10:27	00:10:29	Don't know.
120	00:10:29	00:10:30	You pimping her out, Superfly?
121	00:10:30	00:10:32	Pimping her out?
122	00:10:32	00:10:35	Nah, pimping ain't easy, and you know I'm all about the easy, okay?
123	00:10:35	00:10:37	J.J. used to come to my club.
124	00:10:37	00:10:39	She was a club rat.
125	00:10:39	00:10:41	Sometimes she worked atmosphere.
126	00:10:41	00:10:44	Oh, atmosphere. What's that, like turning into a smoke machine?
127	00:10:44	00:10:46	No, more like an ATM machine.
128	00:10:46	00:10:50	You sit her on a couch, tourists start to buy her drinks, she makes me money.
129	00:10:50	00:10:53	Yeah, especially when the tourist leaves with her.
130	00:10:53	00:10:54	So what's your cut, Easy?
131	00:10:54	00:10:58	Look, if the customers like the atmosphere...
132	00:10:59	00:11:00	...then I try to Chuck Woolery that.
133	00:11:00	00:11:01	Okay?
134	00:11:01	00:11:03	I want my customers happy.
135	00:11:03	00:11:05	You know any unhappy customers, Chuck?
136	00:11:05	00:11:07	Look at her.
137	00:11:07	00:11:09	She even looks good in that picture.
138	00:11:11	00:11:17	Yeah, I admit, she looks a whole lot better than Mrs. Espinosa upstairs.
139	00:11:19	00:11:20	Who did it?
140	00:11:20	00:11:25	If I knew that, I wouldn't have driven all the way out here to this frying pan in the desert to ask you.
141	00:11:25	00:11:29	This woman took care of me when I was a kid.
142	00:11:29	00:11:32	Went homeless a couple of years ago...
143	00:11:33	00:11:35	...so I moved her into my house.
144	00:11:35	00:11:38	When the tax dudes took that, I had to rent the apartments.
145	00:11:38	00:11:41	Top bunk was hers, bottom was mine...
146	00:11:41	00:11:46	Figured it was the least I can do, being as she had to wipe my snot nose all the time.
147	00:11:46	00:11:49	What was J.J. doing downstairs?
148	00:11:49	00:11:51	I told you.
149	00:11:51	00:11:53	I don't know, so unless you want me to start lying...
150	00:11:53	00:11:54	You never stop.
151	00:11:54	00:11:59	If that's the way you feel, I'm out.
152	00:12:14	00:12:19	Mr. Jaynes, we'd be happy to have someone watch your son while you're doing this, you know?
153	00:12:19	00:12:21	He stays with me.
154	00:12:28	00:12:30	Mr. Jaynes, is that your wife?
155	00:12:31	00:12:33	Yeah, and his mommy.
156	00:12:33	00:12:36	Do you have any idea what your wife was doing at the Glanville Apartments?
157	00:12:36	00:12:37	She has lots of friends.
158	00:12:37	00:12:39	She always came home every night... to me.
159	00:12:40	00:12:41	To our baby.
160	00:12:43	00:12:45	Sir.
161	00:12:56	00:12:57	We almost got all the way around, girl.
162	00:13:08	00:13:09	Maybe these will help out a little?
163	00:13:11	00:13:13	Or would you two prefer to be alone?
164	00:13:13	00:13:15	Ah, very funny.
165	00:13:15	00:13:21	So, Grissom comes up with a theory, and we get to do the reenactments and the photo docs.
166	00:13:21	00:13:23	Yeah.
167	00:13:23	00:13:25	Well, it's...
168	00:13:25	00:13:28	good to be the king, I suppose.
169	00:13:28	00:13:29	Sure is.
170	00:13:29	00:13:31	Perfect. Mm-hmm.
171	00:13:33	00:13:35	Oops. Damn it.
172	00:13:40	00:13:42	Hey, Nick, hang on.
173	00:13:44	00:13:46	What?
174	00:13:57	00:13:59	That look like a bullet hole to you?
175	00:13:59	00:14:02	Yeah. It sure does.
176	00:14:31	00:14:34	.38 cannelured revolver round.
177	00:14:36	00:14:37	I like it when the king gets it wrong.
178	00:14:37	00:14:39	Keeps him human.
179	00:14:39	00:14:46	The bullet we found in Mrs. Espinosa's ceiling was fired from the same revolver as the bullet that went into her cheek.
180	00:14:47	00:14:49	Yeah, but there were two bullets in the apartment.
181	00:14:49	00:14:52	And only one hole in her floor.
182	00:14:52	00:14:56	Which means the kill shot had to be a separate event.
183	00:14:59	00:15:01	I think we got the timeline backwards.
184	00:15:02	00:15:05	Looks to me like J.J. shot Mrs. Espinosa first.
185	00:15:10	00:15:12	Then went downstairs where somebody returned the favor.
186	00:15:20	00:15:22	Yeah. Who's the somebody?
187	00:15:22	00:15:28	'Cause the only name on the lease is Drops, and he has a really good alibi.
188	00:15:28	00:15:31	Yeah and even if he knew who it was, he's not going to just give them up.
189	00:15:32	00:15:34	He may not have to.
190	00:15:34	00:15:38	So that urine sample that Greg found in the downstairs apartment, had female epithelials in it.
191	00:15:38	00:15:40	Now, I ran it through CODIS.
192	00:15:40	00:15:44	I didn't get any hits, but the suspect has half her DNA in common at every marker with Mrs. Espinosa.
193	00:15:44	00:15:46	It's her daughter?
194	00:15:46	00:15:48	Mm-hmm, Dana Espinosa.
195	00:15:48	00:15:49	Dana's got a record.
196	00:15:49	00:16:01	She was charged with attempted murder for something involving a Japanese businessman with his nose full of blow, skydiving out of the eighth story of The Palms there was a defense witness whose testimony exonerated her.
197	00:16:01	00:16:02	Care to guess who?
198	00:16:03	00:16:04	Drops. Drops.
199	00:16:05	00:16:06	I don't know, Kellen.
200	00:16:06	00:16:09	I'm having trouble with this idea that you're such a nice guy.
201	00:16:09	00:16:13	I mean, renting your apartment to a little, old lady and her daughter?
202	00:16:13	00:16:14	You're right.
203	00:16:14	00:16:16	I'm not a nice guy.
204	00:16:16	00:16:19	But you plant your seed in a woman, you got to take care of it.
205	00:16:19	00:16:20	Dana's pregnant?
206	00:16:20	00:16:25	Due next month. That explains the urine at the scene.
207	00:16:25	00:16:26	No bladder control, especially in a gunfight.
208	00:16:26	00:16:28	So make a ho a housewife.
209	00:16:28	00:16:29	I saw that movie.
210	00:16:29	00:16:32	Look, man, first of all, Dana was no ho.
211	00:16:32	00:16:35	I scooped her out the atmosphere before she could get touched.
212	00:16:35	00:16:37	You sure about that?
213	00:16:37	00:16:42	Why would J.J. kill Mrs. Espinosa and then try to kill Dana?
214	00:16:42	00:16:44	I mean, they roll in the same clique.
215	00:16:44	00:16:46	I-I can't explain these women.
216	00:16:46	00:16:52	One minute, they're sending each other cupcakes on Facebook, the next, they're trying to kill each other over a broken curling iron.
217	00:16:52	00:16:56	But I do know...
218	00:16:56	00:16:59	that if J.J. tried to creep on Dana, Dana ain't just gonna just sit there.
219	00:17:00	00:17:01	She a bad bitch.
220	00:17:01	00:17:04	If someone's gunning for her or she's gunning for somebody else, we need to find her.
221	00:17:05	00:17:06	You ain't gonna get her.
222	00:17:06	00:17:09	She badder, sneakier, more dangerous.
223	00:17:10	00:17:11	I'll warn the SWAT team.
224	00:17:11	00:17:12	Let's give her a call.
225	00:17:12	00:17:14	What's her phone number? Phone call?
226	00:17:14	00:17:15	Yeah. From your cop phone number?
227	00:17:15	00:17:17	Yeah. No chance.
228	00:17:17	00:17:20	And she won't answer an unknown caller either.
229	00:17:20	00:17:21	I'll text in sugar daddy.
230	00:17:22	00:17:25	No, this is the kind of girl you have to find in person.
231	00:17:25	00:17:26	Then give us some addresses.
232	00:17:26	00:17:29	What are you going to do? MapQuest her ass?
233	00:17:29	00:17:30	That's not going to work.
234	00:17:30	00:17:34	There's only one way to find this girl.
235	00:17:34	00:17:35	Let me out.
236	00:17:36	00:17:38	No, for real.
237	00:17:38	00:17:40	I mean, I can have her to you today.
238	00:17:40	00:17:42	You think we can just pop you out of jail?
239	00:17:42	00:17:45	Yeah. Like 48 Hours.
240	00:17:45	00:17:46	You know, the flick.
241	00:17:46	00:17:48	Nolte busts Eddie out of jail.
242	00:17:48	00:17:49	They get the bad guy. Everything's cool.
243	00:17:49	00:17:51	You think this is a joke, man?
244	00:17:51	00:17:54	Dead bodies are piling up around your new family.
245	00:17:54	00:17:55	Now, that would worry me.
246	00:17:56	00:18:01	But if you want to angle for some weekend pass instead of helping us out, that's fine, man. I understand.
247	00:18:01	00:18:02	Let's get out of here.
248	00:18:02	00:18:04	Hey, we out.
249	00:18:14	00:18:16	Are these the text messages that came from Jessica Jaynes phone?
250	00:18:16	00:18:19	Yep. No physical phone required.
251	00:18:19	00:18:21	Everything's stored on the server.
252	00:18:21	00:18:24	You ever worry that you could be replaced by a computer?
253	00:18:24	00:18:26	Every day of my life.
254	00:18:26	00:18:31	Last text she sent was to her husband's number, about a half hour before the apartment shootings.
255	00:18:32	00:18:35	Wit Val she knows where D stashed our money.
256	00:18:35	00:18:37	Yay! Be back soon wit phat pockets.
257	00:18:37	00:18:40	Kisses to you and Bebe.
258	00:18:40	00:18:42	Sounds like this girl was looking for a big score.
259	00:18:42	00:18:45	We didn't find any money in either of those apartments.
260	00:18:45	00:18:48	Well, maybe that's what got the old lady killed.
261	00:18:50	00:18:52	D for Dana or Drops?
262	00:18:52	00:18:54	Pull up her voice calls.
263	00:18:54	00:18:56	Yep.
264	00:18:58	00:19:02	Okay, the last call she got was from Valinda Carlisle.
265	00:19:02	00:19:03	Val.
266	00:19:05	00:19:07	Let's see what Val has to say.
267	00:19:11	00:19:14	Hello?
268	00:19:14	00:19:15	Uh, yeah.
269	00:19:15	00:19:18	Hey, uh, is Val around?
270	00:19:18	00:19:20	Catherine?
271	00:19:20	00:19:22	Warrick?
272	00:19:22	00:19:25	I'm afraid she's unable to come to the phone now.
273	00:19:25	00:19:27	Permanently.
274	00:19:27	00:19:28	How'd you get this number?
275	00:19:28	00:19:31	Valinda called my apartment homicide vic last night.
276	00:19:33	00:19:34	Are there any witnesses?
277	00:19:34	00:19:37	Unis talked to a couple of guys that went to the strip club across the street.
278	00:19:37	00:19:42	I think they said they saw a pregnant woman getting into the vic's car from the passenger side.
279	00:19:42	00:19:46	We've got a BOLO out on Dana Espinosa in connection with the apartment homicides.
280	00:19:46	00:19:49	She's considered armed, dangerous and pregnant.
281	00:19:49	00:19:51	Ooh, raging hormones and a gun?
282	00:19:51	00:19:53	We've got to get that off the streets fast.
283	00:19:53	00:19:54	What's the plan?
284	00:20:23	00:20:26	Look who it is.
285	00:20:26	00:20:28	Mom and Dad.
286	00:20:38	00:20:40	One big happy family, huh?
287	00:20:41	00:20:43	Yeah, sort of.
288	00:20:46	00:20:48	Get in the car.
289	00:20:50	00:20:53	I got a feeling I'm going to regret this.
290	00:20:53	00:20:55	I already do.
291	00:21:08	00:21:11	You have reached the voice mail of Bruce Zagberg, Registered Financial Planner.
292	00:21:12	00:21:13	Please leave a message.
293	00:21:14	00:21:15	Voice mail again.
294	00:21:15	00:21:18	It's 'cause you don't call Zig-Zag Bruce.
295	00:21:18	00:21:19	He calls you, man.
296	00:21:19	00:21:22	Is there a burger joint or something around here?
297	00:21:22	00:21:26	No, but what makes you so sure Dana would go to this guy Bruce anyway?
298	00:21:26	00:21:29	If Dana's on the run, she gonna need some on-the-run money.
299	00:21:29	00:21:34	Let's say Zig-Zag handles certain aspects of my finances.
300	00:21:34	00:21:35	What, like laundering the street vig?
301	00:21:35	00:21:38	No. Actually, my 401k.
302	00:21:38	00:21:41	Why are you always tossing the pimp card at me, man?
303	00:21:41	00:21:45	I guess to you, a black man in a suit is a pimp.
304	00:21:45	00:21:47	Oh. Did I hurt your feelings?
305	00:21:55	00:21:57	So, is this the place?
306	00:21:57	00:21:58	What?
307	00:21:58	00:22:00	You just gonna leave me here?
308	00:22:00	00:22:01	Yup.
309	00:22:01	00:22:04	Zig-Zag Bruce ain't gonna tell you squat.
310	00:22:07	00:22:11	Wonder what the schools are like around here.
311	00:22:11	00:22:12	What?
312	00:22:12	00:22:16	You know, seems like a nice neighborhood.
313	00:22:16	00:22:22	Yeah, probably some sweet little foreclosures coming up soon, too.
314	00:22:22	00:22:24	Sounds like you're thinking about settling down.
315	00:22:24	00:22:27	Looks like you were finally right about something.
316	00:22:30	00:22:32	Single nine-millimeter shell casing.
317	00:22:32	00:22:34	Consistent with the other murders.
318	00:22:34	00:22:36	How about the neighbors?
319	00:22:36	00:22:37	Nobody at home.
320	00:22:37	00:22:40	Parents at work, kids at school, and nannies don't like talking to cops.
321	00:22:40	00:22:42	What about Drops?
322	00:22:42	00:22:44	He give us anything besides more bodies?
323	00:22:44	00:22:45	No, not yet.
324	00:22:46	00:22:49	I'll process.
325	00:22:49	00:22:51	Okay.
326	00:22:55	00:22:58	So, who else would Dana go to for help?
327	00:22:58	00:23:00	Zig-Zag doesn't seem to be a very big talker.
328	00:23:00	00:23:04	You're a lot funnier than I remember, Crime-Lab.
329	00:23:04	00:23:06	You been going to cop comedy school?
330	00:23:06	00:23:09	Answer the question, Kellen.
331	00:23:10	00:23:11	I got a stepsister, Sherry.
332	00:23:12	00:23:13	Her and Dana are pretty tight.
333	00:23:13	00:23:17	If Dana's not with her, Sherry should at least know something.
334	00:23:18	00:23:19	Jackson and D.
335	00:23:19	00:23:21	Let's go.
336	00:23:21	00:23:23	Jackson and D. Yippee.
337	00:23:24	00:23:25	We're going to the hood.
338	00:23:42	00:23:44	Yeah, that's her right there.
339	00:23:44	00:23:45	The round one.
340	00:23:45	00:23:48	Check this out here, fellas.
341	00:23:48	00:23:51	Y'all gonna have to let me do this one solo.
342	00:23:51	00:23:53	Sherry's allergic to badges.
343	00:23:53	00:23:55	Okay, look at this.
344	00:23:55	00:23:57	Instant antihistamine.
345	00:23:57	00:24:01	Look, man, the cop entourage just ain't gonna cut it. Nah.
346	00:24:01	00:24:03	I need to be alone.
347	00:24:03	00:24:05	I mean, come on.
348	00:24:05	00:24:06	Where am I going?
349	00:24:06	00:24:08	You got your game boy on me.
350	00:24:10	00:24:13	Okay, check it out.
351	00:24:13	00:24:15	I'll cover the street.
352	00:24:24	00:24:27	What about the cuffs, yo? Cuff?
353	00:24:27	00:24:31	(sighs) Now, why the hell would anybody talk to someone that's already arrested?
354	00:24:31	00:24:32	Okay.
355	00:24:32	00:24:34	Okay, Kellen, give me that. Give me that.
356	00:24:37	00:24:38	(laughs) What about a business card?
357	00:24:38	00:24:42	You know, just in case Dana ain't around, Sherry can get in contact with us, you know?
358	00:24:42	00:24:43	Okay.
359	00:24:43	00:24:45	Don't make me look bad.
360	00:24:45	00:24:48	Do the right thing.
361	00:24:48	00:24:49	(laughs) Cool.
362	00:24:49	00:24:51	The Church on the Move.
363	00:25:05	00:25:06	Hey, Sher.
364	00:25:06	00:25:08	Oh, uh-uh.
365	00:25:08	00:25:09	You escape from jail?!
366	00:25:09	00:25:11	No. Hell, no...
367	00:25:11	00:25:13	Oh, so they just let you out, huh?
368	00:25:13	00:25:15	Well, I mean...
369	00:25:15	00:25:16	Lying sack!
370	00:25:16	00:25:18	You don't think I see 'em?
371	00:25:19	00:25:22	You trying to get everybody you know arrested, or maimed, or killed?
372	00:25:22	00:25:25	Huh?! You a snake now?! A rat?!
373	00:25:25	00:25:26	Wait a minute.
374	00:25:26	00:25:28	Miss me with the BS, all right, Sher?
375	00:25:29	00:25:31	I'm just looking for... For what?! For another damn shortcut?!
376	00:25:31	00:25:33	Dana's mother was killed.
377	00:25:33	00:25:36	J.J. was killed, too, and Dana's missing.
378	00:25:37	00:25:39	Now, the cops got me out to help find her.
379	00:25:39	00:25:42	I thought maybe you might know where she is.
380	00:25:42	00:25:44	Last time I talked to her was the night before last.
381	00:25:44	00:25:47	She wasn't feeling too good.
382	00:25:47	00:25:51	Had to cancel her regular Bingo night with her mama.
383	00:25:51	00:25:52	Well, listen, all right?
384	00:25:52	00:25:59	If she does come around here, or calls you, I need you to call Captain Jim Brass, or Nick Stokes...
385	00:26:01	00:26:03	...at the Crime Lab.
386	00:26:04	00:26:08	Don't look at me like that, Sherry, please, all right? Just do it.
387	00:26:08	00:26:10	Hold on.
388	00:26:37	00:26:39	Stop where you are, Kellen, and drop the bag!
389	00:26:40	00:26:41	Why?! Drop the bag!
390	00:26:41	00:26:42	What did I do...? Drop it!
391	00:26:42	00:26:43	I didn't even do nothing.
392	00:26:43	00:26:44	Drops. Okay.
393	00:26:44	00:26:45	Hands above your head.
394	00:26:45	00:26:47	Don't move.
395	00:26:47	00:26:49	Oh, that is funky.
396	00:26:49	00:26:50	What is that nasty stuff?!
397	00:26:50	00:26:51	Chicken gizzards!
398	00:26:51	00:26:53	Hey, we're not on a lunch break here.
399	00:26:53	00:26:54	At least in jail, I got one.
400	00:26:55	00:26:57	What'd she tell you? Nothing. She told him nothing.
401	00:26:57	00:26:58	All right, come on, Kellen. We're going to jail.
402	00:26:58	00:26:59	Whoa, whoa, whoa, wait a minute.
403	00:26:59	00:27:01	No, no, no, no, no!
404	00:27:01	00:27:02	There's one more place to go. Where?
405	00:27:02	00:27:03	The office at my after-hours spot.
406	00:27:03	00:27:04	Why would Dana go there?
407	00:27:05	00:27:06	Maybe to check out the big-ass safe I got.
408	00:27:07	00:27:09	Let's go. Ugh!
409	00:28:03	00:28:05	Display last destination.
410	00:28:05	00:28:06	Huh.
411	00:28:09	00:28:10	Hey!
412	00:28:10	00:28:12	Hey.
413	00:28:12	00:28:14	Got the autopsy report on Valinda Carlisle.
414	00:28:14	00:28:16	Thought I'd save you a trip to the morgue.
415	00:28:16	00:28:17	Nice.
416	00:28:17	00:28:22	I found Jessica Jayne's purse in the glove compartment.
417	00:28:22	00:28:24	Really?
418	00:28:24	00:28:26	And address to the Glanville Apartments on the GPS.
419	00:28:27	00:28:28	Okay.
420	00:28:29	00:28:31	So they were in it together.
421	00:28:33	00:28:37	Valinda drives J.J. to shake down Drops' family for some cash.
422	00:28:38	00:28:40	It goes bad.
423	00:28:40	00:28:54	J.J. kills the mother, Dana kills J.J., Valinda flees the scene, and, the next night, the pissed-off pregnant chick tracks down Valinda and pays her back.
424	00:28:54	00:28:58	That seems plausible, but there's something still off.
425	00:28:58	00:29:05	The bullet entered through the back of the skull, and it exited through the forehead, and...
426	00:29:07	00:29:09	...out through the open window.
427	00:29:16	00:29:18	I think you got lucky.
428	00:29:18	00:29:22	The bullet grazed the window frame on its way out.
429	00:29:22	00:29:25	Gives you a trajectory.
430	00:29:25	00:29:41	Well, that's good, but the witnesses say that Valinda was in the driver's seat when Dana got in the car, and if that's true, then, Dana had to shoot Valinda like this, not like this.
431	00:29:41	00:29:45	(gunshot) That seems kind of awkward, don't you think?
432	00:29:45	00:29:48	Yeah, but awkward or not, it definitely lines up the shot.
433	00:29:48	00:29:52	Well, it seems to me that the shot came from the back seat.
434	00:29:54	00:29:56	There was someone else in the car.
435	00:30:06	00:30:08	Yeah, Dana was here about an hour ago.
436	00:30:08	00:30:10	She was with some NASCAR-looking dude.
437	00:30:10	00:30:13	And what exactly does a NASCAR-looking dude look like?
438	00:30:13	00:30:14	Kind of like you.
439	00:30:14	00:30:16	But this guy's all inked up.
440	00:30:16	00:30:19	He's got that loco look.
441	00:30:19	00:30:21	You just let a complete stranger into your boss' office?
442	00:30:21	00:30:23	I thought you were a smart businessman.
443	00:30:23	00:30:25	I mean, it was Dana, your girl.
444	00:30:25	00:30:27	I didn't ask questions.
445	00:30:30	00:30:32	What is this?
446	00:30:32	00:30:34	And where's the DJ?
