	start	end	text
432	00:38:21	00:38:22	Get them up!
433	00:38:22	00:38:23	You're all done.
434	00:38:23	00:38:26	Get down on your knees.
435	00:38:28	00:38:29	Get down!
436	00:38:34	00:38:37	I didn't do it.
437	00:38:37	00:38:38	I'm innocent.
438	00:38:38	00:38:40	I know what the parents are going through.
439	00:38:40	00:38:44	I... I wanted to help you guys.
440	00:38:44	00:38:48	When you killed Sylvia Mallick, you were wearing a mask.
441	00:38:48	00:38:50	We have your DNA on a piece of that mask.
442	00:38:50	00:38:52	That's called incriminating evidence.
443	00:38:53	00:38:54	I-I didn't hurt anybody.
444	00:38:54	00:38:56	You never hurt anybody?
445	00:38:56	00:38:58	Yeah.
446	00:38:58	00:38:59	I don't know who that is.
447	00:38:59	00:39:00	What about Elena Garcia?
448	00:39:01	00:39:02	I-I don't...
449	00:39:02	00:39:03	What about Maria Perez?
450	00:39:03	00:39:04	I-I didn't hurt them.
451	00:39:04	00:39:05	You didn't hurt these women?
452	00:39:05	00:39:06	No. I don't know who...
453	00:39:07	00:39:08	You didn't murder these women?
454	00:39:08	00:39:09	No, I did not do this.
455	00:39:09	00:39:11	You didn't murder Sylvia Mallick?
456	00:39:11	00:39:12	No, I didn't. No!
457	00:39:12	00:39:14	Then who did?
458	00:39:15	00:39:18	Who did?
459	00:39:18	00:39:21	It was Oggun.
460	00:39:23	00:39:25	Oggun did it.
461	00:39:25	00:39:33	Oggun is the god of violence and brute force.
462	00:39:35	00:39:37	Oggun.
463	00:39:37	00:39:40	I tried to stop him.
464	00:39:40	00:39:42	I tried to reason with him.
465	00:39:42	00:39:46	But Oggun would not listen.
466	00:39:47	00:39:51	I begged him not to hurt anyone else.
467	00:39:53	00:39:57	I went to the priest.
468	00:39:57	00:40:01	But the priest couldn't stop Oggun.
469	00:40:01	00:40:04	Oggun is the knife.
470	00:40:06	00:40:07	Oggun needs sacrifice.
471	00:40:07	00:40:12	Oggun didn't murder Sylvia Mallick, you did.
472	00:40:12	00:40:13	Ray... (screams)
473	00:40:13	00:40:16	No evil spirit murdered this woman. We gotta...
474	00:40:16	00:40:21	You did, because she was going to reveal you as the murderer you are! Hey, hey, hey, Ray. Ray.
475	00:40:21	00:40:23	Take it easy, take it... Ray, take it easy.
476	00:40:29	00:40:31	Ray!
477	00:40:47	00:40:49	So you're gonna be a CSI?
478	00:40:49	00:40:51	I am.
479	00:40:51	00:40:53	You'll be great at it.
480	00:40:54	00:40:56	And so will you one day.
481	00:40:56	00:40:58	I think so.
482	00:41:01	00:41:04	Well, I'm gonna hold you to your promise.
483	00:41:04	00:41:06	You better take my call.
484	00:41:06	00:41:08	You can count on it.
485	00:41:56	00:42:00	I had a student who wanted to be published.
486	00:42:00	00:42:02	These would've been her words.
487	00:42:02	00:42:11	I dedicate each chapter to the unsolved cold cases LVPD has deemed related by evidence or method of killing.
488	00:42:12	00:42:27	Hopefully, by the time I'm done, we will have a better idea why these serial killers got away I intend to write in detail about the ones who did not.
