	start	end	text
393	00:29:08	00:29:09	That's where I saw him.
394	00:29:09	00:29:11	There was blood all over his scrubs.
395	00:29:11	00:29:13	So I went out there with Vince.
396	00:29:13	00:29:16	At first, I thought, Why would he be way out here?
397	00:29:16	00:29:19	But if you think about it, it's the perfect place.
398	00:29:19	00:29:21	Nobody could hear his victims scream.
399	00:29:21	00:29:24	Who knows how many victims he's chalked up by this point.
400	00:29:24	00:29:27	Could have bodies buried all around here.
401	00:29:27	00:29:31	Might consider bringing out some cadaver dogs or ground-penetrating radar.
402	00:29:31	00:29:33	Place wasn't even locked.
403	00:29:33	00:29:36	Hardly the fastidious work of a killer like Jekyll.
404	00:29:36	00:29:40	And what I found inside did nothing to assuage those doubts.
405	00:29:40	00:29:42	He's good.
406	00:29:42	00:29:43	Not a drop of blood anywhere.
407	00:29:43	00:29:45	The guy's a genius.
408	00:29:45	00:29:48	I'll be sure to integrate this lead into our investigation.
409	00:29:53	00:29:55	Is this the place?
410	00:29:55	00:29:57	Yes.
411	00:30:15	00:30:16	It's all clear.
412	00:30:16	00:30:18	All right, Ray, I'm heading in.
413	00:30:18	00:30:20	Copy that.
414	00:31:14	00:31:17	I got a stain on the floor in here.
415	00:31:17	00:31:19	Blood?
416	00:31:25	00:31:28	Nick, you there?
417	00:31:28	00:31:30	Nick, you there?
418	00:31:30	00:31:32	Nick, you there?!
419	00:31:32	00:31:34	Yeah.
420	00:31:34	00:31:36	Yeah, and so was someone else.
421	00:31:56	00:31:58	Got a toolbox here.
422	00:32:01	00:32:05	Yellow paint like we found in Heidi's head wound.
423	00:32:05	00:32:09	And some of the paint's been knocked off one of the corners.
424	00:32:19	00:32:23	I may even have a partial palm print.
425	00:32:27	00:32:31	The bloody fingerprints from the fridge are Heidi Custer's.
426	00:32:31	00:32:35	Well, what about the palm print from the toolbox?
427	00:32:35	00:32:37	Running it right now.
428	00:32:41	00:32:43	No match.
429	00:32:43	00:32:48	And no way to tell if it's from the same contributor as the bloody fingerprint from the steering wheel in Heidi's car.
430	00:32:48	00:32:55	That means Heidi was in the building and alive at least long enough to have left her prints.
431	00:32:55	00:33:01	Ray, if you haven't been back out to this place since she came to town, how did she learn about it?
432	00:33:01	00:33:05	Perhaps from the same person who led me out there.
433	00:33:07	00:33:10	Happy to aid you with the Jekyll investigation.
434	00:33:12	00:33:15	Has Dr. Langston been following up on my lead?
435	00:33:17	00:33:22	Mr. Grady, you recognize her?
436	00:33:23	00:33:25	Yes, ma'am.
437	00:33:27	00:33:28	She-she's dead?
438	00:33:28	00:33:30	Mm-hmm.
439	00:33:32	00:33:34	Nev-never should have taken her out there.
440	00:33:35	00:33:39	She said that she had seen me talking to Dr. Langston.
441	00:33:39	00:33:43	Gave him a big lead in the Dr. Jekyll investigation.
442	00:33:43	00:33:44	It was integrated.
443	00:33:44	00:33:46	Oh.
444	00:33:46	00:33:48	What was the lead?
445	00:33:48	00:33:49	Well, that's police business.
446	00:33:49	00:33:52	Really don't want to compromise the investigation.
447	00:33:52	00:33:57	Sure. Um, well, I'm working on a story for a big national news magazine.
448	00:33:57	00:34:01	Think a $100 latte might be the fix I need?
449	00:34:03	00:34:05	Hey, Lou, cover for me.
450	00:34:09	00:34:13	The key with a killer like Jekyll is to put yourself into his twisted mindset.
451	00:34:13	00:34:14	It's a chess game, really.
452	00:34:15	00:34:22	Every move Jekyll makes is calculated, and guys like Langston and I have to anticipate his deadly gambits.
453	00:34:23	00:34:27	Location like this fits my profile of Jekyll.
454	00:34:27	00:34:32	I'm thinking there may be a secret passageway to an underground operating room.
455	00:34:32	00:34:34	(gasps) Ow. Geez!
456	00:34:34	00:34:37	Toolbox just happened to fall on her head?
457	00:34:37	00:34:39	That's what happened. I swear.
458	00:34:39	00:34:43	So, tell me more about the secret passageway theory.
459	00:34:43	00:34:46	I'm not buying it, Mr. Grady.
460	00:34:46	00:34:48	And I don't think Heidi was, either.
461	00:34:48	00:34:55	I think Heidi realized that there was nothing in that building but a story and a pathetic little man who had spun it for some attention.
462	00:34:55	00:35:01	She called you out on it-- she humiliated you-- so you attacked her.
463	00:35:01	00:35:05	You smashed her head into that toolbox, grabbed her by the throat...
464	00:35:05	00:35:06	No.
465	00:35:07	00:35:09	No. No.
466	00:35:09	00:35:11	Uh, no, no, no, no, no.
467	00:35:11	00:35:19	Okay, yeah, maybe she wasn't thrilled about the head wound and some of my theories, but I certainly did not touch her.
468	00:35:19	00:35:22	She gave me a ride back to the medical school.
469	00:35:22	00:35:23	She was alive when she dropped me off.
470	00:35:23	00:35:27	And I was not lying.
471	00:35:29	00:35:31	We never should have breached Jekyll's lair.
472	00:35:31	00:35:36	But we did-- he tasted her blood, he hunted her down, and he finished her.
473	00:35:36	00:35:38	Where's Dr. Langston?
474	00:35:38	00:35:40	Excuse me? I need to speak to Dr. Langston.
475	00:35:40	00:35:43	He understands the kind of criminal mastermind that we're after.
476	00:35:53	00:36:01	The palm print on the toolbox is Vince's, but the bloody print on Heidi's steering wheel is definitely not.
477	00:36:01	00:36:03	Still unknown.
478	00:36:03	00:36:06	Well, it's consistent with the goofball's story.
479	00:36:06	00:36:09	Guy's delusional, but I don't think he killed her.
480	00:36:09	00:36:11	And we don't have any other suspects.
481	00:36:11	00:36:13	But we do have another theory.
482	00:36:14	00:36:16	Langston's.
483	00:36:16	00:36:22	If Langston was right and he led Heidi to Jekyll, we might find him somewhere in this Blue Aces surveillance footage.
484	00:36:22	00:36:25	Well, I've looked through it all.
485	00:36:25	00:36:27	She didn't talk to anybody.
486	00:36:27	00:36:32	She just follows Langston through the casino, into the bar, and then out again.
487	00:36:32	00:36:38	Besides, aside from a guy playing keno in his bloody scrubs, how are we even going to be able to identify Jekyll?
488	00:36:38	00:36:41	Some random five-foot-ten white dude?
489	00:36:41	00:36:43	Check out this guy.
490	00:36:43	00:36:49	He's playing a penny machine near Langston and Heidi, but when they were on the other side of the casino...
491	00:36:51	00:36:55	...the same guy is playing ten dollar slots, and again right by the two of them.
492	00:36:55	00:36:59	Now, nobody who plays pennies starts yanking ten dollars a spin like that.
493	00:36:59	00:37:02	Well, maybe I can get some other angles on this guy.
494	00:37:02	00:37:08	Yeah, but first, give me a surveillance still of Jekyll from the St. Sebastian's Hospital supply room.
495	00:37:08	00:37:10	Biometric comparison?
496	00:37:10	00:37:11	Yeah, exactly.
497	00:37:11	00:37:13	All right.
498	00:37:27	00:37:35	So, Heidi's following Langston and Jekyll is following one-- or both-- of them.
499	00:37:35	00:37:36	Yep.
500	00:37:36	00:37:42	And somewhere along the way, Heidi meets Jekyll, and he kills her.
501	00:37:42	00:37:44	Okay.
502	00:37:44	00:37:46	There are no more angles on this guy. No.
503	00:37:47	00:37:49	He's good. He ducks the cameras.
504	00:37:52	00:37:54	Hey, Jim.
505	00:37:54	00:37:59	So, we picked up a guy who was trying to pawn Heidi Custer's amber pendant, and her laptop and camera.
506	00:37:59	00:38:03	And his print matches the bloody print we found on the rental car.
507	00:38:03	00:38:05	Jim, it's got to be him-- Dr. Jekyll.
508	00:38:05	00:38:07	No, this kid is no Doogie Howser.
509	00:38:07	00:38:09	Been spilling his guts for the past two hours.
510	00:38:09	00:38:11	Name is Lou Brennan.
511	00:38:11	00:38:18	He's a busboy at the loony-tune coffeemaker Vince's place, and he was tweaked on more than a macchiato.
512	00:38:18	00:38:22	Said he saw Heidi talking to Vincent at the coffee stand.
513	00:38:22	00:38:25	Well, I'm working on a story for a big national news magazine.
514	00:38:25	00:38:27	Saw her flashing a lot of green.
515	00:38:27	00:38:29	Think a $100 latte might be the fix I need?
516	00:38:32	00:38:35	After Lou closed up, he waited for Heidi and Vince to come back.
517	00:38:36	00:38:38	What the hell?
518	00:38:38	00:38:40	Heard you give money to people who know stuff.
519	00:38:40	00:38:43	I know stuff about all kinds of stuff. You know what?
520	00:38:43	00:38:46	I have had a belly full of crap from losers today.
521	00:38:46	00:38:48	I am not giving you any money.
522	00:38:48	00:38:50	You don't think I know stuff?
523	00:38:51	00:38:54	You mop the floors for a guy who knows nothing, so no.
524	00:38:54	00:38:56	Now, get out of my car.
525	00:39:13	00:39:19	Claims he didn't mean to kill her, just accidentally strangled her for four and a half minutes.
526	00:39:22	00:39:25	Then, had to get rid of his mess.
527	00:39:34	00:39:37	So, Heidi's murder had nothing to do with Dr. Jekyll.
528	00:39:37	00:39:39	It was a simple crime of opportunity.
529	00:39:39	00:39:46	My big question is, if Jekyll wasn't after Heidi, what was he doing at the Blue Aces?
530	00:39:47	00:39:48	He was following me.
531	00:39:55	00:39:57	The man stole my I.D. badge.
532	00:39:57	00:39:58	He knows my face.
533	00:39:59	00:40:03	He could have followed me from the lab to that casino.
534	00:40:09	00:40:12	He could have followed me home.
535	00:40:12	00:40:14	He could have followed me here.
536	00:40:16	00:40:19	I can talk to Brass to get a protection detail for you.
537	00:40:21	00:40:24	You should think about wearing a gun again.
538	00:40:24	00:40:26	Jekyll's had plenty of opportunities to hurt me.
539	00:40:26	00:40:28	I don't think that's what he wants.
540	00:40:28	00:40:30	Don't be so sure.
541	00:40:30	00:40:33	Jekyll's meticulous, takes his time.
542	00:40:33	00:40:36	He might be planning something special for you.
543	00:40:38	00:40:40	Thanks.
544	00:40:40	00:40:42	Excuse me.
545	00:40:43	00:40:45	This is Langston.
546	00:40:46	00:40:48	It's been a while, Professor.
547	00:40:48	00:40:49	Who is this?
548	00:40:51	00:40:54	Did I come up on your phone as unknown?
549	00:40:54	00:40:57	And you answered anyway.
550	00:40:57	00:41:01	It's nice to know you haven't lost your faith in your fellow man.
551	00:41:03	00:41:06	How's the real world been treating you?
552	00:41:06	00:41:10	Ever get nostalgic for our school days?
553	00:41:11	00:41:12	Nate Haskell.
554	00:41:12	00:41:14	That's right.
555	00:41:14	00:41:18	Your favorite serial killer.
556	00:41:18	00:41:21	I'm calling with an exciting limited-time offer.
557	00:41:21	00:41:23	What do you want, Nate?
558	00:41:23	00:41:26	That's the wrong question, Professor.
559	00:41:26	00:41:28	This isn't about what I want.
560	00:41:28	00:41:30	This is about what you want.
561	00:41:30	00:41:34	Or rather... who you want.
562	00:41:34	00:41:37	I know who Dr. Jekyll is.
