	start	end	text
443	00:26:57	00:27:00	Or reflective.
444	00:27:00	00:27:02	I am in remission.
445	00:27:02	00:27:04	Thanks to Dr. Ryan.
446	00:27:04	00:27:07	And to Jeffrey's positive attitude.
447	00:27:07	00:27:08	And who is Jeffrey?
448	00:27:08	00:27:10	Jeffrey Fitzgerald.
449	00:27:10	00:27:11	He's a beautiful man.
450	00:27:11	00:27:12	Inside and out.
451	00:27:14	00:27:18	Mrs. Kemp, is that wig made from your real hair?
452	00:27:18	00:27:24	When I started to lose my hair, someone recommended a wig maker.
453	00:27:24	00:27:27	Jeffrey.
454	00:27:27	00:27:34	When your insides are eroding, your outside's all you have left.
455	00:27:34	00:27:39	Your, uh, wig maker, Jeffrey, was he was the one who collected your hair to make the wig?
456	00:27:39	00:27:41	No. I did.
457	00:27:41	00:27:42	I brought it to his studio.
458	00:27:42	00:27:43	It's out near Silverado Ranch.
459	00:27:43	00:27:44	Along with some of my dresses.
460	00:27:44	00:27:46	As inspiration.
461	00:27:46	00:27:47	Inspiration?
462	00:27:47	00:27:49	Jeffrey is an artist.
463	00:27:49	00:27:54	He asked me when I felt the most beautiful, so that he could repaint my life.
464	00:27:54	00:27:58	He knows hair like Monet knows light.
465	00:27:58	00:28:00	When was the last time you saw Jeffrey?
466	00:28:00	00:28:02	Just a few days ago.
467	00:28:02	00:28:05	He still comes around to give me a comb-out.
468	00:28:05	00:28:10	He sounds very devoted to you.
469	00:28:17	00:28:20	Mr. Fitzgerald! LVPD!
470	00:28:29	00:28:31	Mr. Fitzgerald?
471	00:28:31	00:28:33	Police department!
472	00:28:50	00:28:52	Let me see your hands!
473	00:28:52	00:28:53	Let me go! Let me go!
474	00:28:53	00:28:55	What did you do to her?
475	00:29:01	00:29:02	Stop looking at my hair.
476	00:29:02	00:29:03	Sorry, I can't help myself.
477	00:29:03	00:29:05	Hey.
478	00:29:05	00:29:06	You're just lucky your client's not pressing charges.
479	00:29:06	00:29:08	Charges?
480	00:29:08	00:29:12	I was performing a service, which you interrupted. A service?
481	00:29:12	00:29:13	That's what you're calling it?
482	00:29:13	00:29:15	My client is...
483	00:29:15	00:29:17	how shall we say...
484	00:29:17	00:29:25	a professional woman who lost a valuable asset, her hair, but doesn't have the assets to afford a proper transplant.
485	00:29:25	00:29:36	And so, I offered her an affordable, stitching acrylic hair directly into the scalp. And do you have a license to do that?
486	00:29:36	00:29:38	I'm certified in body modification.
487	00:29:38	00:29:46	However, my main trade is wig making, for a clientele that needs restorations, not only of the hair, but of their self-esteem.
488	00:29:46	00:29:48	Yeah, we've seen your work.
489	00:29:48	00:29:49	You're quite the artist. Thank you.
490	00:29:49	00:29:54	I, uh, I like to think that I give back what God hath taken away.
491	00:29:54	00:29:59	Well, you hath a very inflated idea of yourself, Mr. Fitzgerald.
492	00:29:59	00:30:03	Image is everything.
493	00:30:07	00:30:09	I knew this guy on days.
494	00:30:09	00:30:11	He had a hair phobia.
495	00:30:11	00:30:15	Any time there was a crime scene involving hair, he'd puke his guts out.
496	00:30:15	00:30:17	He'd hate this.
497	00:30:17	00:30:18	I got one of those.
498	00:30:18	00:30:19	Really?
499	00:30:19	00:30:21	What's your kryptonite?
500	00:30:21	00:30:24	Braids.
501	00:30:24	00:30:25	You got a hair thing, too?
502	00:30:25	00:30:27	No.
503	00:30:27	00:30:28	Braids.
504	00:30:28	00:30:32	Jeffery Fitzgerald had a thing for braids.
505	00:30:36	00:30:38	And vintage clothing, too.
506	00:30:38	00:30:39	What?
507	00:30:41	00:30:43	That dress look familiar?
508	00:30:44	00:30:45	I do smell mothballs.
509	00:30:57	00:30:59	And I...
510	00:30:59	00:31:01	smell a serial killer.
511	00:31:11	00:31:14	I smell conviction.
512	00:31:14	00:31:15	So, um...
513	00:31:15	00:31:19	when are you two crazy kids gonna let me know why I'm here?
514	00:31:20	00:31:22	Lucinda Kemp.
515	00:31:22	00:31:24	One of the lives you restored.
516	00:31:24	00:31:27	Yeah, yes, I gave her back her hair, restored her beauty.
517	00:31:27	00:31:28	And you're still doing that.
518	00:31:28	00:31:30	You give her a comb-out every week.
519	00:31:30	00:31:33	Is combing out a crime now?
520	00:31:38	00:31:41	You know what I think all this is for him?
521	00:31:41	00:31:42	Foreplay.
522	00:31:42	00:31:46	Before you have your real fun with these girls, am I right?
523	00:31:46	00:31:49	Do you recognize that morphine?
524	00:31:49	00:31:52	We found morphine in two dead women.
525	00:31:52	00:31:55	I've never seen it before.
526	00:31:55	00:31:56	Our guys just discovered it in your studio.
527	00:32:01	00:32:09	You found unmarked morphine, in a place that I rent, after you let yourself in without an invitation.
528	00:32:11	00:32:16	I'm sorry, I just don't see how that problem relates to me at all.
529	00:32:16	00:32:19	Legally speaking.
530	00:32:19	00:32:22	Fitzgerald can play cute all he likes.
531	00:32:22	00:32:23	We still hit the mother lode.
532	00:32:23	00:32:25	Lucinda's dress, Lucinda's hair, the morphine.
533	00:32:25	00:32:26	We got him.
534	00:32:26	00:32:28	What about hair braids?
535	00:32:28	00:32:31	Greg's running them now, along with the rest of the hair from Fitzgerald's studio.
536	00:32:31	00:32:33	You do not want to go into trace lab right now.
537	00:32:33	00:32:36	Where I don't want to go is into court without a DNA match on the hair.
538	00:32:36	00:32:43	I mean, all the morphine and dresses in the world won't matter at all if we can't connect Fitzgerald directly to the victim.
539	00:32:43	00:32:44	I hear you.
540	00:32:44	00:32:45	We got this. Okay, okay.
541	00:32:49	00:32:51	Paula?
542	00:32:51	00:32:52	Please, help.
543	00:32:52	00:32:55	I got free, but I can't see.
544	00:32:55	00:32:56	He forgot something downstairs.
545	00:32:58	00:33:00	I think he's coming back!
546	00:33:00	00:33:02	Paula!
547	00:33:07	00:33:09	LVPD!
548	00:33:31	00:33:32	Russell.
549	00:33:54	00:33:55	You okay?
550	00:33:58	00:34:00	Guy was interrupted.
551	00:34:03	00:34:04	Panicked.
552	00:34:04	00:34:05	Killed her quick.
553	00:34:05	00:34:08	He knew we were coming.
554	00:34:08	00:34:11	There's nothing you could've done.
555	00:34:11	00:34:13	Our best suspect was in custody.
556	00:34:13	00:34:16	Well, he's not our best anymore, is he?
557	00:34:16	00:34:19	Well, I want to know who is.
558	00:34:23	00:34:25	I don't know.
559	00:34:27	00:34:28	But he left a mess.
560	00:34:28	00:34:30	We'll find something.
561	00:34:33	00:34:36	Hey, Russell, we just got the call-- what's going on?
562	00:34:36	00:34:39	Process this scene with a fine-toothed comb.
563	00:34:39	00:34:40	Every inch of it.
564	00:34:43	00:34:44	Call me.
565	00:34:44	00:34:47	Yeah, you got it.
566	00:34:57	00:35:00	Man... I really thought we had this guy.
567	00:35:00	00:35:02	Well, who says we don't?
568	00:35:02	00:35:05	Maybe our wigmaker isn't working alone.
569	00:35:05	00:35:07	The hairs say we don't.
570	00:35:07	00:35:11	All of the wigs, the braids, the-the bales of hair from his studio.
571	00:35:11	00:35:13	None are a match to our victims.
572	00:35:13	00:35:15	Well, somebody really went after these women.
573	00:35:15	00:35:18	Yeah, somebody who had to have had a connection to Lucinda Kemp.
574	00:35:25	00:35:27	I got some short brown hairs here.
575	00:35:27	00:35:30	Obviously didn't come from her.
576	00:35:30	00:35:34	From our killer? Could be. We should be able to get a good DNA sample.
577	00:35:34	00:35:36	Hairs have tags that are pulled out at the root.
578	00:35:36	00:35:38	Might've happened during the struggle.
579	00:35:38	00:35:40	Mm-hmm.
580	00:35:47	00:35:50	Got what looks like a corner of a photo.
581	00:35:51	00:35:54	Well, where's the rest of it?
582	00:35:59	00:36:00	Here it is.
583	00:36:02	00:36:07	Killer might have jammed it up here for reference.
584	00:36:08	00:36:10	Wait a minute, now.
585	00:36:10	00:36:13	Now, does that look like a young Lucinda Kemp to you?
586	00:36:13	00:36:15	Sure does.
587	00:36:15	00:36:23	Well, if Jeffrey Fitzgerald isn't our killer, maybe it's someone who's even closer to Lucinda.
588	00:36:23	00:36:25	You think it's the son? You talked to him.
589	00:36:26	00:36:28	Hm.
590	00:36:28	00:36:31	Looks like we might have a pretty good print here.
591	00:36:31	00:36:32	We'll figure it out.
592	00:36:54	00:36:56	I'm sorry.
593	00:36:58	00:37:04	Where are we? Henry's running DNA on the hair, and Nick's working on the print-- we should have an answer soon.
594	00:37:06	00:37:10	When I was in Seattle, we had some guy running around...
595	00:37:10	00:37:12	killing coeds...
596	00:37:12	00:37:15	and my daughter was...
597	00:37:16	00:37:19	...roughly the same age at that time.
598	00:37:19	00:37:22	Every crime scene was like walking into her dorm room.
599	00:37:22	00:37:23	Did you catch the guy?
600	00:37:23	00:37:25	Yeah.
601	00:37:25	00:37:28	We're gonna catch this guy, too.
602	00:37:31	00:37:33	Yeah.
603	00:37:41	00:37:45	Can I tell you something crazy?
604	00:37:45	00:37:52	You know how kids are always bumping into something or falling onto something and they got those cuts and scrapes?
605	00:37:52	00:37:56	I've been saving my kids' Band-Aids for years.
606	00:37:57	00:38:00	Keep them in the refrigerator.
607	00:38:00	00:38:01	DNA reference.
608	00:38:01	00:38:03	Yeah.
609	00:38:03	00:38:05	It's not so crazy.
610	00:38:06	00:38:09	I know somebody who used to work here.
611	00:38:09	00:38:11	She used to do the same thing.
612	00:38:42	00:38:46	Henry ran DNA on that hair we found in Paula Bingham's bathroom.
613	00:38:46	00:38:48	Yeah? Compared it to Lucinda Kemp.
614	00:38:48	00:38:50	No familial match.
615	00:38:50	00:38:51	It's not Adam.
616	00:38:51	00:38:53	Are you sure about that? Yeah.
617	00:38:53	00:38:55	'Cause I ran it again myself.
618	00:38:55	00:38:57	Her son's not our killer.
619	00:38:57	00:39:00	So we're down to the print.
620	00:39:00	00:39:02	Moment of truth.
621	00:39:07	00:39:09	That's our guy?
622	00:39:13	00:39:15	What, not even a courtesy call this time?
623	00:39:15	00:39:17	Not this time.
624	00:39:25	00:39:30	Perhaps we should have this conversation in my office. I think we should do it down at the station.
625	00:39:40	00:39:45	First we thought this was a picture of Lucinda Kemp, but it's not, is it?
626	00:39:45	00:39:48	It's your mother, back when she was...
627	00:39:48	00:39:51	young and healthy. And beautiful.
628	00:39:51	00:39:53	Before the cancer took it all away.
629	00:39:53	00:39:56	Hospital records show, uh, your mother died at age 51.
630	00:39:56	00:40:00	Yeah, but I'm sure she looked a lot older by then-- a lot like Lucinda Kemp.
631	00:40:00	00:40:02	That's when all this started, isn't it?
632	00:40:02	00:40:07	Lucinda came to you for treatment, and it was like your mother was coming back.
633	00:40:09	00:40:11	Hey, Doc!
634	00:40:11	00:40:13	We searched your house.
635	00:40:13	00:40:14	We found the hair products.
636	00:40:14	00:40:15	We found the makeup.
637	00:40:15	00:40:18	Same brands Lucinda uses.
638	00:40:18	00:40:20	You washed her hair; you helped her with her makeup.
639	00:40:20	00:40:24	Must have been great to have Mom back again, right?
640	00:40:24	00:40:28	Right up until you didn't. Until Jeffrey the wig guy gave her something that her doctor couldn't.
641	00:40:28	00:40:32	I wasn't just her doctor; I was everything to her.
642	00:40:32	00:40:34	Lean back...
643	00:40:41	00:40:43	Yeah, but then she left you, right?
644	00:40:43	00:40:45	Just like your mother did?
645	00:40:45	00:40:48	No, actually, not exactly like your mother did.
646	00:40:48	00:40:51	Because you didn't put Lucinda out of her misery, the way you did Mom.
647	00:40:51	00:40:52	Found that in the medical records, too.
648	00:40:52	00:40:54	Death by morphine overdose.
649	00:40:54	00:41:00	Hospital investigation proved inconclusive, but you were interning at the same hospital, right?
650	00:41:00	00:41:01	Wow.
651	00:41:01	00:41:02	You killed your mother.
652	00:41:02	00:41:04	I ended her pain!
653	00:41:04	00:41:06	Yeah.
654	00:41:06	00:41:10	Just like you did those other women-- Eva...
655	00:41:10	00:41:12	Joyce, Paula...
656	00:41:12	00:41:15	All attempts to recreate your mother.
657	00:41:15	00:41:22	We found the hair that you cut from all those women, with the date and place when it was taken.
658	00:41:22	00:41:24	You are a very meticulous...
659	00:41:24	00:41:25	man, Dr. Ryan.
660	00:41:25	00:41:27	You're kind of a mama's boy, actually.
661	00:41:27	00:41:28	Do you think you know me?!
662	00:41:28	00:41:31	You don't know me at all.
663	00:41:37	00:41:39	You know something? You're right, I don't.
664	00:41:41	00:41:43	I need to step out for a minute.
665	00:41:46	00:41:48	You're done, Doc.
666	00:42:07	00:42:09	Hey, Catherine.
667	00:42:09	00:42:10	I didn't wake you up, did I?
668	00:42:10	00:42:14	No, I know, I know, I'm gonna go home in a minute.
669	00:42:14	00:42:17	I'm just not quite ready yet, you know?
670	00:42:18	00:42:20	One of those days.
671	00:42:20	00:42:22	No, we're fine, we're fine.
672	00:42:22	00:42:29	Uh... my wife and I have a little contract between us-- there are certain things I don't bring home from work.
673	00:42:30	00:42:33	And, um...
674	00:42:33	00:42:35	well, today, um...
675	00:42:38	00:42:43	I lost one today, Catherine, and, uh...
676	00:42:43	00:42:52	you know, I can't stop seeing her-her face, and... can't stop feeling like, you know, there's something I should have done, you know, something more.
677	00:42:52	00:42:54	No, I know, I know.
678	00:42:54	00:42:55	I-I will, I will.
679	00:42:55	00:42:57	It's, um...
680	00:42:57	00:43:01	I just wanted to talk to you.
681	00:43:01	00:43:02	Knew you'd understand.
