	start	end	text
438	00:28:48	00:28:52	And when I went down to pick them up, I put my hand in some very un-eco-friendly battery acid.
439	00:28:52	00:28:54	Why'd you drop your gloves?
440	00:28:54	00:28:57	You know, they really shouldn't even let you out of the lab.
441	00:28:57	00:28:59	May I cite you in my Workmen's Comp case?
442	00:28:59	00:29:04	How about citing your results from the blue fibers Super Dave found on Mr. Chambliss, instead?
443	00:29:04	00:29:06	Lucky for you, I can work through the pain.
444	00:29:08	00:29:11	Your blue fibers-- denim.
445	00:29:11	00:29:13	Of the phylum Levis.
446	00:29:13	00:29:15	So jeans. Almost.
447	00:29:15	00:29:21	Just as you'll never get the chance to run Grave, these never got the chance to be pants.
448	00:29:21	00:29:23	How much pain do you want to have to work through, Hodges?
449	00:29:23	00:29:25	Please turn to page two.
450	00:29:26	00:29:30	The fibers were saturated in borate-- fire retardant.
451	00:29:30	00:29:35	Jean companies will pulp their cutting-room scraps and sell them for insulating materials.
452	00:29:35	00:29:37	Which is used in green construction.
453	00:29:37	00:29:39	So how does insulation end up on Dad?
454	00:29:39	00:29:41	Well, maybe he was doing some sort of home improvement?
455	00:29:41	00:29:44	Or maybe the killer works construction.
456	00:29:46	00:29:48	You don't have to be mean about it.
457	00:30:02	00:30:04	Morgan, Greg, get in here.
458	00:30:09	00:30:13	This is the exact layout of John Lee's bedroom, except he didn't have one of these.
459	00:30:13	00:30:15	Yeah, and the electrical panel's in the garage.
460	00:30:24	00:30:26	Good call, Hollywood.
461	00:30:26	00:30:28	I love it when I'm right.
462	00:30:28	00:30:31	We searched the house, John.
463	00:30:31	00:30:32	We know about the drugs.
464	00:30:32	00:30:36	So these awful people that went into the house-- is-is that what they came for?
465	00:30:36	00:30:39	They let strange men sit on her bed.
466	00:30:39	00:30:41	Made her sit out in the hallway.
467	00:30:41	00:30:45	One time, she forgot her doll.
468	00:30:45	00:30:47	Tried to come back in and get it.
469	00:30:47	00:30:50	Her dad yelled at her.
470	00:30:50	00:30:51	She cried.
471	00:30:53	00:30:55	He yelled a lot.
472	00:30:55	00:30:57	Did he ever yell at anybody else?
473	00:31:20	00:31:24	Got a hit-- multiple arrests for drug possession.
474	00:31:25	00:31:27	Lonny Gallows.
475	00:31:27	00:31:29	John, you saw something happen in that house.
476	00:31:29	00:31:32	You saw someone arguing with Fiona's dad.
477	00:31:32	00:31:35	Who?
478	00:31:40	00:31:43	John, is this the guy?
479	00:31:45	00:31:49	Hey! Did you ever see this man, John?
480	00:31:51	00:31:53	Yes.
481	00:31:53	00:31:55	In Fiona's bedroom?
482	00:31:55	00:31:57	Yes.
483	00:31:59	00:32:01	Yes, a lot.
484	00:32:04	00:32:05	Lonny Gallows?!
485	00:32:12	00:32:14	(grunts) Get out of here.
486	00:32:14	00:32:16	Where you going, dude? Yo, I didn't do nothing!
487	00:32:16	00:32:18	Yeah, pat him down good, Mitch.
488	00:32:19	00:32:24	(Lonny sighs) Lonny, this looks bad.
489	00:32:24	00:32:26	Yeah, this looks worse.
490	00:32:26	00:32:28	Lonny Gallows, you're under arrest.
491	00:32:28	00:32:31	Possession for sales of a controlled substance.
492	00:32:31	00:32:33	Well, you're in a lot more trouble than that, bud.
493	00:32:33	00:32:36	Hey, what are you doing with my son?
494	00:32:36	00:32:37	Arresting him for murder.
495	00:32:37	00:32:39	My son didn't kill anyone.
496	00:32:39	00:32:44	Sir, stay out of this now. You don't want to interfere with a police investigation.
497	00:32:44	00:32:46	Those boots are mine.
498	00:32:46	00:32:48	So are the gloves.
499	00:32:48	00:32:51	Arrest me. I did it.
500	00:32:51	00:32:53	I'm the one who killed the Chambliss family.
501	00:32:53	00:32:54	You got to be kidding me.
502	00:33:03	00:33:05	You understand lying to a police officer is a crime.
503	00:33:05	00:33:08	I'm not lying. Really?
504	00:33:08	00:33:09	I got your file.
505	00:33:09	00:33:13	You know, Mr. Gallows, you've never done anything wrong in your life.
506	00:33:13	00:33:17	You're a family man, you own your own business, you're doing well.
507	00:33:17	00:33:19	You're the only guy in construction that I know who's making money.
508	00:33:19	00:33:21	Then you massacre a family?
509	00:33:21	00:33:23	I want to make a deal.
510	00:33:23	00:33:25	I'm not making a deal with you because I don't believe you.
511	00:33:25	00:33:28	I did it. Listen, listen, we know your son's a drug addict.
512	00:33:28	00:33:33	He was high when we busted him and it's pretty safe to assume he was high a couple of nights ago when he committed these crimes.
513	00:33:33	00:33:39	We found his prints all over the cash and drugs in the Chambliss house. That's how we know he was running drugs for Cal Chambliss.
514	00:33:39	00:33:42	I get it-- you want to protect your kid.
515	00:33:42	00:33:44	I did protect my kid by killing that family.
516	00:33:46	00:33:48	Lonny got clean in rehab.
517	00:33:48	00:33:54	I tried to keep him clean, I put him on my crew building green houses-- same damn houses in Cal Chambliss' neighborhood.
518	00:33:54	00:33:56	So that's how they met.
519	00:33:56	00:33:59	It's my fault, my mistake.
520	00:33:59	00:34:01	Here's how I correct it.
521	00:34:01	00:34:04	You drop the drug charges on Lonny...
522	00:34:04	00:34:08	and I'll tell you everything.
523	00:34:08	00:34:18	Well, thanks to Maurice Gallows' confession, Leslie Gitig just got sprung, and our perv John Lee just made bail.
524	00:34:18	00:34:19	I'm telling you, it pays to have rich parents.
525	00:34:19	00:34:21	I don't see the dad doing it.
526	00:34:21	00:34:24	No, no, man, he's taking the rap for his son.
527	00:34:24	00:34:30	Okay, so Lonny's dealing drugs for Chambliss, gets hooked, starts dipping into his boss' supply.
528	00:34:30	00:34:32	Cal cuts him off, and Lonny just decides to gets even.
529	00:34:32	00:34:37	Great, so our only viable suspect is the one person who hasn't confessed to the crime.
530	00:34:43	00:34:46	Any thoughts?
531	00:34:46	00:34:48	Yeah.
532	00:34:48	00:34:50	Who killed Cock Robin?
533	00:34:52	00:34:54	Those shrooms in your office aren't medicinal, are they?
534	00:34:54	00:34:56	I, said the Sparrow.
535	00:34:56	00:34:59	With my bow and arrow, I killed Cock Robin.
536	00:34:59	00:35:00	Who saw him die?
537	00:35:00	00:35:01	I, said the Fly.
538	00:35:01	00:35:04	With my little eye, I saw him die.
539	00:35:04	00:35:06	I, said the Fish, I, said...
540	00:35:06	00:35:07	Oh, come on.
541	00:35:07	00:35:08	All right, forget folk songs.
542	00:35:08	00:35:10	Uh, crime novels.
543	00:35:10	00:35:12	Yeah, I saw the movie.
544	00:35:12	00:35:14	What's, what's your point?
545	00:35:14	00:35:15	The p... (sighs)
546	00:35:15	00:35:17	Nick, when you were hooking up Lonny, what did his father say-- exact words?
547	00:35:17	00:35:21	He said, I did it, I'm the one who killed the Chambliss family.
548	00:35:21	00:35:27	I, said John Lee, I did it, I'm the one who killed the Chambliss family.
549	00:35:27	00:35:32	I, said Leslie Gitig, I did it, I'm the one who killed the Chambliss family.
550	00:35:32	00:35:35	Now, that's three confessions, all identical.
551	00:35:35	00:35:38	Hell of a coincidence. So it's like they got their stories straight.
552	00:35:38	00:35:39	They were working together.
553	00:35:39	00:35:40	Strangers on a Train.
554	00:35:40	00:35:44	Total strangers get together to commit a crime, figuring the cops won't make the connection.
555	00:35:44	00:35:47	And each one of them had motive to do harm to someone in that family.
556	00:35:47	00:35:50	And each had reason to confess.
557	00:35:50	00:35:51	By all confessing, they muddied the water.
558	00:35:51	00:35:56	There is no perfect crime, but if you create enough reasonable doubt, you might just have the perfect defense.
559	00:35:56	00:35:58	And that's something a legal secretary would know.
560	00:35:58	00:36:01	Now, how do we get around reasonable doubt?
561	00:36:03	00:36:04	Find the train.
562	00:36:07	00:36:09	All right, thank you.
563	00:36:11	00:36:13	So I just spoke with the owner of Benson's Auto Body.
564	00:36:13	00:36:17	Two weeks ago, Leslie Gitig paid him $4,500.
565	00:36:17	00:36:18	Benson's Auto Body?
566	00:36:18	00:36:20	That's where John Lee works.
567	00:36:20	00:36:21	Could be where they met.
568	00:36:21	00:36:26	Leslie's BMW was in an accident and she didn't want to run it through her insurance.
569	00:36:26	00:36:29	She paid cash, but not just for her repair but for the truck that she plowed into.
570	00:36:29	00:36:30	Truck, what kind of truck?
571	00:36:30	00:36:33	I don't know, the driver hasn't brought it in yet.
572	00:36:33	00:36:35	Maybe 'cause he needed it for work.
573	00:36:35	00:36:39	I saw a couple of thousand dollars worth of damage to Maurice Gallows' truck.
574	00:36:39	00:36:46	All right, well, sounds like we need to take a look at that truck, compare the damage to Leslie's car.
575	00:36:46	00:36:47	I'll take the truck.
576	00:36:47	00:36:49	Greg and I'll take the Beemer.
577	00:36:51	00:36:55	Victor 2-4, Victor 2-4. Come in.
578	00:36:55	00:36:57	Nice job matching the color.
579	00:36:57	00:36:59	Well, yeah, to the naked eye anyway.
580	00:37:06	00:37:08	Yep, left-side damage.
581	00:37:08	00:37:10	I'll call for a warrant.
582	00:37:11	00:37:13	3-David-34.
583	00:37:13	00:37:15	Shots fired. Request backup at our location.
584	00:37:15	00:37:18	2-David-3-4, copy that. 4-34 call.
585	00:37:28	00:37:29	We got one down.
586	00:37:42	00:37:47	We need rescue at 10923 Cartland Avenue.
587	00:37:47	00:37:49	Put the gun down!
588	00:37:49	00:37:50	Put the gun down! Now!
589	00:37:50	00:37:51	Stay with her.
590	00:37:51	00:37:53	Drop the gun.
591	00:37:53	00:37:54	John...
592	00:37:54	00:37:56	please...
593	00:37:56	00:37:58	do what he says.
594	00:37:58	00:37:59	Put down the gun.
595	00:38:00	00:38:03	They made me go there.
596	00:38:03	00:38:04	She made me.
597	00:38:04	00:38:06	Leslie?
598	00:38:06	00:38:11	She said I could have her, but she didn't tell me what we had to do.
599	00:38:11	00:38:15	And then the screaming started.
600	00:38:16	00:38:23	The shooting-- it was so loud and there was blood.
601	00:38:23	00:38:25	There was so much blood.
602	00:38:25	00:38:26	John, we can talk about this.
603	00:38:26	00:38:28	You've got to put the gun down.
604	00:38:28	00:38:30	She said Fiona had to die.
605	00:38:30	00:38:32	She gave me her gun...
606	00:38:32	00:38:35	this gun.
607	00:38:35	00:38:36	(screams) Oh, shut up!
608	00:38:36	00:38:38	I just couldn't do it. Give me that.
609	00:38:38	00:38:39	No, no!
610	00:38:41	00:38:43	She was so beautiful.
611	00:38:43	00:38:50	I didn't want to remember her like that, so I came back afterward.
612	00:38:56	00:38:59	That awful woman.
613	00:38:59	00:39:04	Sh-She took my Fiona away from me.
614	00:39:05	00:39:10	Now... I have nothing.
615	00:39:15	00:39:18	We found the murder weapons at Leslie Gitig's house.
616	00:39:18	00:39:21	Knife, gun-- the real one.
617	00:39:21	00:39:24	I killed Chambliss and his family, like I said.
618	00:39:24	00:39:30	Well, it's a good story, but this gun tells a better one.
619	00:39:30	00:39:32	Maurice, your son did it.
620	00:39:32	00:39:38	The gun goes back to him, so unless you make us understand what really happened, Lonny's going to get the needle.
621	00:39:39	00:39:43	This is crazy, you know, I...
622	00:39:43	00:39:45	I'd blame Leslie.
623	00:39:45	00:39:47	It wasn't like she hit your truck by accident.
624	00:39:47	00:39:50	That's just the beginning of the damage she did to you and your family.
625	00:39:50	00:39:53	There are no accidents, right?
626	00:39:53	00:39:59	A woman scorned parks outside her ex-lover's house night after night, thinking about how to destroy him?
627	00:39:59	00:40:02	What does she see?
628	00:40:02	00:40:04	A pedophile lusting after a little girl...
629	00:40:04	00:40:09	Stop pushing drugs on my son or I swear I will kill you. ...and a father fighting for his son. You and your whole family!
630	00:40:09	00:40:12	Three strangers who all want something.
631	00:40:12	00:40:14	They just need to meet.
632	00:40:16	00:40:22	I did everything I could to get Lonny clean, and it was working.
633	00:40:22	00:40:24	Then he met Cal, and I was losing him again.
634	00:40:28	00:40:31	She swore it was just going to be Cal.
635	00:40:31	00:40:33	Cal's expecting me.
636	00:40:33	00:40:34	She lied.
637	00:40:39	00:40:41	What are you waiting for?
638	00:40:41	00:40:45	Once I stepped into that house, I had no choice.
639	00:40:49	00:40:50	Run!
640	00:40:50	00:40:52	No!
641	00:40:53	00:40:55	(gasps) You bitch!
642	00:41:07	00:41:09	(Fiona screaming) Give me that.
643	00:41:09	00:41:10	No, no!
644	00:41:13	00:41:21	You know what it's like to lose a kid to drugs, to wish the world for 'em and see that world come crashing down around 'em?
645	00:41:23	00:41:26	I do, actually.
646	00:41:29	00:41:31	I do.
647	00:41:31	00:41:35	But it still doesn't justify killing a whole family.
648	00:41:50	00:41:51	I'm going to head out.
649	00:41:51	00:41:52	You need anything?
650	00:41:52	00:41:55	No, I'm good, thank you.
651	00:41:55	00:41:57	I'll see you tomorrow.
652	00:42:02	00:42:03	Cock Robin.
653	00:42:03	00:42:05	Really? (chuckles)
654	00:42:05	00:42:08	What journal did you get that one from?
655	00:42:08	00:42:14	My parents were singers, and that was kind of a favorite around our, our van.
656	00:42:14	00:42:15	Oh.
657	00:42:15	00:42:17	Go with what you know, right?
658	00:42:17	00:42:19	Yeah.
659	00:42:19	00:42:21	Well, it worked, it really worked.
660	00:42:22	00:42:24	What's going on?
661	00:42:24	00:42:25	Are you all right?
662	00:42:33	00:42:34	Aren't you going to get that?
663	00:42:34	00:42:36	I don't want to be rude.
664	00:42:36	00:42:38	Oh, be rude.
665	00:42:38	00:42:39	Good night.
666	00:42:41	00:42:43	Good night.
667	00:42:43	00:42:46	Hey, doll, how are you?
668	00:42:46	00:42:48	Uh, don't worry about it.
669	00:42:48	00:42:50	I-I'll pick something up for us on the way home.
670	00:42:50	00:42:53	Yeah, hey, hey, wait, how, how did Charlie do in practice?
