	start	end	text
408	00:26:29	00:26:33	And even though he's gone, I still think he's somehow watching over me and his family.
409	00:26:36	00:26:40	They were up on a shelf in James's room, sitting there like trophies.
410	00:26:40	00:26:46	Well, I guess if your mystical guardian angel returns them, you're not just gonna wear them around, right?
411	00:26:46	00:26:47	Check this out.
412	00:26:47	00:26:51	Bully Ben was reported missing by his family a year ago.
413	00:26:51	00:26:53	That's consistent with James's story.
414	00:26:53	00:26:56	He's working a night shift at a burger joint, never came home.
415	00:26:56	00:26:59	18 years old, behavior issues, cops just figured it was a runaway.
416	00:26:59	00:27:01	Well, I don't think it was that simple.
417	00:27:01	00:27:03	Look at this.
418	00:27:05	00:27:07	Blood spatter. High-velocity.
419	00:27:07	00:27:10	Not talking a nosebleed or a fistfight.
420	00:27:10	00:27:11	Gunshot.
421	00:27:11	00:27:16	Okay, there is a DNA sample of Ben Drayton's in the missing persons database.
422	00:27:16	00:27:18	Let's get a comparison.
423	00:28:03	00:28:06	Surveillance footage from Ben Drayton's final shift at the burger joint.
424	00:28:06	00:28:08	He's the last guy there, so he's closing up.
425	00:28:08	00:28:10	Look at that.
426	00:28:10	00:28:12	He's wearing the shoes he took from James.
427	00:28:12	00:28:16	Now a shadowy someone catches his attention.
428	00:28:21	00:28:23	Is that it?
429	00:28:23	00:28:24	Gone.
430	00:28:24	00:28:28	Sara, they're telling me that I might not get Eli back for months.
431	00:28:28	00:28:29	You need to help me.
432	00:28:29	00:28:31	Tell them you know me.
433	00:28:31	00:28:33	Yeah, I'm sorry, Tina. Really, I am.
434	00:28:33	00:28:35	But there's nothing I can do.
435	00:28:38	00:28:40	Oh, so this is how this works?
436	00:28:40	00:28:47	CSIs just show up, and if I don't let them into my house, then my life just gets ripped away from me?
437	00:28:47	00:28:48	You didn't let us in four years ago.
438	00:28:48	00:28:51	We wanted to be there for you, and then none of this...
439	00:28:52	00:28:54	I have to go back to work now.
440	00:28:54	00:28:56	If I would've let you in, I...
441	00:28:56	00:28:58	I wouldn't be alive.
442	00:29:00	00:29:06	After Warrick died, Eli was the only thing that kept me from ending things.
443	00:29:06	00:29:09	I told myself that he needed me.
444	00:29:09	00:29:13	He was the reason to... to get up, to go through the motions, and...
445	00:29:13	00:29:15	if I would've let you all in...
446	00:29:16	00:29:22	...Eli wouldn't have needed me, and I wasn't gonna let that happen.
447	00:29:24	00:29:28	Eli's always going to need you.
448	00:29:28	00:29:29	And he'll be back, Tina.
449	00:29:32	00:29:35	But you need to find your way back first.
450	00:29:46	00:29:48	The journey of the wandering gym shoes continues.
451	00:29:48	00:29:52	We analyzed trace on the soles--think we've figured where they may have taken their last steps.
452	00:29:52	00:29:56	Trace of rust and auto paint chips in oil-saturated soil.
453	00:29:56	00:29:58	Auto junkyard, no?
454	00:29:58	00:30:00	Why would Ben Drayton have gone there?
455	00:30:00	00:30:03	I can think of more reasons why someone would've taken him there.
456	00:30:03	00:30:04	Junkyard's a secluded place.
457	00:30:04	00:30:06	Late at night.
458	00:30:12	00:30:16	I found a junkyard a mile away from Ben's burger joint.
459	00:30:16	00:30:21	I realize it's a year-old crime scene, so fat chance of evidence, but...
460	00:30:21	00:30:23	He may still be there.
461	00:30:23	00:30:24	Lots of land.
462	00:30:24	00:30:25	Crammed with wreckage.
463	00:30:25	00:30:27	Why take the body anywhere else?
464	00:30:31	00:30:33	All right, thanks.
465	00:30:37	00:30:42	You know, even if there is a body out here, half a million pounds of steel could be on top of it.
466	00:30:42	00:30:43	Yeah.
467	00:30:45	00:30:46	What is that?
468	00:30:46	00:30:48	It is a ten-dollar long shot.
469	00:30:48	00:30:55	(chuckles) I noticed on the surveillance video that Ben Drayton had a find-my-key fob on his keychain.
470	00:30:55	00:31:01	You know, lose your keys, click this button, keychain beeps, find your keys. Yeah, yeah.
471	00:31:01	00:31:03	Well, it's worth a shot.
472	00:31:03	00:31:04	Yep.
473	00:31:31	00:31:33	Well...
474	00:31:33	00:31:40	short of clearing the yard and bringing in ground-penetrating radar, there's nothing to indicate a burial.
475	00:31:40	00:31:43	There's no signs of a soil disturbance anywhere.
476	00:31:43	00:31:46	Yeah, no slabs of suspiciously-poured concrete.
477	00:31:46	00:31:49	(beep pinging) No bones unearthed by helpful dogs.
478	00:31:49	00:31:51	Whoa, whoa, whoa, whoa. What?
479	00:31:51	00:31:53	Hit that thing again.
480	00:32:00	00:32:01	No.
481	00:32:23	00:32:25	Yeah, that's Ben Drayton.
482	00:32:28	00:32:30	Died with his boots off.
483	00:32:31	00:32:33	All right, let's get him out here, boys.
484	00:32:33	00:32:36	Jimmy, grab the head.
485	00:32:36	00:32:37	Okay, on three.
486	00:32:37	00:32:40	One, two, three.
487	00:32:56	00:32:58	Bullet's in there.
488	00:32:58	00:32:59	Okay. I'll tell Doc.
489	00:32:59	00:33:03	Killer could've pulled this trunk liner from any one of these wrecks.
490	00:33:03	00:33:07	Bundled the body to contain the blood before digging the grave.
491	00:33:07	00:33:08	That's not all he bundled.
492	00:33:08	00:33:10	Take a look at this hair.
493	00:33:16	00:33:17	Near the victim's feet.
494	00:33:20	00:33:22	Could be from the assailant.
495	00:33:22	00:33:25	James Newman thinks that the universe is granting him wishes.
496	00:33:29	00:33:31	Let's hope that he kept it to three.
497	00:33:37	00:33:39	Russell.
498	00:33:39	00:33:41	Yeah. Uh, the hair that was buried with the bully?
499	00:33:41	00:33:43	I ran the DNA profile against James Newman.
500	00:33:43	00:33:46	It's not his hair, but it is a new lead.
501	00:33:46	00:33:49	Hair shares alleles with James, so the killer...
502	00:33:49	00:33:52	...has to be a male relative of his-- father, brother, son.
503	00:33:52	00:33:54	James is an only child.
504	00:33:54	00:33:55	No kids of his own.
505	00:33:55	00:33:57	Dad in the picture?
506	00:33:57	00:33:58	Certainly is now.
507	00:34:00	00:34:02	Hey.
508	00:34:02	00:34:04	You, uh, balancing your checkbook?
509	00:34:04	00:34:07	No, I'm just following the money-- not mine, by the way.
510	00:34:07	00:34:09	I spoke with James's aunt.
511	00:34:09	00:34:13	She said that nobody knows who James' father is-- Mom would never say.
512	00:34:13	00:34:19	But I figured, guy's killing to protect his son-- maybe he'd help out in other ways.
513	00:34:19	00:34:25	Money. Aunt Jo said that the only financial help that she's gotten has been checks from the mother's life insurance.
514	00:34:25	00:34:28	But she killed herself, so there should be no payment.
515	00:34:28	00:34:33	Exactly why I asked her for the info off of the most recent check she received.
516	00:34:33	00:34:35	I was just entering it now.
517	00:34:38	00:34:40	The checks came from a private account...
518	00:34:42	00:34:44	...opened by Warrick Brown.
519	00:34:44	00:34:47	Warrick opened the account ten years ago.
520	00:34:47	00:34:50	And it has a balance of $50,000.
521	00:34:50	00:34:52	Warrick actually have that much extra cash?
522	00:34:52	00:34:59	I wouldn't have thought so, but even weirder-- the deposits kept getting made into the account after Warrick's death.
523	00:34:59	00:35:01	Banking from beyond.
524	00:35:07	00:35:09	Aaron Voss has been shot.
525	00:35:09	00:35:12	That's the kingpin from Warrick's neighborhood.
526	00:35:12	00:35:17	Well, we know the killer is all about protecting James, you know, making the world safe for him.
527	00:35:17	00:35:20	If Aaron Voss was making that neighborhood a dangerous place...
528	00:35:20	00:35:23	Guardian Angel is going to make it dangerous for Aaron Voss.
529	00:35:28	00:35:30	Kingpin Voss's vehicle?
530	00:35:30	00:35:32	Just got back from the scene.
531	00:35:32	00:35:35	Witnesses said a silver Escalade just pulled up and popped him.
532	00:35:37	00:35:39	Rushed to Desert Palm, stable.
533	00:35:39	00:35:43	Same witnesses gave us a partial plate on the shooter's vehicle.
534	00:35:43	00:35:45	Willing to help when it's the boss who's been shot.
535	00:35:45	00:35:47	Patrol is hunting down the Escalade right now.
536	00:35:47	00:35:53	Russell...yeah, I tracked money wires into the Warrick account that was helping to support James Newman.
537	00:35:53	00:35:55	Funds came from a Nevada corp.
538	00:35:55	00:35:57	XL Industries.
539	00:35:57	00:36:05	They own a number of properties around Vegas-- commercial buildings, apartments, and the junkyard where Ben Drayton's body was buried.
540	00:36:05	00:36:12	So whoever's behind XL Industries killed and buried Ben Drayton on his property, and has been giving money to support James.
541	00:36:12	00:36:13	Who is it?
542	00:36:13	00:36:15	(phone chimes) Oh, hold on a sec.
543	00:36:15	00:36:17	Yeah, Finn.
544	00:36:17	00:36:19	Officers caught up with Voss's shooter.
545	00:36:19	00:36:20	They just brought him in. And?
546	00:36:20	00:36:22	Definitely not our Guardian Angel.
547	00:36:22	00:36:27	He's a 19-year-old banger from another hood who was, uh, making a power grab.
548	00:36:27	00:36:30	Sounds like the same guy who took a shot at Voss last week.
549	00:36:30	00:36:31	We still got our killer out there.
550	00:36:31	00:36:34	Thank you.
551	00:36:34	00:36:36	Russell...
552	00:36:36	00:36:39	...there's only one name associated with XL Industries.
553	00:36:45	00:36:47	I'll get Henry to run DNA, confirm paternity.
554	00:36:50	00:36:52	Hey.
555	00:36:52	00:36:54	Hey.
556	00:36:54	00:36:57	Voss was shot in the front seat, not the, um, trunk.
557	00:36:57	00:37:00	Car is evidence for whatever case we want.
558	00:37:04	00:37:08	This is a trunk liner that was wrapped around Ben Drayton's body.
559	00:37:08	00:37:10	Very d-distinct wear patterns.
560	00:37:16	00:37:19	Aaron Voss killed and dumped Ben Drayton.
561	00:37:19	00:37:24	Wouldn't be the first time a father got hands-on with his son's bully.
562	00:37:24	00:37:25	Voss is James' father?
563	00:37:25	00:37:27	Yeah, how about that, huh?
564	00:37:27	00:37:30	Did you find any trace on the passenger side?
565	00:37:30	00:37:32	Uh, no, I was still working on the driver's side.
566	00:37:32	00:37:36	'Cause the reverend still had the chalk on his shoe from Tina's house.
567	00:37:36	00:37:41	Hadn't walked it off yet, which means he had to have gotten a ride to the cemetery.
568	00:37:41	00:37:44	The car was freshly vacuumed.
569	00:37:53	00:37:56	Well, look at that.
570	00:37:57	00:38:00	Mark of the reverend.
571	00:38:00	00:38:04	Hard to believe that just fell out of his pocket into that crevice.
572	00:38:04	00:38:08	More likely, the reverend knew that when the local crime boss gets you in his car...
573	00:38:10	00:38:12	...You may not be seen again.
574	00:38:16	00:38:24	Probably just stuffed the handkerchief in the cushion here as a Hail Mary bread crumb to get Voss busted.
575	00:38:24	00:38:26	(grunts) For making him kneel one last time.
576	00:38:32	00:38:34	Why Warrick's grave?
577	00:38:34	00:38:38	Maybe as a warning to anyone else who might want to mess with Tina.
578	00:38:38	00:38:41	Stay away from Warrick Brown's family.
579	00:38:41	00:38:43	Warning came too late for Cliff Paul.
580	00:38:47	00:38:48	No, no-no...
581	00:38:57	00:38:58	Homie, I am titanium.
582	00:38:58	00:39:00	Lead can't scratch me.
583	00:39:00	00:39:03	Car wash, cocktail, I'm straight.
584	00:39:03	00:39:06	Yeah, we'll talk how to handle that.
585	00:39:06	00:39:09	All's forgiven and forgotten, Officer.
586	00:39:09	00:39:12	No need to waste community resources.
587	00:39:12	00:39:13	Well, that's very generous of you.
588	00:39:13	00:39:17	So willing to look past the misdeeds of others, even after you take a bullet.
589	00:39:17	00:39:20	Actually, I want to talk to you about your misdeeds.
590	00:39:20	00:39:22	I don't know what you're talking about.
591	00:39:22	00:39:24	We know that you're James's father.
592	00:39:24	00:39:25	DNA proved that.
593	00:39:25	00:39:30	We also know that you've been providing for him, financially, in Warrick Brown's name.
594	00:39:30	00:39:32	You remember Warrick, right?
595	00:39:32	00:39:38	The guy who was the real man in your son's life, not just some scumbag crook.
596	00:39:38	00:39:44	Warrick wanted to play the hero, so I let him... on my dollar.
597	00:39:44	00:39:45	So what?
598	00:39:45	00:39:49	So what is that's not the only way you've been providing for your son.
599	00:39:49	00:39:55	You keep your eyes on him, you know when he's getting into trouble, like when the bully gave him that hard time.
600	00:39:55	00:39:56	You remember that?
601	00:39:56	00:40:09	Or when James was trying to buy a gun from one of your corner guys to protect Warrick's family-- now, you saw that go down and you decided, Well, I'm gonna take care of that myself so my son doesn't have to.
602	00:40:09	00:40:12	Bottom line-- you killed three people.
603	00:40:12	00:40:16	I got to be honest with you...
604	00:40:16	00:40:17	That doesn't sound like me.
605	00:40:17	00:40:19	No? Looking out for a kid...
606	00:40:21	00:40:26	...Protecting him so he can grow up, get out, become something.
607	00:40:28	00:40:33	Why would a scumbag crook like Aaron Voss do something like that?
608	00:40:38	00:40:44	Aaron Voss, you're under arrest for the murders of Ben Drayton, Rick Renken, and Cliff Paul.
609	00:40:44	00:40:45	You have the right to remain silent...
610	00:40:50	00:40:52	Tell you the truth, man...
611	00:40:52	00:40:54	I always liked believing Warrick was my dad.
612	00:40:54	00:40:55	Really?
613	00:40:55	00:40:57	Yeah.
614	00:40:57	00:41:02	Being the son of a guy like Aaron Voss-- I don't know what to do with that.
615	00:41:02	00:41:03	No, you don't have to do anything with it.
616	00:41:03	00:41:06	I mean, Voss doesn't have to mean anything to you.
617	00:41:06	00:41:09	It's not like he ever offered himself as a father.
618	00:41:09	00:41:12	Besides, you don't really need his kind of looking out for you, anyway.
619	00:41:12	00:41:13	You know what I mean?
620	00:41:13	00:41:15	So is he going away?
621	00:41:15	00:41:16	Yeah, he is.
622	00:41:16	00:41:20	And by playing guardian angel to you, he may have just saved that whole neighborhood.
623	00:41:20	00:41:21	Yeah, from him.
624	00:41:21	00:41:23	Exactly.
625	00:41:23	00:41:25	Warrick would be happy.
626	00:41:25	00:41:26	Yeah, I think so.
627	00:41:28	00:41:33	You know, I still hear him talking to me sometimes, you know, when things are going wrong and...
628	00:41:33	00:41:35	I know it sounds crazy.
629	00:41:35	00:41:39	No, it doesn't sound crazy; not to me.
630	00:41:39	00:41:42	Warrick...walks beside me every day.
631	00:41:42	00:41:44	He's the source of a lot of my strength.
632	00:41:46	00:41:48	He's a good friend to have, man.
633	00:41:49	00:41:51	Don't ever let him go.
634	00:41:54	00:41:56	The church is cleaning out the reverend's bad deals.
635	00:41:56	00:41:58	The house is going to stay yours.
636	00:41:59	00:42:10	I... I really appreciate that, and, Sara, about what you said about finding my way back, I'm in--meetings, counseling, whatever it takes.
637	00:42:10	00:42:12	Um, I spoke with CPS.
638	00:42:12	00:42:19	Um, Eli is going to stay with a foster family for a couple of days, but then they're gonna talk to you about what comes next.
639	00:42:24	00:42:26	You know, you, uh...
640	00:42:26	00:42:29	you could have called me with this, Sara.
641	00:42:29	00:42:33	I gave you my number and I--I promise...
642	00:42:33	00:42:34	I'll answer now.
643	00:42:34	00:42:36	Okay.
644	00:42:36	00:42:40	But, um, I wanted you to have a minute.
645	00:42:40	00:42:41	What?
