	start	end	text
0	00:00:34	00:00:35	You need anything else, hon?
1	00:00:35	00:00:38	He loves his little sister.
2	00:00:38	00:00:39	Look at...
3	00:00:39	00:00:40	I love 'em.
4	00:00:40	00:00:42	Here you go, Miss Connie.
5	00:00:42	00:00:43	Oh, thank you. You're welcome.
6	00:00:43	00:00:45	Edie, did I show you these yet? Aw.
7	00:00:45	00:00:47	Look how precious.
8	00:00:47	00:00:49	I can't believe how big those grandbabies are getting. I know.
9	00:00:49	00:00:51	Hey, guys. Whenever you're ready, okay?
10	00:00:51	00:00:53	Thanks. Thanks, Edie.
11	00:00:53	00:00:57	Sheila, it's 4 Do we really have to fight about this now?
12	00:00:57	00:00:58	Looking good.
13	00:00:58	00:00:59	Not for you, young lady.
14	00:00:59	00:01:01	We've been married for three years.
15	00:01:01	00:01:04	You know me better than that. Strawberries.
16	00:01:04	00:01:12	I don't know what your secret is, but one of these days, you're gonna have to share it with my brother. Babe, why do we keep having the same conversation?
17	00:01:12	00:01:14	It's not going to change anything.
18	00:01:14	00:01:15	But it's not up to you.
19	00:01:15	00:01:19	This time it's up to me.
20	00:01:19	00:01:22	I don't know how you keep that figure drinking one of these every night.
21	00:01:22	00:01:24	Work it off on stage, honey. Trust me.
22	00:01:26	00:01:27	You should come see the show sometime.
23	00:01:27	00:01:30	Yeah.
24	00:01:40	00:01:43	00.
25	00:01:43	00:01:47	I'm-I'm staying a while longer.
26	00:01:47	00:01:49	Is that guy still bothering you?
27	00:01:49	00:01:51	Can't you two make him disappear?
28	00:01:51	00:01:56	Hey, I'll tell you what, we'll have a little talk with him on the way out. Thanks.
29	00:02:01	00:02:03	Looks like your problem disappeared, Edie.
30	00:02:03	00:02:04	3-David-11, respond to 308...
31	00:02:04	00:02:06	Control, 3-David-11, copy.
32	00:02:06	00:02:08	Bye, guys.
33	00:02:08	00:02:11	All right, see you, fellas.
34	00:02:11	00:02:13	I got to get more hash browns.
35	00:02:13	00:02:14	Okay.
36	00:02:38	00:02:41	Hey, you know what I'm talking about, though.
37	00:02:41	00:02:42	I'm talking about the dish with the tortillas and the...
38	00:02:42	00:02:44	Yeah, I know what you mean.
39	00:02:44	00:02:51	(sighs) I can't believe we've been coming here for the past 12 years and you've never had the chilaquiles.
40	00:02:51	00:02:52	I don't like chilaquiles.
41	00:02:52	00:02:54	Seriously? Have you had Vincent's? No.
42	00:02:54	00:02:55	Sara. Huh?
43	00:02:55	00:02:56	Help me out here.
44	00:02:56	00:02:58	You know, I'm not a fan either.
45	00:02:58	00:02:59	Really? Yeah... Hi.
46	00:02:59	00:03:01	Vincent call you guys, too?
47	00:03:01	00:03:03	No, we're just coming here to grab something to eat. Why?
48	00:03:03	00:03:05	Not sure. Vincent said he's stuck in the fridge.
49	00:03:05	00:03:07	Can't get his brother to answer his cell.
50	00:03:07	00:03:09	Maybe he's enjoying some chilly-killies.
51	00:03:09	00:03:12	No, no, its cheelay-keelays.
52	00:03:15	00:03:16	Oh, my God.
53	00:03:16	00:03:19	Control, 3-David-10.
54	00:03:19	00:03:21	Multiple 419s at Frank's Diner.
55	00:03:21	00:03:23	Owen's dead.
56	00:03:23	00:03:24	Yeah, so is Dahlia.
57	00:03:26	00:03:28	It's Edie.
58	00:03:28	00:03:29	We just left her.
59	00:03:32	00:03:35	Let's take the back.
60	00:03:35	00:03:36	Come on, let's go.
61	00:03:37	00:03:38	Clear.
62	00:03:38	00:03:40	Clear.
63	00:03:40	00:03:41	Freezer.
64	00:03:45	00:03:47	Whoa, whoa, whoa. J-Just me, guys.
65	00:03:47	00:03:48	Hey, Vincent, let's go out back.
66	00:03:48	00:03:50	Why? Wh-What's happening?
67	00:03:50	00:03:53	Go in there. Come on, come on.
68	00:03:53	00:03:54	Vincent, stop, Vincent, no.
69	00:03:54	00:03:56	No.
70	00:03:56	00:03:57	Vincent... No.
71	00:03:57	00:03:59	Come on, man.
72	00:03:59	00:04:01	There's blood on the floor here.
73	00:04:01	00:04:02	This can't be! I just...
74	00:04:02	00:04:04	Nick...
75	00:04:04	00:04:07	They're all dead.
76	00:04:47	00:04:49	What the hell happened?
77	00:04:49	00:04:51	You were here? We'd just left.
78	00:04:51	00:04:53	Captain, it was only a couple minutes. Register's cleaned out.
79	00:04:53	00:04:55	It looks like a robbery, maybe.
80	00:04:55	00:04:57	Maybe? Edie was having trouble with some guy, a stalker.
81	00:04:57	00:04:59	He was hanging around out front.
82	00:04:59	00:05:01	Well, did you do anything about it? Wish we had.
83	00:05:01	00:05:03	We were gonna go talk to him, but he was gone before we even got outside.
84	00:05:03	00:05:04	We know this guy, right?
85	00:05:04	00:05:06	Yeah. Yes.
86	00:05:06	00:05:08	So put a broadcast on! Get him here!
87	00:05:08	00:05:09	Yes, sir.
88	00:05:19	00:05:22	Oh, man.
89	00:05:22	00:05:26	You know, I-I been coming here probably 20 years.
90	00:05:26	00:05:29	Even had Thanksgiving dinner here when I first came to Vegas.
91	00:05:29	00:05:32	Shooter must've come in the front door.
92	00:05:32	00:05:34	I mean, the trouble started right there with Owen.
93	00:05:34	00:05:37	And you know Dahlia always sits at the counter.
94	00:05:37	00:05:38	Must've tried to jump in.
95	00:05:38	00:05:40	Once a marine, always a marine.
96	00:05:49	00:05:52	I always used to notice them when they came in here.
97	00:05:52	00:05:54	The way they looked at each other.
98	00:05:54	00:05:57	They seemed so... content.
99	00:05:57	00:06:00	Seemed to have marriage all figured out.
100	00:06:00	00:06:02	Look at that.
101	00:06:09	00:06:13	I know most of the faces in here.
102	00:06:13	00:06:15	Ever see these two guys before?
103	00:06:15	00:06:17	No, I haven't.
104	00:06:17	00:06:21	But Connie was always happy to see a fresh face so she could show off her grandkids.
105	00:06:22	00:06:24	All this carnage, you know.
106	00:06:24	00:06:26	I don't buy robbery.
107	00:06:27	00:06:30	Akers is putting a broadcast out on the stalker.
108	00:06:30	00:06:32	Ronald Basderic.
109	00:06:34	00:06:37	Been terrorizing Edie for six months.
110	00:06:37	00:06:39	Wasn't enough to kill her.
111	00:06:39	00:06:41	He wanted to destroy her whole world.
112	00:06:43	00:06:45	Gunshot to the head, up close and personal.
113	00:06:45	00:06:48	I tried to help her get a restraining order, but the judge denied it.
114	00:06:48	00:06:51	Basderic has been very careful.
115	00:06:51	00:06:54	He'd push right up to the line and never cross it.
116	00:06:54	00:06:57	Until now.
117	00:06:57	00:06:59	Shoe impression.
118	00:06:59	00:07:01	They don't match any of the shoes in here.
119	00:07:02	00:07:04	I got to take this.
120	00:07:06	00:07:08	Yeah, go ahead.
121	00:07:56	00:07:58	Whoa.
122	00:07:58	00:08:00	You step on my finger, I'll kill you.
123	00:08:00	00:08:02	Ten inches in front of your left foot.
124	00:08:02	00:08:03	Could you mark it?
125	00:08:07	00:08:08	Thanks.
126	00:08:10	00:08:15	Hey, guys, could I just have an hour to be alone so I can work the blood?
127	00:08:15	00:08:19	I was just going to check the walk-in.
128	00:08:19	00:08:20	Is there blood?
129	00:08:20	00:08:21	No.
130	00:08:21	00:08:22	Okay.
131	00:08:57	00:08:59	Hello?
132	00:09:26	00:09:27	Ah.
133	00:09:27	00:09:29	Hey, Finn.
134	00:09:29	00:09:31	I found something.
135	00:09:31	00:09:37	(laughs) Well, I'd... I'd love to, but, uh... you're gonna have to come to me.
136	00:09:37	00:09:39	This is so horrible.
137	00:09:39	00:09:42	I know it's been a long night, Vincent, but they still need to talk to you.
138	00:09:42	00:09:45	It's okay, Charlie, I'll take care of him.
139	00:09:45	00:09:47	Yeah. Hey, Vincent. Nick.
140	00:09:47	00:09:49	How could this happen? I don't know yet, man.
141	00:09:49	00:09:51	We're just getting started.
142	00:09:51	00:09:52	Now, do you have any other clothes?
143	00:09:52	00:09:57	'Cause the minute you stepped in blood, you became evidence, you know that, right? No, I-I understand.
144	00:09:57	00:10:00	How many times have I heard you guys talk about crime scenes?
145	00:10:00	00:10:02	No, no, that's okay, I'll get it.
146	00:10:02	00:10:03	I'll get it. Just relax.
147	00:10:08	00:10:11	Okay, turn around for me.
148	00:10:15	00:10:16	Vincent?
149	00:10:16	00:10:17	Oh, God.
150	00:10:17	00:10:19	That's Sheila, Owen's wife.
151	00:10:19	00:10:20	Vincent, they called me, but they're wrong.
152	00:10:20	00:10:22	It's not true, right?
153	00:10:22	00:10:23	He's okay! Please!
154	00:10:23	00:10:24	Tell me he's okay!
155	00:10:24	00:10:26	I'm so sorry.
156	00:10:26	00:10:28	No! Sheila.
157	00:10:28	00:10:29	No, no, Vincent.
158	00:10:29	00:10:30	Now, get back.
159	00:10:30	00:10:32	I can't let you do that.
160	00:10:32	00:10:34	Not until I've processed your clothes, okay?
161	00:10:34	00:10:35	Okay.
162	00:10:42	00:10:44	What's all the fuss?
163	00:10:44	00:10:46	You look okay to me.
164	00:10:46	00:10:48	And here I thought you weren't gonna come visit me.
165	00:10:48	00:10:50	You got in just under the wire, mister.
166	00:10:50	00:10:51	Yeah, I know. I'm sorry. No, that's...
167	00:10:51	00:10:55	Barbara and I had to take Maya and Katie back up to Seattle.
168	00:10:55	00:10:57	I took a little time off.
169	00:10:57	00:10:58	How you feeling?
170	00:10:58	00:11:01	You know...
171	00:11:02	00:11:04	Honestly, it hurts.
172	00:11:04	00:11:08	I wouldn't recommend getting shot.
173	00:11:08	00:11:12	Although it did get my daughter to tell me she loves me, so...
174	00:11:12	00:11:13	Can't be bad. Yeah.
175	00:11:13	00:11:16	How is your family?
176	00:11:16	00:11:18	Better.
177	00:11:18	00:11:19	Thank you.
178	00:11:19	00:11:21	Barbara's gonna stay there for a while.
179	00:11:21	00:11:24	Help them get settled in.
180	00:11:28	00:11:30	Damn it. Oh, come on.
181	00:11:34	00:11:36	There it is.
182	00:11:36	00:11:38	Thanks. Yeah.
183	00:11:39	00:11:40	Good, you're dressed.
184	00:11:40	00:11:42	We got to go. Hi.
185	00:11:42	00:11:44	Honey, look, if you don't have the time...
186	00:11:44	00:11:45	No, I-I want to take you home.
187	00:11:45	00:11:46	I just can't stick around.
188	00:11:46	00:11:48	Got a call. All hands on deck.
189	00:11:48	00:11:50	That's the diner? Mm-hmm.
190	00:11:50	00:11:52	Finn told me that she had that handled.
191	00:11:52	00:11:55	Well, I got all hands.
192	00:11:55	00:11:57	All right. I better take off.
193	00:11:57	00:11:59	I'm happy to see you.
194	00:11:59	00:12:00	Really, thanks for stopping by.
195	00:12:00	00:12:01	Yeah.
196	00:12:01	00:12:03	See you there.
197	00:12:08	00:12:10	Hey.
198	00:12:10	00:12:12	You're not supposed to be working, remember?
199	00:12:12	00:12:14	No, you're right.
200	00:12:14	00:12:16	Hmm.
201	00:12:16	00:12:17	I'm gonna get a nurse.
202	00:12:17	00:12:19	Get you out of here.
203	00:12:25	00:12:28	Yeah, it's Ecklie. Get me the sheriff.
204	00:12:30	00:12:37	You know, I appreciate you having my back, but I think you might have misrepresented the situation just a little bit.
205	00:12:37	00:12:39	Yeah, in what way?
206	00:12:39	00:12:42	Pretty sure that I said that it was something that I could handle.
207	00:12:42	00:12:47	I think your exact words were, It's nothing to worry about.
208	00:12:47	00:12:48	Oh, and are you worried?
209	00:12:48	00:12:49	Yeah, a little bit.
210	00:12:49	00:12:51	You look stumped.
211	00:12:51	00:12:52	I'm not stumped.
212	00:12:52	00:12:53	I'm thinking.
213	00:12:53	00:12:57	I've released the other bodies, but there's something odd about these three.
214	00:12:57	00:12:59	I'm going with stumped.
215	00:13:00	00:13:03	Thinking.
216	00:13:03	00:13:06	Look at the blood on this guy's chin.
217	00:13:06	00:13:09	Unless gravity's been altered, it's going the wrong way.
218	00:13:09	00:13:11	Yeah, you're right.
219	00:13:11	00:13:14	This guy's lying down now, but he had to be upright when he was shot. Mm-hmm.
220	00:13:14	00:13:17	And over here, on this guy...
221	00:13:19	00:13:22	There's no exit wound, and yet, his back is all bloody.
222	00:13:22	00:13:25	Which means he was laying down, not sitting.
223	00:13:25	00:13:26	Where's her wound?
224	00:13:30	00:13:33	(sighs) On the right.
225	00:13:33	00:13:37	How was she shot on the right while she was sitting here?
226	00:13:37	00:13:40	She wasn't.
227	00:13:40	00:13:45	Someone moved all three of these bodies after they were shot.
228	00:13:51	00:13:52	Hey. Hi.
229	00:13:52	00:13:54	Whoa.
230	00:13:54	00:13:55	They had a camera in the walk-in?
231	00:13:55	00:14:00	Yeah, Vincent said someone was pilfering steak and lobster a while back.
232	00:14:00	00:14:02	How long was Vincent in there?
233	00:14:02	00:14:10	Well, the camera's motion-activated, and there's no time code, so I checked cell records from the first time he dialed his brother until the cops let him out.
234	00:14:10	00:14:12	Under seven minutes.
235	00:14:12	00:14:14	You buy he got locked in there?
236	00:14:14	00:14:17	It happens easier than you'd think.
237	00:14:17	00:14:18	Not interrupting.
238	00:14:18	00:14:22	I just, uh... I wanted to find out about, uh, your father.
239	00:14:22	00:14:26	Uh, he's getting out of the hospital today, and I wanted to see how that all went.
240	00:14:26	00:14:28	It was... fine.
241	00:14:28	00:14:30	Thank you for asking, though.
242	00:14:30	00:14:32	Yeah, it's, uh, no trouble at all.
243	00:14:32	00:14:35	Uh, to ask, I mean.
244	00:14:37	00:14:39	Uh, yeah, I'm-I'm... I'm gonna go.
245	00:14:44	00:14:45	Did he seem weird to you?
246	00:14:45	00:14:48	I mean, weirder than usual.
247	00:14:48	00:14:51	No, not at all.
248	00:14:52	00:14:54	I got three more in the hallway.
249	00:14:54	00:14:56	Well, I can always use the overtime.
250	00:14:56	00:14:58	Why don't you, uh, prep this young lady?
251	00:14:58	00:15:01	I'm almost done with Dahlia. Yeah.
252	00:15:11	00:15:12	Can I help you?
253	00:15:12	00:15:15	I'm looking for a loved one who was brought in.
254	00:15:15	00:15:16	Edie Graham.
255	00:15:19	00:15:21	Reception let you come back here?
256	00:15:21	00:15:25	I might have given them the impression I worked for the mortuary.
257	00:15:25	00:15:27	So, you're the next of kin?
258	00:15:27	00:15:29	I'm the closest thing Edie's got.
259	00:15:29	00:15:31	We were gonna be married.
260	00:15:32	00:15:34	I see, Mr...
261	00:15:34	00:15:36	Basderic.
262	00:15:36	00:15:40	David, call Sara.
263	00:15:40	00:15:45	Tell her to bring down Edie's paperwork right away for Mr. Basderic.
264	00:15:45	00:15:47	Right.
265	00:16:06	00:16:08	We met at the diner where she worked.
266	00:16:08	00:16:10	I went in there a lot.
267	00:16:10	00:16:14	She was always so good to me.
268	00:16:14	00:16:16	So warm.
269	00:16:16	00:16:17	I just knew.
270	00:16:19	00:16:23	And I could see in her eyes... she felt it, too.
271	00:16:23	00:16:25	I'm sorry for your loss.
272	00:16:33	00:16:35	Right there.
273	00:16:35	00:16:37	I can't allow you to touch her.
274	00:16:49	00:16:52	I'd like to put the ring on her finger.
275	00:16:52	00:16:55	No, I'm sorry.
276	00:16:56	00:16:59	That's him. That's Basderic.
277	00:17:06	00:17:08	Hello, Ronald.
278	00:17:13	00:17:14	It's a match.
279	00:17:17	00:17:18	You're done, you son of a bitch.
280	00:17:28	00:17:29	Where are my clothes?
281	00:17:29	00:17:30	I want my clothes.
282	00:17:30	00:17:34	That prison jumpsuit is the only clothes you need to worry about now.
283	00:17:34	00:17:39	When you return them, I expect them to be in the condition in which you received them.
284	00:17:39	00:17:40	I'm very particular.
285	00:17:40	00:17:42	We have you in the diner, Ronald.
286	00:17:42	00:17:44	You stepped in Edie's blood.
287	00:17:47	00:17:48	I went in to check on her.
288	00:17:48	00:17:51	Cops saw you stalking her from outside right before the shooting.
289	00:17:51	00:17:53	I wasn't stalking; I was observing.
290	00:17:53	00:17:54	You were there.
291	00:17:54	00:17:55	Yes.
292	00:17:55	00:17:59	But I knew the officers would harass me, so I took a walk around the block.
293	00:17:59	00:18:02	When I got back, I could tell something was wrong.
294	00:18:02	00:18:05	That's when I went inside.
295	00:18:07	00:18:09	She was already dead.
296	00:18:09	00:18:10	Why didn't you call 911?
297	00:18:10	00:18:12	Because she was already dead.
298	00:18:12	00:18:16	Okay, you didn't do it, so you must have seen who did.
299	00:18:16	00:18:19	I told you, I went for a walk around the block.
300	00:18:21	00:18:25	If I knew who killed Edie, I would tell you.
301	00:18:25	00:18:27	They took her from me.
302	00:18:27	00:18:29	She was mine.
303	00:18:31	00:18:33	Do you own a gun, Ronald?
304	00:18:34	00:18:36	I would never. I hate guns.
305	00:18:38	00:18:40	Open your mouth.
306	00:18:40	00:18:42	No.
307	00:18:42	00:18:44	You can't make me.
308	00:18:44	00:18:45	Not without my consent.
309	00:18:45	00:18:46	I can get a court order.
310	00:18:46	00:18:49	Good luck with that.
311	00:18:49	00:18:53	I can't imagine too many judges being receptive to your requests.
312	00:18:53	00:18:56	What with your corruption scandal and all.
313	00:19:04	00:19:06	Three bodies all moved after the fact.
314	00:19:06	00:19:09	Why were they moved, and who moved them?
315	00:19:09	00:19:10	Do we know who they are?
316	00:19:10	00:19:12	Yeah, this is Connie.
317	00:19:12	00:19:14	She was a regular at the diner.
318	00:19:14	00:19:19	00 a.m. shift so that she could be at home with her grandkids in the afternoon.
319	00:19:19	00:19:21	Their mom's a blackjack dealer.
320	00:19:21	00:19:23	This one I don't know.
321	00:19:23	00:19:25	Who is this, Super Dave?
322	00:19:25	00:19:28	Oh, I found an Arizona driver's license.
323	00:19:28	00:19:29	Robert Rios.
324	00:19:29	00:19:32	I ran him through mobile AFIS.
325	00:19:32	00:19:33	There's no criminal history.
326	00:19:36	00:19:39	And this guy, Alex Brenner.
327	00:19:39	00:19:40	Local address.
328	00:19:40	00:19:42	Look at that, brand-new license.
329	00:19:42	00:19:43	Mint condition.
330	00:19:43	00:19:45	I'm running his prints now.
331	00:19:52	00:19:54	Access blocked.
332	00:19:54	00:19:57	I have a feeling our friend Alex Brenner here isn't Alex Brenner.
333	00:19:57	00:20:02	Sheriff, I'm aware of the pressure that you're getting from the press on this case.
334	00:20:02	00:20:04	No, I know, I get it, I get it.
335	00:20:04	00:20:06	No, I don't disagree.
336	00:20:06	00:20:09	No, especially in light of what's going on in the department.
337	00:20:09	00:20:13	But I have a feeling that the answer you're looking for is staring at me right now in my office.
338	00:20:13	00:20:14	I'll get back to you.
339	00:20:14	00:20:16	Captain.
340	00:20:16	00:20:18	Karen Taylor, Deputy U.S. Marshal.
341	00:20:18	00:20:20	Your department ran fingerprints on someone we have an interest in.
342	00:20:20	00:20:22	Alex Brenner.
343	00:20:22	00:20:24	That's what you Feds are calling him, right?
344	00:20:24	00:20:28	And since it's U.S. Marshals in my office and not FBI, I'm guessing he was in Witness Protection.
345	00:20:28	00:20:30	So, who is he really?
346	00:20:30	00:20:31	Obviously, I can't tell you that.
347	00:20:31	00:20:32	Who are you protecting him from?
348	00:20:32	00:20:38	I can't tell you that, either. Miss Taylor, you dropped this guy in my jurisdiction without even bothering to call the department.
349	00:20:38	00:20:45	Now he's one of eight victims in a multiple homicide that just so happened to have killed several of my friends.
350	00:20:45	00:20:49	Now, you got about two seconds to tell me something or I'll have you thrown out of here.
351	00:20:50	00:20:54	Alex Brenner testified against some really bad people about four months ago.
352	00:20:54	00:20:57	We dropped him in Las Vegas just last week.
353	00:20:57	00:21:03	As for our failure to notify LVPD, frankly, we didn't know if you could be trusted.
354	00:21:03	00:21:05	(sighs) Okay.
355	00:21:05	00:21:11	So, these bad people, are they the kind that would sacrifice seven innocent lives just to get the one they want?
356	00:21:11	00:21:13	I believe so.
357	00:21:13	00:21:15	Yes.
358	00:21:21	00:21:24	Pretty intense look you have going on there.
359	00:21:24	00:21:26	What are you searching for?
360	00:21:26	00:21:28	Edie's stalker, Basderic.
361	00:21:28	00:21:30	He knows the law.
362	00:21:30	00:21:33	Up until last night, he has known exactly how far he could go without crossing the line.
363	00:21:33	00:21:34	Okay.
364	00:21:34	00:21:36	But the guy is sick.
365	00:21:36	00:21:37	Edie couldn't have been his first.
366	00:21:37	00:21:39	He-he must've screwed up somewhere before.
367	00:21:39	00:21:42	I just haven't been able to find it.
368	00:21:42	00:21:47	Well, have you tried searching court records for other TROs or denied apps?
369	00:21:47	00:21:48	Yeah, I did that.
370	00:21:48	00:21:50	I'm on criminal records now.
371	00:21:50	00:21:53	Ok, well, how about I take civil court.
372	00:21:53	00:21:54	Basderic's not a common name.
373	00:21:54	00:21:56	Well, you never know.
374	00:21:56	00:22:00	Oh, here's something. Apparently, Basderic was involved in a lawsuit.
375	00:22:00	00:22:02	Who sued him?
376	00:22:02	00:22:04	Actually, he was the plaintiff.
377	00:22:04	00:22:06	He sued for damages after some guy assaulted him.
378	00:22:06	00:22:12	Well, what do you want to bet that the guy was the boyfriend or the husband of some poor woman that Basderic was stalking?
379	00:22:12	00:22:18	Well, the judge sided with Basderic and awarded him almost $200,000.
380	00:22:18	00:22:20	I hate this guy.
381	00:22:20	00:22:22	I hate the way he works the law.
382	00:22:22	00:22:30	Well, this probably won't ease your blood pressure any, but during the assault, Basderic actually shot the guy.
383	00:22:30	00:22:32	He shot his attacker?
384	00:22:32	00:22:34	Legally, it was self-defense.
385	00:22:34	00:22:36	Point is...
386	00:22:36	00:22:38	he had a gun.
387	00:22:38	00:22:41	Hey, Doc. Hey.
388	00:22:41	00:22:43	We need to take a long, hard look at Alex Brenner.
389	00:22:43	00:22:45	You care to elaborate?
390	00:22:45	00:22:48	Well, he was in the Witness Protection Program.
391	00:22:48	00:22:50	We're thinking maybe that's what got him killed.
392	00:22:50	00:22:51	Along with everybody else in the diner.
393	00:22:51	00:22:53	What can you tell us about where he's been?
394	00:22:53	00:22:55	Well, there are some things that suggest his history.
395	00:22:55	00:22:57	Dental work, certainly.
396	00:22:57	00:22:58	I don't think it was done in the U.S.
397	00:22:58	00:23:00	Mexico, maybe. Hmm.
398	00:23:00	00:23:01	What else?
399	00:23:01	00:23:03	He was suffering from talcosis.
400	00:23:03	00:23:05	I found talc granulomas in his lungs.
401	00:23:05	00:23:09	Talc? Yeah, it's a condition usually associated with drug use.
402	00:23:09	00:23:13	People inject talc-diluted heroin or cocaine.
403	00:23:13	00:23:15	But there's no evidence that he was a drug user.
404	00:23:15	00:23:18	So how did the talc get into his body? Probably inhaled.
405	00:23:18	00:23:23	I'm thinking that he spent a lot of time in an environment where talc was used, breathed it in.
406	00:23:23	00:23:24	Yeah, drug environment.
407	00:23:24	00:23:27	If he was cutting heroin and cocaine with talc.
408	00:23:27	00:23:29	It's not an unreasonable inference.
409	00:23:29	00:23:31	Stomach content was waffles.
410	00:23:31	00:23:32	Is that significant?
411	00:23:32	00:23:37	If he ate waffles, that puts him in the corner booth where we found Rios.
412	00:23:39	00:23:41	What did Rios eat?
413	00:23:46	00:23:48	Hmm.
414	00:23:48	00:23:51	His stomach was filled with pizza.
415	00:23:51	00:23:54	Frank's Diner doesn't serve pizza.
416	00:23:54	00:23:56	Maybe he wasn't there to eat.
417	00:23:56	00:23:58	Okay, what more can you tell us about Rios?
418	00:23:58	00:24:02	I found fibers in his upper trachea and esophagus as well as his mouth.
419	00:24:02	00:24:05	I gave them to Hodges, but he hasn't tested them yet.
420	00:24:05	00:24:08	Until a minute ago, Mr. Rios here was on the back burner.
421	00:24:08	00:24:10	He's on the front burner now.
422	00:24:13	00:24:20	The pizza would have raised a red flag had I known that the diner didn't serve pizza, but I didn't know that the diner didn't serve pizza.
423	00:24:20	00:24:22	You care to guess why?
424	00:24:22	00:24:26	Because no one ever includes me whenever they go to the diner.
425	00:24:27	00:24:29	Positive for lead.
426	00:24:30	00:24:32	What about the fiber?
427	00:24:34	00:24:36	It's a microfiber.
428	00:24:36	00:24:40	Polyethylene terephthalate to be more precise.
429	00:24:40	00:24:42	More commonly known as polar fleece.
430	00:24:42	00:24:44	Like a jacket.
431	00:24:44	00:24:51	Or, considering that he inhaled it, I think Rios was wearing a ski mask.
432	00:24:56	00:24:58	The belt tested positive for lead.
433	00:24:58	00:24:59	Tells me he had a gun.
434	00:24:59	00:25:01	And a mask.
435	00:25:01	00:25:04	Robert Rios was not a victim.
436	00:25:04	00:25:07	He was the shooter.
437	00:25:11	00:25:14	Robert Rios had an Arizona license.
438	00:25:14	00:25:17	PD's there checking into him now.
439	00:25:17	00:25:20	I guess the bigger question is, if Rios is our shooter, who shot Rios?
440	00:25:20	00:25:22	Probably whoever hired him.
441	00:25:22	00:25:24	Could be the cartel if they were after Alex Brenner.
442	00:25:24	00:25:30	You know, once the dirty work's done, you bring somebody in; a cleaner.
443	00:25:30	00:25:32	Kill Rios, take his gun, move the bodies.
444	00:25:32	00:25:33	Okay, you know what?
445	00:25:33	00:25:35	Let's not wait for the cops in Arizona.
446	00:25:35	00:25:37	Dig into Rios. Get whatever you can, okay?
447	00:25:37	00:25:39	All right, I'm on it.
448	00:25:45	00:25:47	All right, I'm here. What's the issue?
449	00:25:47	00:25:51	I ran ballistics on all 15 rounds that were fired.
450	00:25:51	00:25:53	Turns out five of them were from a second gun.
451	00:25:53	00:25:58	Well, that's consistent with the idea of a cleaner, right? We know at least two of the shots were the ones that killed Rios.
452	00:25:58	00:26:01	And we've got the point-blank on the waitress, Edie.
453	00:26:01	00:26:03	Then I've got two misses.
454	00:26:03	00:26:05	Misses?
455	00:26:05	00:26:08	Wouldn't have thought a cleaner would be sloppy.
