	sentence	killer_gold	medion_time
302	who drives backwards on a downtown street	N	00:31:40.114
303	first degree murder	N	00:31:43.448
304	that 's how we see it	N	00:31:44.586
305	it 's okay	N	00:31:47.257
306	in that case my client is now prepared to make a statement	Y	00:31:50.314
307	tell him adam	Y	00:31:53.254
308	i may have hit the guy	Y	00:31:55.831
309	that 's some statement	N	00:31:57.093
310	okay	N	00:31:58.356
311	i remember hitting something	Y	00:32:00.438
312	it was dark	N	00:32:02.488
313	i-i just kept driving	Y	00:32:03.705
314	did n't look back	N	00:32:05.378
315	adam we found lice in the driver 's seat of your vehicle but your scalp was clean	Y	00:32:11.656
316	was there anyone else there	N	00:32:18.038
317	a witness who might support your account	Y	00:32:20.657
318	yeah someone was with me	Y	00:32:28.458
319	mark	Y	00:32:30.287
320	markrucker	Y	00:32:31.823
321	he can confirm everything i told you	Y	00:32:34.454
322	i want to see him	Y	00:32:36.785
323	is that the coward who killed brian	Y	00:32:38.455
324	what happened	N	00:32:39.864
325	he scare you	Y	00:32:40.346
326	talk a little funny	N	00:32:41.278
327	make a lot of noises	N	00:32:42.211
328	screamed	N	00:32:43.788
329	or maybe he just looked at you the wrong way	Y	00:32:45.847
330	get away from me	Y	00:32:48.194
331	you make me sick	Y	00:32:52.616
332	you said you 'd include me	N	00:33:04.489
333	you offered to help with my investigation and now you 're compromising it	N	00:33:06.667
334	you found the killer	Y	00:33:08.385
335	who says it was a hit-and-run	Y	00:33:09.477
336	not murder	N	00:33:10.569
337	he has a witness	Y	00:33:11.788
338	who will lie for him	Y	00:33:12.966
339	the witness can say whatever he wants	Y	00:33:14.888
340	the important thing is that adamwalkey was not alone when he killed brian	Y	00:33:17.385
341	until now i did not know who was with him	N	00:33:21.753
342	and now you do	N	00:33:24.216
343	his witness is our other suspect	Y	00:33:27.658
344	i read him his rights	Y	00:34:55.736
345	last chance for a lawyer	N	00:34:58.258
346	i did n't do anything	Y	00:34:59.960
347	why would i need a lawyer	Y	00:35:01.240
348	fire away	N	00:35:03.296
349	i have just one question does your head itch	Y	00:35:06.636
350	do i have to answer that	Y	00:35:09.793
351	i 'm going to just uh rearrange your part a little	Y	00:35:14.858
352	hmm	N	00:35:27.994
353	according to adamwalkey you were with him in his suv the other night and your head lice confirmed his statement	Y	00:35:31.476
354	they also tell me that you were driving	Y	00:35:38.359
355	yeah yeah i was with him	Y	00:35:40.858
356	and like he told you we did n't know he hit the guy	Y	00:35:42.898
357	how do you know what adam told us	Y	00:35:44.854
358	now why do n't you tell us what really happened	Y	00:35:53.973
359	well it was around midnight	N	00:35:57.858
360	and we were listening to the radio	Y	00:36:00.296
361	i changed the station	Y	00:36:02.292
362	adam got pissed	Y	00:36:03.358
363	dude what are you doing	Y	00:36:04.424
364	that song is a classic	N	00:36:05.518
365	it 's not a classic	N	00:36:06.477
366	it 's crap	N	00:36:07.436
367	it 's always been crap	N	00:36:08.898
368	now this this is tight	N	00:36:10.696
369	wh-what was that	N	00:36:13.917
370	probably a dog	N	00:36:15.287
371	let 's get out of here	N	00:36:16.663
372	we just kept driving	Y	00:36:19.038
373	it 's the truth	N	00:36:21.754
374	the evidence says otherwise	N	00:36:24.074
375	what are you talking about	N	00:36:27.696
376	well there were n't just lice in the suv	N	00:36:30.097
377	there were lice on the victim 's sweater	N	00:36:32.053
378	so who cares about lice	N	00:36:35.098
379	do you know what lice eat	Y	00:36:38.416
380	blood	N	00:36:41.917
381	i 'm pretty sure i can prove that the lice on brianclemonds came from your head	Y	00:36:47.258
382	we got out of the car	Y	00:36:53.778
383	we got to call the paramedics	Y	00:37:03.617
384	we tell anybody we are in trouble	Y	00:37:06.738
385	we could go to jail	Y	00:37:09.159
386	but i did n't want to leave him like that	Y	00:37:11.674
387	adam talked me into it	Y	00:37:13.598
388	he had a scholarship to duke next year you know	Y	00:37:15.115
389	he could n't risk it	Y	00:37:16.632
390	let me tell you what i think happened	Y	00:37:21.234
391	you and adam saw brian walking out of a liquor store carrying a six-pack	Y	00:37:24.955
392	you 're underage	Y	00:37:28.446
393	maybe you wanted him to front you some beer	Y	00:37:30.141
394	hey man can you do us a favor	Y	00:37:31.966
395	brian does n't respond	N	00:37:33.740
396	hey	N	00:37:35.498
397	what 's his problem	N	00:37:36.857
398	markrucker let 's find out	Y	00:37:37.853
399	then you got out of the car	Y	00:37:40.055
400	hey moron we just want you to buy us some beer	Y	00:37:43.084
401	markrucker how about we just grab yours huh	Y	00:37:43.816
402	adamwalkey what do you want	Y	00:37:44.548
403	markrucker what do you say	Y	00:37:45.927
404	you going to give it up	Y	00:37:47.781
405	you started taunting him	Y	00:37:49.676
406	and then everything escalated	N	00:37:52.975
407	the blood on the victim 's knuckles led us to adam	Y	00:38:07.416
408	the average male loses 80 hairs a day	N	00:38:11.074
409	a stray hair left behind lice which brings us to you	Y	00:38:13.759
410	it would have ended there but as you were about to drive away something caught your attention	Y	00:38:24.516
411	something in your rearview mirror	Y	00:38:29.657
412	and you took off	Y	00:38:52.137
413	i want a lawyer	Y	00:38:54.296
414	let me tell you something son	Y	00:38:56.056
415	gil the interrogation is over	N	00:38:57.131
416	he 's requested counsel	Y	00:38:59.159
417	fine	N	00:39:03.378
418	no more questions	N	00:39:05.936
419	just this	N	00:39:09.898
420	you want to know why brianclemonds ran away from you	Y	00:39:11.297
421	it was dark you were shouting at him and he did n't understand what you were saying	Y	00:39:15.619
422	brianclemonds was deaf	N	00:39:20.935
423	he was afraid of you	Y	00:39:26.399
424	but you were more afraid of him were n't you	Y	00:39:31.854
425	some people are just afraid	N	00:41:39.978
426	and that 's why they killed brian	Y	00:41:43.187
427	because he was different	N	00:41:44.763
428	you do n't see us as different	N	00:41:47.577
429	you 're not	N	00:41:49.617
430	who taught you to sign	N	00:41:51.657
431	my mother	N	00:41:54.818
432	tell me about her	N	00:41:56.553
433	and use your hands	N	00:41:57.899
434	you 're a little rusty	N	00:41:59.245
435	she lost her hearing when she was eight	N	00:42:06.115
436	loved to swim	N	00:42:14.377
437	i asked her what it was like to be deaf	N	00:42:18.508
438	she told me to stick my head under the water	N	00:42:22.639
439	true	N	00:42:26.770
440	she taught me not to make fun of she you everyone the same	N	00:42:30.901
