	sentence	killer_gold	medion_time
0	that club was hot we got a call about ten minutes ago a shooting at vegas grounds coffee shop eighth and main multiple fatalities	N	00:00:13.298
1	we 're just warming up my girl we want this one	N	00:00:15.254
2	wait wait wait keep me in the loop	N	00:00:18.770
3	i do n't think this is the right way keep the media out of it	N	00:00:19.592
4	it 's a shortcut right	N	00:00:20.415
5	a shortcut to where grissom turns to let them leave	N	00:00:21.716
6	stop catherine and nick walks up the sidewalk to the coffee shop	N	00:00:25.145
7	stop the car one person dead it 's a shame more than one 's a party	N	00:00:25.835
8	it was just a pothole get ready to pull a double	N	00:00:26.525
9	i think you hit someone they walk into the crime scene and look around	N	00:00:29.675
10	blonde behind the wheel brass walks up to them	N	00:00:41.137
11	girlfriend in the passenger seat called it in vehicular manslaughter welcome to the caffeine wars	N	00:00:47.215
12	taillight one in the back room	N	00:00:53.578
13	yeah guy was n't light with the ammo	Y	00:00:55.459
14	you been drinking warrick catherine walks up to one of the bodies and recognizes him	N	00:01:00.410
15	no hey i know this guy	N	00:01:01.153
16	i 'm having a block party i bet you do	N	00:01:01.896
17	i marked it where i found it over on the sidewalk over there who does n't know frankieflynn	N	00:01:19.936
18	two distinct tire treads one wide one narrow who 's the muscle	N	00:01:37.195
19	given the extensive bruising from the wide tread mark victim was killed by a larger vehicle this is alrobson frankieflynn 's bodyguard	N	00:01:40.719
20	not that compact cash taken	N	00:01:44.996
21	hey o'riley i would n't book those suspects just yet or the coffee	N	00:01:47.198
22	i think they ran over a corpse nick and catherine both head for the back of the counter	N	00:01:49.898
23	printed your hit-and-run brass looks around	N	00:02:54.038
24	afis found a match brianclemonds 22 born in vegas and he 's deaf maybe	N	00:02:57.837
25	you can tell he 's deaf by his fingerprints frankie drives a bulletproof car	N	00:03:01.154
26	actually yes he was printed as part of a state aid program in 81 what does that tell you	N	00:03:03.758
27	to confirm i examined his ear canal catherine sees the dead girl behind the counter and closes her eyes for a moment	N	00:03:06.854
28	normally the malleus is shaped like a hammer a long smooth handle connecting to a blunt head but brian 's malleus is knotted both of them birth defect she 's probably still in high school	N	00:03:13.395
29	there 's a college for the deaf about a mile from where we found him nick groans at the sight	N	00:03:20.778
30	so brian takes a walk crosses the street does n't hear the car gets creamed catherine closes her eyes	N	00:03:24.634
31	the vehicle probably a truck or an suv based on the width of the tire tread takes off nick walks past catherine to check on the body	N	00:03:28.398
32	later along comes a compact thump runs over his dead body bless her heart	N	00:03:33.333
33	maybe maybe not he kneels down	N	00:03:37.159
34	see the dried blood on his knuckles assuming flynn was the target and it was a hit the shooter followed flynn	Y	00:03:39.578
35	no associated wounding quick flashback to [_shooter_'s_pov_] of frankieflynn and alrobson as they walk into the coffee shop	N	00:03:41.408
36	blood 's probably not his in the front door shot the muscle first	N	00:03:42.864
37	you know what that means smackdown the kid was in a fight the shooter raises his gun and points at alrobson first	Y	00:03:45.238
38	that ended in murder robson reaches for his gun but the shooter fires	N	00:03:47.618
39	did you send a sample of his blood to dna robson goes down	N	00:03:49.097
40	when you find the suspect you 'll nail him with his own body fluid then flynn	Y	00:03:51.335
41	has his family been notified the shooter turns and fires at flynn	Y	00:03:53.835
42	not yet cut to the boy with the ear phones on senses someone approach him from behind	N	00:03:55.516
43	and some poor kid minding his own business grissom rings the door bell	N	00:06:04.598
44	the girls were last yes	N	00:06:08.699
45	four dead crime lab	N	00:06:13.295
46	one is still alive may i come in for a minute	N	00:06:17.936
47	make that five grissom steps inside and looks around	N	00:06:23.306
48	guy died on the way to the hospital he notices the bell near the floorboards	N	00:06:24.882
49	that bell is connected to the doorbell davidphillips assists while dr robbins goes over the bodies with catheirne	N	00:06:55.334
50	the bell sets off vibrations which reverberate on the floorboards so that he knows someone 's at the door it 's been a hell of a night	N	00:06:58.938
51	yes first the deaf kid now a hit	N	00:07:02.578
52	mrs clemonds i 'm here about your son brian it 's going to take a while to process all the bodies	N	00:07:06.676
53	there 's no easy way to say this what do you know about flynn	N	00:07:12.477
54	oh god please no frankieflynn 38 gunshot wounds to the head and the abdomen	N	00:07:16.755
55	brian was killed tonight any bullets recovered	N	00:07:22.377
56	no no no only one out of the head nine-millimeter 357	N	00:07:24.417
57	this is my fault ballistics deals with the pins	N	00:07:26.259
58	no shooter could have saved himself a lot of trouble if he 'd waited a month or two	Y	00:07:30.475
59	no it 's not why	N	00:07:35.516
60	when i was pregnant i had the german measles and the virus took away his hearing invasive colon cancer	N	00:07:40.895
61	it 's my fault on his way out	N	00:07:45.377
62	no mrs clemonds we think he might have been murdered guess he got off easy	N	00:07:48.218
63	murdered hmmm	N	00:07:50.098
64	would you like to talk to a family services counselor catherine turns to the next body	N	00:07:54.934
65	talking is overrated mr grissom i.d	N	00:07:59.075
66	just find out who did this to my boy	N	00:08:03.495
67	please erinmccarty 20	N	00:08:06.473
68	just keeps getting better sara and warrick try to talk with dr gilbert with the use of an interpreter	N	00:08:48.034
69	someone notify the husband neither sara nor warrick have much experience in this area and do n't fare very well	N	00:08:51.176
70	cop said she 's single she lives at home with her mother dr gilbert	N	00:08:52.410
71	how far along was she sara turns around to look at the interpreter who stands behind them	N	00:08:55.014
72	about six weeks we need your help	N	00:08:57.577
73	she knew brianclemonds was murdered	N	00:08:58.731
74	another nine-millimeter just like our casings sara misinterprets the motion and then continues her questioning but she 's again looking at the interpreter	N	00:09:17.975
75	yeah we understand you do n't want a homicide investigation upsetting your students	N	00:09:20.377
76	nine bullets all the same caliber i 'm severely deaf and i can communicate fine	N	00:09:22.418
77	looks like robson never got a shot off i 'd appreciate it if you 'd look at me when you speak to me	N	00:09:24.714
78	i would n't want him as my bodyguard i wear a hearing aid and i can read lips	N	00:09:27.176
79	need help with the measurements i 'm sorry	N	00:09:29.007
80	sure i did n't mean to offend you	N	00:09:30.224
81	captain i got the manager outside we live together we study together we eat together	Y	00:09:32.176
82	okay dr gilbert we 're just following protocol	N	00:09:34.497
83	that 's the guy right there we need to speak with brian 's friends his roommates	Y	00:09:36.537
84	this one we 'll also need access to his records	Y	00:09:37.926
85	yep the crime did n't happen here it happened out there	N	00:09:38.578
86	that 's the one i 'm not accusing anybody of anything	Y	00:09:39.230
87	i 'm detective brass but we 're here now and evidence is time-sensitive	N	00:09:41.175
88	catherinewillows how can you solve a crime without understanding the victim	N	00:09:43.888
89	nickstokes from the crime lab frustrated dr gilbert signs to the interpreter	N	00:09:46.066
90	bradkendall sara turns to look back at halley	Y	00:09:47.729
91	i heard it on the news um she 's kicking us out	Y	00:09:48.707
92	they 're saying it was some kind of a hit warrick and sara both leave the office	N	00:09:50.027
93	where are erin and alice halley looks at dr gilbert and apologizes to her	N	00:09:51.523
94	they did n't make it sara and warrick drive in to the parking lot and park the car	N	00:09:54.938
95	did you call their parents hey	N	00:10:01.154
96	once the coroner makes a positive i.d how 'd it go at the college	N	00:10:03.297
97	their families will be notified they 're not cooperating	N	00:10:05.095
98	shooting occurred around closing time yeah we did n't have a warrant so she kicked us out	N	00:10:07.337
99	is it customary for your employees to close up what did you do	Y	00:10:11.034
100	erin locked up twice a week 10:00 on the nose what did we do	N	00:10:15.055
101	she was training alice moving on at the end of the month we met with the president asked a few questions	N	00:10:19.176
102	i ca n't believe they 're gone she was kind of hostile	Y	00:10:21.698
103	like it 's our fault we can hear brass holds up the lasvegas chronicle with the headline it 's a hit frankieflynn murdered	N	00:12:28.183
104	all right guess who used to sign bradkendall 's paychecks six years ago	Y	00:12:29.516
105	let 's go frankieflynn	N	00:12:30.472
106	dr gilbert hey brad thanks for coming in we just got a few more questions	Y	00:12:39.667
107	i 'm gilgrissom with the crime lab catherine sits down	N	00:12:41.163
108	you kicked my people out of your office the door closes behind him	Y	00:12:42.768
109	well i 'm kicking you out too sure	N	00:12:44.304
110	look your student is dead at the orpheus	N	00:12:50.678
111	do n't you want to know who 's responsible i was a waiter in the coffee shop	Y	00:12:54.816
112	i do he came in all the time	N	00:12:58.196
113	your people ca n't solve this crime sit down	N	00:13:00.058
114	why bradkendall sits down	Y	00:13:00.839
115	cause they do n't understand the victim did you see him outside the coffee shop	Y	00:13:02.357
116	help them understand once in a while	N	00:13:04.696
117	when a deaf person meets a hearing person the hearing person so much as says i 'm normal you 're not he owned the place	N	00:13:08.857
118	is that what you think i 'm saying he was everywhere	N	00:13:13.174
119	a student is dead why do n't you tell us about your ccw permit	Y	00:13:16.994
120	maybe you feel responsible i made cash deposits	Y	00:13:19.217
121	maybe you 're angry i carry a concealed weapon	Y	00:13:22.315
122	but do n't be angry with us what kind	N	00:13:24.479
123	we want to help you glock nine millimeter	N	00:13:27.678
124	if i agree to cooperate you will include me in your investigation we 'll need to see the weapon and any spare ammo	N	00:13:31.499
125	yes i will yeah of course i 'll bring it in	Y	00:13:35.477
126	i welcome your involvement catherine turns the corner and walks into the lab where nick is already there looking through a scope	N	00:13:38.674
127	now may i see brianclemonds file talk to me	N	00:13:40.978
128	please good news bad news	N	00:13:42.653
129	i did nothing wrong catherine looks over at bobbydawson standing inside the lab	N	00:13:46.759
130	brian filed six complaints against his roommate paularrington bobby	N	00:13:50.036
131	paul lost his hearing less than a year ago a tumor striations do n't match	N	00:13:52.708
132	he has n't adjusted bobby points the monitor	N	00:13:54.124
133	he 's angry the gun that killed those five people at the coffee house is n't your store manager s	Y	00:13:55.897
134	and he took it out on brian the good news is all of the nine millimeter bullets fired at the scene from the same gun	N	00:13:57.497
135	assaulted him quick cgi pov camera moves down and inside the barrel of a gun	N	00:13:58.572
136	brian requested a new roommate the gun fires and the bullet exits the barrel	N	00:14:01.567
137	request denied end of cgi pov	N	00:14:03.262
138	there were no other available beds resume to present	N	00:14:05.354
139	i want to speak to paul you 're looking for only one guy	N	00:14:07.817
140	he does n't read lips or sign well what about the breach-face marks on the casings	N	00:14:10.115
141	you do n't need to hear or speak to communicate indeterminate	N	00:14:13.014
142	or commit murder hmm	N	00:14:16.716
143	so you going to tell us how you learned to sign i got a ton of people out interviewing every two-bit stiff that ever had a beef against flynn	N	00:14:24.998
144	no they 're all doing the smart thing keeping their mouth shut	N	00:14:27.435
145	well the president of the college is a real whack job yeah why	N	00:14:30.798
146	sara you see deafness as a pathology you know something i do n't know	N	00:14:33.458
147	for dr gilbert her deafness is not her handicap it 's her way of life not yet	N	00:14:36.635
148	you know i think you might be siding with her brass looks past catherine toward nick	N	00:14:39.697
149	as long as you see this as us versus them you 're going to have problems on this case catherine turns around to look at nick	N	00:14:42.715
150	the roommate 's here smoke and mirrors	N	00:14:45.818
151	this explains what we 're doing shooter was standing here when he shot al	Y	00:14:52.735
152	i need for paul to read it bamm	N	00:14:55.257
153	what was that all about once in the chest	N	00:14:59.954
154	grissom signs this is flynn	N	00:15:03.337
155	do you know what grissom drinks when he goes out at night one miss	N	00:15:04.657
156	he goes out he moves to the next light on the tripod and turns it on so the light hits the cardboard cut out representing flynn	N	00:15:05.225
157	exactly one hit one through and through	N	00:15:06.317
158	who knows anything about that guy the next light goes on and is pointed through the hole in the cardboard cut out	N	00:15:07.409
159	hey check that out catherine moves to the other lights set up	N	00:15:10.758
160	oh i 've read about this machine she turns on the lights pointing them at the witness with the headphones who was killed	N	00:15:12.378
161	very frankenstein ricochet	N	00:15:13.377
162	brain printing through and through	N	00:15:15.179
163	they call it a visual polygraph nick walks around the room looking at the ray of lights	N	00:15:16.658
164	you 've used one of these before catherine walks up close to the cardboard cut out of the witness	N	00:15:18.458
165	yeah back in 97 grissom and i used one to interview this rapist she stops and thinks about it	N	00:15:22.518
166	the guy was mute but his brain waves spoke loud and clear camera cuts to a slow pan around the room at the various cardboard cut outs and lights indicating the shots fired	N	00:15:26.715
167	so you show the suspect slides of the crime scene and if he 's our guy it stops on the laptop monitor of the room layout	N	00:15:30.295
168	then the oscillator will give him away cut to nick and catherine work on the computer laptop	N	00:15:33.636
169	good quick flashback to the night of the shooting the kid with the cd player has his back to the action	N	00:15:50.007
170	he recollects you the camera moves slowly toward him and he turns around	N	00:15:51.224
171	he recollects the college flynn was closest to the door	N	00:16:00.496
172	he recollects brian flynn and alrobson walk into the coffee shop and up to the counter	N	00:16:08.239
173	this is a shot of the crime scene resume to present	N	00:16:13.816
174	no recollection flynn eats it	N	00:16:21.617
175	no recollection of the crime scene or of brian under these conditions robson walks up to the counter and puts both hands flat on top	N	00:16:41.995
176	may we go now end of flashback	N	00:16:45.639
177	if you want to find the killer look outside the school she and nick walk inside	N	00:17:13.615
178	grissom like this	N	00:17:44.958
179	grissom together they work to find the missing bullet	N	00:17:52.200
180	grissom nick checks the bag	N	00:17:53.507
181	sorry the ricochet went out into the store	N	00:17:53.547
182	i was thinking there 's no hole in the door	N	00:17:53.555
183	about what it 's like to be deaf there 's no hole in the door cause the door had to have been open	N	00:17:54.358
184	about what it 's like to hear assuming erin was running for her life the shooter follows her in the back room shoots her twice he would have been shooting toward the parking lot	Y	00:17:55.956
185	sara told me that you spoke in sign and now you 're putting plugs in your ears he shot toward the parking lot first and then toward the front of the store	Y	00:17:59.376
186	i 'm on a case he 'd only shoot toward the front if there 's somebody there	Y	00:18:02.457
187	mm-hmm so who was in the line of fire	N	00:18:03.373
188	is that why you forgot about the conference what if we have it backwards	N	00:18:05.200
189	those the tire treads from the crime scene wrong place wrong time	N	00:18:46.999
190	i photo'ed the victim 's torso and imaged the tread mark scanned it got it running through a tread assistance cd rom the target was erin the pregnant girl and the rest was damage control	N	00:18:51.014
191	any hits nick and catherine walk through the hallway on their way to forensic pathology	N	00:18:54.237
192	not yet you really think erin knew she was pregnant	N	00:18:55.272
193	cd database 11,033 patterns i mean six weeks	N	00:18:57.398
194	could take a while she would have taken a test if she was five seconds late panic city	N	00:18:59.668
195	yeah yeah	N	00:19:01.004
196	what are you doing brass talked to her parents	N	00:19:02.546
197	checking out the dead guy 's clothes there was no guy in her life	N	00:19:04.122
198	whoa if the guy was mr right she would have told her folks	Y	00:19:15.017
199	what are these which means he was mr wrong	Y	00:19:17.075
200	what back for more	N	00:19:24.458
201	they look like lice you still have the pregnant girl	N	00:19:26.736
202	lice stall them	N	00:19:29.038
203	was n't our dead guy clean we want a paternity test	N	00:19:30.475
204	yeah he was at six weeks	N	00:19:32.396
205	lice adhere to hair follicles six weeks with half of someone else 's dna in her body	N	00:19:34.198
206	i did n't find any stray hairs on him nick turns and opens the door for catherine	N	00:19:36.115
207	well he was in a fight right nick walks into the lab toward bobbydawson	N	00:19:38.019
208	maybe his attacker had lice and they crawled off on his sweater and they got comfy and the stray hair blew away 911 page	N	00:19:43.138
209	hey right gun wrong barrel	N	00:19:51.357
210	any luck on the tire treads son of a bitch swapped the gun barrel out	Y	00:19:52.756
211	computer 's still processing but warrick found something pretty interesting check this out	N	00:19:55.056
212	you know anything about lice camera zooms in for a close up to show the dent	N	00:19:57.187
213	yeah could be an incomplete tool mark	N	00:19:58.523
214	they make your head itch maybe the guy dropped his gun	Y	00:20:00.726
215	and after head colds the most common medical problem affecting children either way we still do n't have the barrel	N	00:20:03.622
216	little problem no one talks about huh this is true	N	00:20:05.916
217	hey grissom can i see you a second stat what about bullet batching	N	00:20:08.995
218	stay on the tire treads resume to present	N	00:20:13.395
219	warrick every casing from a given batch of ammo has the same markings	N	00:20:16.634
220	yeah which would link brad 's ammo to the crime even though we ca n't link his gun	Y	00:20:32.684
221	right behind you not as airtight as matching the barrel	N	00:20:37.159
222	a few more numbers and this could have been cake the father	Y	00:20:38.694
223	i am the man i 'm married	Y	00:21:22.437
224	why i do n't fool around	Y	00:21:23.233
225	what did you do would you like us to explain the mechanics of sex in the workplace	Y	00:21:24.029
226	let me guess you 're the manager	Y	00:21:25.548
227	you ran a dna profile on the blood from the dead guy 's knuckles and you got a match erin was the employee	N	00:21:27.607
228	no you had the power	Y	00:21:29.459
229	you ran a dna profile and something very distinctive popped up happens all the time	N	00:21:31.274
230	not quite you got it all wrong	N	00:21:33.138
231	you made it out of bed and you dressed yourself maybe we do we all make mistakes but just to be sure why do n't you give us a sample of your dna and you 'll be onyour way	Y	00:21:35.615
232	what is it greg i do n't believe this	Y	00:21:38.377
233	just put your nose down the scope i 've got a court order	Y	00:21:41.497
234	dots of blue light on a red sea brass puts the piece of paper on the desk	N	00:21:47.134
235	pyoverdin bradkendall looks at it then admits it	Y	00:21:50.335
236	pyoverdin a pigment excreted from pseudomonas aeruginosa which is a bacteria occasionally found in the bloodstream it was a one-time thing	N	00:21:55.778
237	so what does that give us i did n't even know she was pregnant	Y	00:21:59.779
238	your killer has fluorescent blue dots in his blood the door opens and brass walks inside	Y	00:22:01.497
239	so the guy 's a glow-stick catherine and nick talk with bradkendall	Y	00:22:03.048
240	how does that help us track him down they show the pictures on the monitor to brad	Y	00:22:04.265
241	have n't i done enough for one day what am i looking at	Y	00:22:06.456
242	we have a lead i found a partial serial number on the broken taillight this ought to make things more clear	N	00:22:08.017
243	i saw it a bunter tool makes a unique mark	N	00:22:08.810
244	it 's missing six digits quick cgi pov to the etchings on the bottom bullet casing at close up as the tool burns in the mark	N	00:22:10.353
245	it 's useless camera pulls back to show the two r from the bullet casings side-by-side	N	00:22:11.896
246	maybe on its own but the tire tread database kicked out a match end of cgi pov	N	00:22:14.477
247	the tire belongs to a ford explorer resume to present	N	00:22:17.667
248	a p235-75 manufactured specifically for their suvs casings from your gun are on the right	Y	00:22:20.443
249	only one with the same partial serial number is registered in vegas casings collected from the crime scene are on the left	N	00:22:24.297
250	what do you call a guy with blue-dotted blood lice and keys to a ford explorer they 're identical	N	00:22:30.097
251	a suspect quick flashback to that night	N	00:22:34.314
252	a killer bradkendall walks in	Y	00:22:36.594
253	you found the car that ran over brian we got to talk	Y	00:22:45.408
254	yes i 'm tired of talking to you	Y	00:22:46.784
255	the suv 's registered to adamwalkey i 'm tired of listening to you	Y	00:22:49.753
256	he 's 18 years old no prior complaints i will take care of this	Y	00:22:52.057
257	we 're processing it now all you take care of is yourself	Y	00:22:54.399
258	i promised to keep you informed erin think	N	00:22:58.619
259	you kept your word use your head for once	N	00:23:00.018
260	hmm the back door opens and alice neely peeks inside	N	00:23:02.637
261	lice i 'm going to have this baby and you are going to support it	Y	00:23:06.157
262	creepy critters in the driver 's seat erin walks past brad toward the back door	Y	00:23:08.238
263	so that 's why grissom 's late brad takes out his gun and shoot her in the back	Y	00:23:11.073
264	you just do n't like other women in his life alice neely gasps	N	00:23:13.199
265	i 'm going to pretend i did n't hear that brad turns around seeing alice standing there	Y	00:23:14.797
266	affirmative on the head lice he shoots at her and misses	Y	00:23:19.114
267	taillights match the bullet ricochets off the shelf	N	00:23:22.635
268	we have a suspect alice quickly closes the door and heads back into the main shop	N	00:23:25.339
269	i 'm advising adam to invoke his fifth amendment rights but alice saw so you shot her	Y	00:23:27.597
270	no charges have been filed and i have n't asked a question brad fires and shoots alice	Y	00:23:30.258
271	go ahead and ask you thought that erin had locked up but there was a kid drinking coffee	Y	00:23:32.378
272	he wo n't answer brad looks up and sees the customer at the table	Y	00:23:34.334
273	well that 's why i suggested we meet here the door opens and flynn and alrobson walk into the shop	Y	00:23:36.207
274	i do n't need him to talk and then things got out of hand	Y	00:23:37.823
275	i just want his blood alrobson walks up to the counter and sees bradkendall standing there	Y	00:23:40.459
276	well for that you 're going to need a warrant he puts both hands on the counter and looks over the top where he sees alice on the floor	N	00:23:42.496
277	this warrant is for blood he walks around the counter and finishes killing everyone in the shop	Y	00:23:51.274
278	and a scalp search resume to present	N	00:23:54.475
279	it 's a licemeister six weeks pregnant with your child	Y	00:23:56.879
280	we 're going to comb your hair brad looks down	Y	00:24:01.017
281	adamwalkey does n't have lice is that why you brought your gun	Y	00:29:47.298
282	not even lice eggs	N	00:29:48.777
283	maybe he got rid of them since the other night	Y	00:29:51.227
284	delousing agents take time to kick in there would have been evidence of the infestation	N	00:29:54.483
285	hey got good news	N	00:29:56.178
286	walkey 's blood sample	Y	00:29:57.377
287	pseudomonas aeruginosa	N	00:29:59.339
288	fluorescent blue	N	00:30:00.738
289	same as the blood we found on brian 's knuckle	N	00:30:04.199
290	greg start a dna comparison	N	00:30:06.677
291	this gives us enough to hold walkey	Y	00:30:08.515
292	it 's just like dr gilbert said the killer came from out here	N	00:30:11.517
293	dr gilbert can afford her personal bias	N	00:30:14.918
294	we ca n't	N	00:30:17.098
295	and we need a lot more than day-glo bacteria to get a conviction	N	00:30:19.837
296	check this out	N	00:31:18.359
297	this fabric matches the victim 's sweater	N	00:31:27.995
298	that 's the muffler	N	00:31:30.138
299	and this is the back of the car	N	00:31:32.059
300	and the taillight was smashed	N	00:31:33.777
301	there 's no way this car was moving forward when it ran over brianclemonds body	N	00:31:36.796
