	sentence	killer_gold	medion_time
285	well how are we going to get a sample of sampson 's blood so corrosion versus time	Y	00:31:48.314
286	warrant based on the butterscotch dirt that you found on his car may 2000	Y	00:31:50.935
287	oh spur exposure time was exactly 17 months	N	00:31:52.946
288	i like that and we can testify to this	N	00:31:53.802
289	you might want to apologize to the phone book missing persons was right	N	00:31:55.549
290	he was in town catherine and sara are in the observation room watching det sulik begin to question douglassampson	Y	00:33:06.655
291	two feet they both leave the observation room	N	00:33:49.114
292	we have reason to believe the wounds that killed randytraschel were made by one of your bulls the door opens	N	00:33:52.335
293	that 's why we cut the horns to prevent such catherine and sara walk in	N	00:33:56.194
294	we 're looking for horns with points attached you still have those chills mr sampson	Y	00:33:59.734
295	yeah feeling hot achy	N	00:34:01.575
296	we need to see your other bulls back of your throat scratchy	Y	00:34:02.805
297	curly 's the only one i got yeah it is	N	00:34:04.749
298	what do you all want now seroconversion	N	00:34:12.815
299	we 're waiting on you actually usually presents two to six weeks after the exchange of fluids	Y	00:34:14.525
300	mr rattison we have reason to believe you were in town the month that randytraschel was murdered exchange of fluids	Y	00:34:18.194
301	could you tell us what used to be here that temperature is your body working up a resistance to the virus	Y	00:34:22.034
302	my belt buckles me	Y	00:34:23.894
303	somebody stole it last year like i said now come on	Y	00:34:25.814
304	you do get a lot of stuff stolen do n't you you just took my blood a few days ago	Y	00:34:27.815
305	mind if we look around your truck a private lab can run a virus test within a day	Y	00:34:31.374
306	sure cdc does n't broadcast that	N	00:34:34.235
307	do n't get any tobacco juice on my shoe we dipped into the budget just for you	Y	00:34:43.704
308	got a tape measure we had that lab do what 's called a phylogenetic analysis of your hiv 's dna and susan s	Y	00:35:02.594
309	eighteen inches he looks down at it	Y	00:35:09.255
310	phenolphthalein as you can see the genes are identical	Y	00:35:11.894
311	positive for blood you did stab her though	Y	00:35:26.414
312	looks like the only thing stolen around here was randytraschel 's life and at that moment	N	00:35:30.094
313	mr rattison want to explain this blood splatters on him	Y	00:35:34.974
314	what you laughing at huh resume to present	N	00:35:47.174
315	you want to come over here and try it non-sexual transmission is extremely difficult but obviously it 's possible	N	00:35:49.775
316	no end of flashback	N	00:35:54.374
317	no resume to present	N	00:35:54.374
318	i did n't mean it douglassampson stares at the womeen	Y	00:35:57.961
319	no he does n't say anything	Y	00:36:03.404
320	wait billy douglassampson says nothing	Y	00:36:09.327
321	wait he 's completely surprised by what they 're saying	Y	00:36:09.981
322	by the way the definition of the word retard is to hinder or to hold someone back i think your life is about to become retarded	Y	00:36:33.494
