	sentence	killer_gold	medion_time
288	sure gil yeah matt could have worn his dad 's sweater when he killed ty	Y	00:32:31.766
289	like i said i 'm more than happy to help you in any way i can but none of the evidence goes to motive	Y	00:32:37.423
290	so when i got your phone call about the scent of our bleach i figured you should to talk to lucy not our problem at the moment	Y	00:32:40.662
291	lucy is our head of housekeeping let 's just stay focused on the sweater	Y	00:32:44.324
292	the guests sometimes complained about the bleach smell after we cleaned the bathrooms a few years ago i started adding cedar chips to the bottles it 's tied to the victim and this scene	N	00:32:50.346
293	makes it smell better we need to tie it to the killer	Y	00:32:54.985
294	lucy who else has access to your bleach hey how tall would you say matthawkins	Y	00:32:57.114
295	just the maids about five feet why	N	00:32:58.849
296	are they all female dad is 6'2	N	00:33:00.404
297	yes what about walter	N	00:33:01.360
298	you park your carts in the hallway when you clean the room so anyone could have swiped a bottle of bleach right mmm 5'10	N	00:33:04.582
299	no what you getting at	N	00:33:07.340
300	we 've had problems with theft towels mainly but now our maids take their carts into the rooms meet me in the garage in half an hour	N	00:33:11.003
301	those your kids catherine turns and leaves	Y	00:33:15.754
302	yeah cu the blue sign for the interview room is lit	N	00:33:17.568
303	two eldest are at unlv catherine is putting red dye on the head of a dummy	N	00:33:19.483
304	and the baby warrick stands in front of the counter watching	N	00:33:21.285
305	jake he 's wearing goggles and a clean sweater	N	00:33:22.881
306	jake is uh six months old okay warrick you are approximately the height of martinhawkins	N	00:33:24.478
307	is that your second wife nick you and the homeless dude are about the same and judy you 're close to matt	Y	00:33:26.106
308	mm-hmm nick and judy are also wearing clean sweaters	N	00:33:27.426
309	so you must have had your vasectomy reversed the table is the same height as ty 's bed forty-three and half inches from the floor to the top of the mattress	Y	00:33:30.103
310	why are we talking about my vasectomy catherine walks around the counter and over to the shelf where the pipes are	Y	00:33:35.264
311	you also have access to the bleach so you wo n't mind if i take a dna sample the pipes are the same diameter as the wounds on ty 's face	Y	00:33:39.081
312	look i want each of you to take a whack at our victim	N	00:33:47.085
313	if word leaks out that you took my dna and i 'm a murder suspect i will never work in hospitality again i 'm sorry the answer 's no she hands a pipe to each person	Y	00:33:53.481
314	anything else just like chuckie cheese	N	00:33:57.506
315	we 'll be in touch whack-a-mole	N	00:33:58.826
316	mr michaels in my work over the last twenty-five years i 've come to understand the kind of person who 's a rapist-killer uh spatter up	Y	00:34:54.082
317	is that an accusation warrick steps up to the counter first	N	00:34:58.666
318	well a woman was murdered in your client 's hotel he uses both hands to grip the pipe and hits the dummy on the counter	Y	00:35:00.681
319	he has a right to hear our theory with every whack the red dye spatters on his white sweater	Y	00:35:03.503
320	the killer is clearly a psychopath quick virtual pov of martinhawkins holds the pipe and whacks tyhawkins as he sleeps	Y	00:35:06.296
321	he 's killed more than once quick flash to [_bedroom_-_night_] martinhawkins whacks tyhawkins as he sleeps	Y	00:35:08.554
322	i 'm sure that before his first rape and murder he fantasized about it for years end of flash	Y	00:35:12.105
323	no cut to nick whacks the dummy on the counter	N	00:35:14.439
324	no with every one-handed whack the red dye spatters on his white sweater	N	00:35:14.439
325	woman no quick virtual pov of walter holds the pipe and whacks tyhawkins as he sleeps	N	00:35:14.541
326	woman get away quick flash to [_bedroom_-_night_] walter whacks tyhawkins as he sleeps	N	00:35:17.127
327	quiet cut to judytremont whacks the dummy on the counter	N	00:35:20.165
328	quiet with every two-handed whack the red dye spatters on her white sweater	N	00:35:20.165
329	quiet quick virtual pov of matthewhawkins holds the pipe and whacks tyhawkins as he sleeps	Y	00:35:20.165
330	no end of flash	N	00:35:21.697
331	during that time he engaged in behavioral tryouts catherine steps over to nick 's sweater	Y	00:35:24.043
332	stalking women and attempting to coerce them sexually each time moving closer and closer to the actual event the spatters cover half of the sweater up to his elbows	N	00:35:29.922
333	shut up it 's a match to the original blue sweater	N	00:35:34.995
334	shut up quick flashback to [_bedroom_-_night_] tyhawkins is sleeping in bed	N	00:35:34.995
335	killer shhh- matthew steps into the room and bashes his head in with a pipe	Y	00:35:42.824
336	i believe that after you consummated your first attack you felt excitement greater than you anticipated end of flashback	Y	00:35:47.409
337	your only regret was that she died too quickly resume to present	Y	00:35:49.847
338	but you took solace in the knowledge that uh you could do it again in fact your subsequent victim had similar characteristics to your first victim you want a medal for figuring out what i already said	Y	00:36:01.641
339	no you never told me why	Y	00:36:08.544
340	no why 's it matter anyways	N	00:36:08.544
341	no yvonnehawkins turns and cries	N	00:36:08.544
342	shut up martin holds her	N	00:36:10.449
343	killer shut up he looks at warrick	Y	00:36:10.978
344	please go ahead	N	00:36:12.485
345	please martin leaves the room	N	00:36:12.485
346	this is a waste of time damn it	N	00:36:19.935
347	you see what differentiates a psychopath from a heat of the moment killer is forethought ty looked up to you	Y	00:36:23.473
348	and you thought about this for a long time matthew stands up and screams	Y	00:36:33.826
349	thank you for the fascinating seminar but you have no evidence so we are free to go shut up	Y	00:36:37.466
350	actually i have some evidence dad	N	00:36:40.846
351	what is this i 'm sorry	Y	00:36:43.775
352	what 's going on i	Y	00:36:45.151
353	mr michaels martin turns and looks back at the mirror where he knows yvonne is	Y	00:36:48.903
354	she ca n't you ca n't do that close-up matthewhawkins hands are handcuffed behind his back	Y	00:36:52.063
355	do what as he passes them he tries to go to his mom but the officers stop him	Y	00:36:53.725
356	no i know my rights oh matthew	Y	00:36:54.145
357	hey shh the officers lead matthew away	Y	00:36:54.901
358	the bitch broke into my car martin leads yvonne away	Y	00:36:56.965
359	i do n't remember seeing a warrant ms sidle from behind him det cavaliere turns the corner	N	00:37:01.766
360	i do n't have a warrant he sees nick and heads over to him	N	00:37:03.975
361	i was following a hunch hey	N	00:37:05.351
362	well then you just set my client free det cavaliere looks at him expectantly	Y	00:37:07.786
363	on the contrary nick nods a little	N	00:37:09.265
364	western airlines issues this exact type of wheelie to all its flight attendants i 'm sorry	N	00:37:12.203
365	since martha 's wheelie was n't in the hotel room we thought maybe the killer took it as a souvenir nick turns away	Y	00:37:17.724
366	this particular suit case that you feel that way	N	00:37:22.686
367	is not martha 's wheelie	N	00:37:28.903
368	and now that we know where to find it and we have your client on tape i bet you we 'll get a warrant	Y	00:37:35.984
369	thank you	Y	00:37:42.726
